match,start_time,market_name,home_team,home_win,away_team,away_win,margin,agency
Carlton v Geelong Cats,2023-06-21T19:40:00Z,Head To Head,Carlton,1.58,Geelong Cats,2.4,1.05,Bet365
Port Adelaide Power v Brisbane Lions,2023-06-22T13:45:00Z,Head To Head,Port Adelaide Power,2.05,Brisbane Lions,1.78,1.05,Bet365
GWS Giants v Sydney Swans,2023-06-22T16:35:00Z,Head To Head,GWS Giants,2.6,Sydney Swans,1.5,1.051,Bet365
Melbourne Demons v North Melbourne Kangaroos,2023-06-22T19:30:00Z,Head To Head,Melbourne Demons,1.15,North Melbourne Kangaroos,5.5,1.051,Bet365
Essendon Bombers v West Coast Eagles,2023-06-23T13:00:00Z,Head To Head,Essendon Bombers,1.14,West Coast Eagles,5.75,1.051,Bet365
Fremantle Dockers v Gold Coast Suns,2023-06-23T16:00:00Z,Head To Head,Fremantle Dockers,1.42,Gold Coast Suns,2.9,1.049,Bet365
