match,start_time,market_name,home_team,home_win,away_team,away_win,margin,agency
Essendon Bombers v Adelaide Crows,2023-07-19T19:40:00Z,Head To Head,Essendon Bombers,1.54,Adelaide Crows,2.5,1.049,Bet365
GWS Giants v Gold Coast Suns,2023-07-20T13:45:00Z,Head To Head,GWS Giants,1.38,Gold Coast Suns,3.1,1.047,Bet365
St Kilda Saints v West Coast Eagles,2023-07-20T13:45:00Z,Head To Head,St Kilda Saints,1.2,West Coast Eagles,4.6,1.051,Bet365
Hawthorn Hawks v Collingwood Magpies,2023-07-20T16:35:00Z,Head To Head,Hawthorn Hawks,1.87,Collingwood Magpies,1.95,1.048,Bet365
Geelong Cats v Western Bulldogs,2023-07-20T19:30:00Z,Head To Head,Geelong Cats,1.38,Western Bulldogs,3.1,1.047,Bet365
Port Adelaide Power v Richmond Tigers,2023-07-20T19:30:00Z,Head To Head,Port Adelaide Power,1.09,Richmond Tigers,7.5,1.051,Bet365
Brisbane Lions v Sydney Swans,2023-07-21T13:10:00Z,Head To Head,Brisbane Lions,1.82,Sydney Swans,2,1.049,Bet365
Fremantle Dockers v Melbourne Demons,2023-07-21T15:20:00Z,Head To Head,Fremantle Dockers,1.44,Melbourne Demons,2.8,1.052,Bet365
Carlton v North Melbourne Kangaroos,2023-07-21T16:40:00Z,Head To Head,Carlton,1.14,North Melbourne Kangaroos,5.75,1.051,Bet365
