match,start_time,market_name,home_team,home_win,away_team,away_win,margin,agency
Richmond Tigers v Fremantle Dockers,2023-05-05T13:00:00Z,Head To Head,Richmond Tigers,2.8,Fremantle Dockers,1.44,1.052,Bet365
Western Bulldogs v Hawthorn Hawks,2023-05-05T16:00:00Z,Head To Head,Western Bulldogs,1.27,Hawthorn Hawks,3.85,1.047,Bet365
Brisbane Lions v Gold Coast Suns,2023-05-05T19:10:00Z,Head To Head,Brisbane Lions,1.47,Gold Coast Suns,2.7,1.051,Bet365
Fremantle Dockers v Sydney Swans,2023-05-10T20:20:00Z,Head To Head,Fremantle Dockers,2.15,Sydney Swans,1.72,1.047,Bet365
Hawthorn Hawks v St Kilda Saints,2023-05-11T13:45:00Z,Head To Head,Hawthorn Hawks,2.5,St Kilda Saints,1.54,1.049,Bet365
Gold Coast Suns v North Melbourne Kangaroos,2023-05-11T19:30:00Z,Head To Head,Gold Coast Suns,1.07,North Melbourne Kangaroos,8.5,1.052,Bet365
Richmond Tigers v Western Bulldogs,2023-05-11T19:30:00Z,Head To Head,Richmond Tigers,3.2,Western Bulldogs,1.36,1.048,Bet365
Adelaide Crows v Brisbane Lions,2023-05-12T16:00:00Z,Head To Head,Adelaide Crows,1.68,Brisbane Lions,2.2,1.05,Bet365
