match,market_name,home_team,home_line,home_win,away_team,away_line,away_win,margin,agency
Essendon Bombers v Port Adelaide Power,Line,Essendon Bombers,8.5,1.91,Port Adelaide Power,-8.5,1.91,1.047,Bet365
Carlton v Western Bulldogs,Line,Carlton,2.5,1.91,Western Bulldogs,-2.5,1.91,1.047,Bet365
Melbourne Demons v Gold Coast Suns,Line,Melbourne Demons,1.5,1.89,Gold Coast Suns,-1.5,1.93,1.047,Bet365
St Kilda Saints v Richmond Tigers,Line,St Kilda Saints,-25.5,1.91,Richmond Tigers,25.5,1.91,1.047,Bet365
Brisbane Lions v Geelong Cats,Line,Brisbane Lions,-14.5,1.91,Geelong Cats,14.5,1.91,1.047,Bet365
Hawthorn Hawks v GWS Giants,Line,Hawthorn Hawks,-12.5,1.91,GWS Giants,12.5,1.91,1.047,Bet365
Adelaide Crows v North Melbourne Kangaroos,Line,Adelaide Crows,-38.5,1.91,North Melbourne Kangaroos,38.5,1.91,1.047,Bet365
West Coast Eagles v Fremantle Dockers,Line,West Coast Eagles,22.5,1.91,Fremantle Dockers,-22.5,1.91,1.047,Bet365
