match,market_name,home_team,home_win,away_team,away_win,margin,agency
Melbourne Demons v Collingwood Magpies,Head To Head,Melbourne Demons,3.85,Collingwood Magpies,1.27,1.047,Bet365
St Kilda Saints v Western Bulldogs,Head To Head,St Kilda Saints,3.5,Western Bulldogs,1.31,1.049,Bet365
Hawthorn Hawks v Adelaide Crows,Head To Head,Hawthorn Hawks,1.85,Adelaide Crows,1.97,1.048,Bet365
Brisbane Lions v GWS Giants,Head To Head,Brisbane Lions,1.35,GWS Giants,3.25,1.048,Bet365
Essendon Bombers v Geelong Cats,Head To Head,Essendon Bombers,NA,Geelong Cats,NA,NA,Bet365
North Melbourne Kangaroos v Fremantle Dockers,Head To Head,North Melbourne Kangaroos,5.25,Fremantle Dockers,1.17,1.045,Bet365
Port Adelaide Power v Melbourne Demons,Head To Head,Port Adelaide Power,1.8,Melbourne Demons,2.02,1.051,Bet365
West Coast Eagles v Carlton,Head To Head,West Coast Eagles,NA,Carlton,NA,NA,Bet365
