match,market_name,home_team,home_win,away_team,away_win,margin,agency
Western Bulldogs v Richmond Tigers,Head To Head,Western Bulldogs,NA,Richmond Tigers,NA,NA,Bet365
Port Adelaide Power v Carlton,Head To Head,Port Adelaide Power,1.75,Carlton,2.1,1.048,Bet365
Sydney Swans v Western Bulldogs,Head To Head,Sydney Swans,NA,Western Bulldogs,NA,NA,Bet365
Gold Coast Suns v Melbourne Demons,Head To Head,Gold Coast Suns,1.36,Melbourne Demons,3.2,1.048,Bet365
Hawthorn Hawks v North Melbourne Kangaroos,Head To Head,Hawthorn Hawks,1.2,North Melbourne Kangaroos,4.6,1.051,Bet365
Collingwood Magpies v West Coast Eagles,Head To Head,Collingwood Magpies,1.03,West Coast Eagles,12,1.054,Bet365
Richmond Tigers v Adelaide Crows,Head To Head,Richmond Tigers,NA,Adelaide Crows,NA,NA,Bet365
Fremantle Dockers v St Kilda Saints,Head To Head,Fremantle Dockers,1.28,St Kilda Saints,3.75,1.048,Bet365
