match,start_time,market_name,home_team,home_line,home_win,away_team,away_line,away_win,margin,agency
Brisbane Lions v St Kilda Saints,2023-06-14T19:40:00Z,Line,Brisbane Lions,-27.5,1.91,St Kilda Saints,27.5,1.91,1.047,Bet365
Western Bulldogs v Fremantle Dockers,2023-06-15T13:45:00Z,Line,Western Bulldogs,-5.5,1.91,Fremantle Dockers,5.5,1.91,1.047,Bet365
Richmond Tigers v Hawthorn Hawks,2023-06-15T16:35:00Z,Line,Richmond Tigers,13.5,1.91,Hawthorn Hawks,-13.5,1.91,1.047,Bet365
Adelaide Crows v Sydney Swans,2023-06-15T19:30:00Z,Line,Adelaide Crows,18.5,1.91,Sydney Swans,-18.5,1.91,1.047,Bet365
North Melbourne Kangaroos v Collingwood Magpies,2023-06-16T13:00:00Z,Line,North Melbourne Kangaroos,41.5,1.91,Collingwood Magpies,-41.5,1.91,1.047,Bet365
GWS Giants v Port Adelaide Power,2023-06-16T16:00:00Z,Line,GWS Giants,-7.5,1.91,Port Adelaide Power,7.5,1.91,1.047,Bet365
