match,start_time,market_name,home_team,home_win,away_team,away_win,margin,agency
Melbourne Demons v Brisbane Lions,2023-04-11T19:30:00Z,Head To Head,Melbourne Demons,1.44,Brisbane Lions,2.8,1.052,Bet365
Western Bulldogs v Essendon Bombers,2023-04-12T19:40:00Z,Head To Head,Western Bulldogs,1.5,Essendon Bombers,2.6,1.051,Bet365
GWS Giants v St Kilda Saints,2023-04-13T13:45:00Z,Head To Head,GWS Giants,1.33,St Kilda Saints,3.35,1.05,Bet365
Carlton v Adelaide Crows,2023-04-13T16:35:00Z,Head To Head,Carlton,1.23,Adelaide Crows,4.2,1.051,Bet365
Gold Coast Suns v Hawthorn Hawks,2023-04-13T19:30:00Z,Head To Head,Gold Coast Suns,1.25,Hawthorn Hawks,4,1.05,Bet365
Port Adelaide Power v Fremantle Dockers,2023-04-13T19:30:00Z,Head To Head,Port Adelaide Power,1.35,Fremantle Dockers,3.25,1.048,Bet365
Geelong Cats v North Melbourne Kangaroos,2023-04-14T13:00:00Z,Head To Head,Geelong Cats,1.03,North Melbourne Kangaroos,12,1.054,Bet365
West Coast Eagles v Richmond Tigers,2023-04-14T16:00:00Z,Head To Head,West Coast Eagles,3.2,Richmond Tigers,1.36,1.048,Bet365
