match,market_name,home_team,home_win,away_team,away_win,margin,agency
Adelaide Crows v Geelong Cats,Head To Head,Adelaide Crows,1.65,Geelong Cats,2.25,1.051,Bet365
Collingwood Magpies v Sydney Swans,Head To Head,Collingwood Magpies,1.62,Sydney Swans,2.3,1.052,Bet365
North Melbourne Kangaroos v Gold Coast Suns,Head To Head,North Melbourne Kangaroos,3.85,Gold Coast Suns,1.27,1.047,Bet365
Carlton v West Coast Eagles,Head To Head,Carlton,1.15,West Coast Eagles,5.5,1.051,Bet365
Western Bulldogs v Brisbane Lions,Head To Head,Western Bulldogs,2.55,Brisbane Lions,1.52,1.05,Bet365
Melbourne Demons v Essendon Bombers,Head To Head,Melbourne Demons,1.97,Essendon Bombers,1.85,1.048,Bet365
Richmond Tigers v Fremantle Dockers,Head To Head,Richmond Tigers,6,Fremantle Dockers,1.13,1.052,Bet365
St Kilda Saints v GWS Giants,Head To Head,St Kilda Saints,2.9,GWS Giants,1.42,1.049,Bet365
Port Adelaide Power v Hawthorn Hawks,Head To Head,Port Adelaide Power,3,Hawthorn Hawks,1.4,1.048,Bet365
