match,market_name,home_team,home_line,home_win,away_team,away_line,away_win,margin,agency
Port Adelaide Power v Carlton,Line,Port Adelaide Power,-4.5,1.91,Carlton,4.5,1.91,1.047,Bet365
Sydney Swans v Western Bulldogs,Line,Sydney Swans,9.5,1.91,Western Bulldogs,-9.5,1.91,1.047,Bet365
Gold Coast Suns v Melbourne Demons,Line,Gold Coast Suns,-17.5,1.91,Melbourne Demons,17.5,1.91,1.047,Bet365
Hawthorn Hawks v North Melbourne Kangaroos,Line,Hawthorn Hawks,-31.5,1.91,North Melbourne Kangaroos,31.5,1.91,1.047,Bet365
Collingwood Magpies v West Coast Eagles,Line,Collingwood Magpies,-55.5,1.91,West Coast Eagles,55.5,1.91,1.047,Bet365
Richmond Tigers v Adelaide Crows,Line,Richmond Tigers,34.5,1.91,Adelaide Crows,-34.5,1.91,1.047,Bet365
Fremantle Dockers v St Kilda Saints,Line,Fremantle Dockers,-21.5,1.91,St Kilda Saints,21.5,1.91,1.047,Bet365
