match,home_team,away_team,home_win,home_liquidity,market_name,away_win,away_liquidity,agency
Brisbane Lions v Port Adelaide Power,Brisbane Lions,Port Adelaide Power,1.228,2285.46,Head To Head,4.8,450.28,Betfair
St Kilda Saints v Hawthorn Hawks,St Kilda Saints,Hawthorn Hawks,3.375,2038.11,Head To Head,1.3704999999999998,1659.22,Betfair
Sydney Swans v Fremantle Dockers,Sydney Swans,Fremantle Dockers,1.6175,59.83,Head To Head,2.425,1143.26,Betfair
Adelaide Crows v Melbourne Demons,Adelaide Crows,Melbourne Demons,1.2375,4474.78,Head To Head,4.609999999999999,157.93,Betfair
Gold Coast Suns v Collingwood Magpies,Gold Coast Suns,Collingwood Magpies,1.95,102,Head To Head,1.855,223.25,Betfair
Western Bulldogs v Adelaide Crows,Western Bulldogs,Adelaide Crows,1.57,182.59,Head To Head,2.33,100.06,Betfair
St Kilda Saints v Sydney Swans,St Kilda Saints,Sydney Swans,2.2539999999999996,84.81,Head To Head,1.646,119.88,Betfair
