match,home_team,away_team,home_win,home_liquidity,market_name,away_win,away_liquidity,agency
Hawthorn Hawks v Adelaide Crows,Hawthorn Hawks,Adelaide Crows,1.855,414.78,Head To Head,2.045,146.74,Betfair
Brisbane Lions v GWS Giants,Brisbane Lions,GWS Giants,1.304,110.8,Head To Head,3.755,22.1,Betfair
Essendon Bombers v Geelong Cats,Essendon Bombers,Geelong Cats,6.699999999999999,60.98,Head To Head,1.152,1342.97,Betfair
North Melbourne Kangaroos v Fremantle Dockers,North Melbourne Kangaroos,Fremantle Dockers,6.89,286.45,Head To Head,1.1424999999999998,5806.74,Betfair
Port Adelaide Power v Melbourne Demons,Port Adelaide Power,Melbourne Demons,1.8739999999999999,1922.9,Head To Head,2.0069999999999997,730.08,Betfair
West Coast Eagles v Carlton,West Coast Eagles,Carlton,4.895,154.38,Head To Head,1.228,4121.6,Betfair
Fremantle Dockers v Essendon Bombers,Fremantle Dockers,Essendon Bombers,1.228,433.91,Head To Head,3.8499999999999996,91.76,Betfair
Carlton v North Melbourne Kangaroos,Carlton,North Melbourne Kangaroos,1.2375,819.38,Head To Head,4.42,41.39,Betfair
Collingwood Magpies v St Kilda Saints,Collingwood Magpies,St Kilda Saints,1.1424999999999998,98.34,Head To Head,4.8,44.15,Betfair
