match,home_team,away_team,home_win,home_liquidity,market_name,away_win,away_liquidity,agency
Melbourne Demons v St Kilda Saints,Melbourne Demons,St Kilda Saints,1.513,9044.19,Head To Head,2.7479999999999998,60.01,Betfair
West Coast Eagles v Geelong Cats,West Coast Eagles,Geelong Cats,9.549999999999999,2331.43,Head To Head,1.0950000000000002,44195.97,Betfair
Western Bulldogs v Hawthorn Hawks,Western Bulldogs,Hawthorn Hawks,1.4369999999999998,67.14,Head To Head,2.5389999999999997,46.25,Betfair
Adelaide Crows v Brisbane Lions,Adelaide Crows,Brisbane Lions,1.6745,71.13,Head To Head,2.178,128.13,Betfair
Richmond Tigers v Sydney Swans,Richmond Tigers,Sydney Swans,2.9,114.14,Head To Head,1.399,45.01,Betfair
GWS Giants v Port Adelaide Power,GWS Giants,Port Adelaide Power,1.2850000000000001,308.77,Head To Head,3.375,43.66,Betfair
Carlton v Essendon Bombers,Carlton,Essendon Bombers,1.2850000000000001,368.37,Head To Head,2.824,27.04,Betfair
Melbourne Demons v Collingwood Magpies,Melbourne Demons,Collingwood Magpies,2.9,54.75,Head To Head,1.342,455.09,Betfair
