match,home_team,away_team,home_win,home_liquidity,market_name,away_win,away_liquidity,agency
Melbourne Demons v Collingwood Magpies,Melbourne Demons,Collingwood Magpies,2.235,450.8,Head To Head,1.7125,171.83,Betfair
Geelong Cats v West Coast Eagles,Geelong Cats,West Coast Eagles,1.076,75.47,Head To Head,12.399999999999999,257.8,Betfair
Richmond Tigers v Gold Coast Suns,Richmond Tigers,Gold Coast Suns,2.52,67.81,Head To Head,1.5795,25.35,Betfair
Hawthorn Hawks v North Melbourne Kangaroos,Hawthorn Hawks,North Melbourne Kangaroos,1.0855000000000001,138.98,Head To Head,8.79,135.25,Betfair
Brisbane Lions v Essendon Bombers,Brisbane Lions,Essendon Bombers,1.1424999999999998,174.64,Head To Head,6.51,524.36,Betfair
Sydney Swans v Adelaide Crows,Sydney Swans,Adelaide Crows,1.399,153.04,Head To Head,3.1849999999999996,26.18,Betfair
Western Bulldogs v GWS Giants,Western Bulldogs,GWS Giants,1.494,113.41,Head To Head,2.691,159.35,Betfair
Carlton v St Kilda Saints,Carlton,St Kilda Saints,1.7029999999999998,28.97,Head To Head,2.2539999999999996,104.39,Betfair
Fremantle Dockers v Port Adelaide Power,Fremantle Dockers,Port Adelaide Power,1.8170000000000002,30.4,Head To Head,2.083,212.12,Betfair
