match,home_team,away_team,home_win,home_liquidity,market_name,away_win,away_liquidity,agency
St Kilda Saints v Western Bulldogs,St Kilda Saints,Western Bulldogs,3.6125,43.2,Head To Head,1.3325,131.12,Betfair
Hawthorn Hawks v Adelaide Crows,Hawthorn Hawks,Adelaide Crows,1.8265,124.68,Head To Head,2.0069999999999997,61.92,Betfair
Brisbane Lions v GWS Giants,Brisbane Lions,GWS Giants,1.3515000000000001,173.05,Head To Head,3.4225,59.49,Betfair
Essendon Bombers v Geelong Cats,Essendon Bombers,Geelong Cats,5.369999999999999,63.66,Head To Head,1.1995,58.44,Betfair
North Melbourne Kangaroos v Fremantle Dockers,North Melbourne Kangaroos,Fremantle Dockers,5.9399999999999995,150.6,Head To Head,1.1709999999999998,29.58,Betfair
Port Adelaide Power v Melbourne Demons,Port Adelaide Power,Melbourne Demons,1.7885,92.37,Head To Head,2.083,58.16,Betfair
West Coast Eagles v Carlton,West Coast Eagles,Carlton,4.23,32.82,Head To Head,1.2565,1031.06,Betfair
