match,home_team,away_team,home_win,home_liquidity,market_name,away_win,away_liquidity,agency
Hawthorn Hawks v North Melbourne Kangaroos,Hawthorn Hawks,North Melbourne Kangaroos,1.0475,31554.81,Head To Head,18.099999999999998,59.49,Betfair
Geelong Cats v West Coast Eagles,Geelong Cats,West Coast Eagles,1.0475,9127.79,Head To Head,19.05,59.52,Betfair
Richmond Tigers v Gold Coast Suns,Richmond Tigers,Gold Coast Suns,2.577,426.92,Head To Head,1.5510000000000002,39.68,Betfair
Brisbane Lions v Essendon Bombers,Brisbane Lions,Essendon Bombers,1.152,1197.74,Head To Head,6.51,209.35,Betfair
Sydney Swans v Adelaide Crows,Sydney Swans,Adelaide Crows,1.342,43.38,Head To Head,3.5174999999999996,20.14,Betfair
Western Bulldogs v GWS Giants,Western Bulldogs,GWS Giants,1.513,949.14,Head To Head,2.729,173.47,Betfair
Carlton v St Kilda Saints,Carlton,St Kilda Saints,2.14,511.8,Head To Head,1.779,31.32,Betfair
Fremantle Dockers v Port Adelaide Power,Fremantle Dockers,Port Adelaide Power,1.912,328.21,Head To Head,1.9689999999999999,103.21,Betfair
