match,home_team,away_team,home_win,home_liquidity,market_name,away_win,away_liquidity,agency
Geelong Cats v Brisbane Lions,Geelong Cats,Brisbane Lions,1.3704999999999998,330.55,Head To Head,3.28,96.7,Betfair
Carlton v North Melbourne Kangaroos,Carlton,North Melbourne Kangaroos,1.266,871.88,Head To Head,4.324999999999999,195.34,Betfair
Port Adelaide Power v Sydney Swans,Port Adelaide Power,Sydney Swans,1.7885,43.46,Head To Head,2.083,69.38,Betfair
Collingwood Magpies v St Kilda Saints,Collingwood Magpies,St Kilda Saints,1.19,701.15,Head To Head,5.655,185.53,Betfair
GWS Giants v Gold Coast Suns,GWS Giants,Gold Coast Suns,1.9215,759.76,Head To Head,1.9689999999999999,499.44,Betfair
Western Bulldogs v Richmond Tigers,Western Bulldogs,Richmond Tigers,1.057,21171.58,Head To Head,14.299999999999999,236.12,Betfair
Collingwood Magpies v West Coast Eagles,Collingwood Magpies,West Coast Eagles,1.038,12000,Head To Head,11.45,154.42,Betfair
Richmond Tigers v Adelaide Crows,Richmond Tigers,Adelaide Crows,5.18,24.89,Head To Head,1.1709999999999998,525.71,Betfair
Fremantle Dockers v St Kilda Saints,Fremantle Dockers,St Kilda Saints,1.2850000000000001,358.13,Head To Head,3.375,44.87,Betfair
