match,home_team,away_team,home_win,home_liquidity,market_name,away_win,away_liquidity,agency
Hawthorn Hawks v Adelaide Crows,Hawthorn Hawks,Adelaide Crows,1.855,4864.25,Head To Head,2.045,940.38,Betfair
Brisbane Lions v GWS Giants,Brisbane Lions,GWS Giants,1.2850000000000001,503.73,Head To Head,4.135,33.58,Betfair
Essendon Bombers v Geelong Cats,Essendon Bombers,Geelong Cats,6.89,33.58,Head To Head,1.1424999999999998,9483.91,Betfair
North Melbourne Kangaroos v Fremantle Dockers,North Melbourne Kangaroos,Fremantle Dockers,6.89,62.38,Head To Head,1.152,35.05,Betfair
Port Adelaide Power v Melbourne Demons,Port Adelaide Power,Melbourne Demons,1.8739999999999999,1631.87,Head To Head,2.0069999999999997,779.35,Betfair
West Coast Eagles v Carlton,West Coast Eagles,Carlton,4.895,142.29,Head To Head,1.228,1429.53,Betfair
Fremantle Dockers v Essendon Bombers,Fremantle Dockers,Essendon Bombers,1.228,433.72,Head To Head,3.8499999999999996,91.72,Betfair
Carlton v North Melbourne Kangaroos,Carlton,North Melbourne Kangaroos,1.2375,763.08,Head To Head,4.515000000000001,46.26,Betfair
Collingwood Magpies v St Kilda Saints,Collingwood Magpies,St Kilda Saints,1.1424999999999998,98.3,Head To Head,4.8,44.14,Betfair
