match,home_team,away_team,home_win,home_liquidity,market_name,away_win,away_liquidity,agency
Fremantle Dockers v Essendon Bombers,Fremantle Dockers,Essendon Bombers,1.152,1558.88,Head To Head,6.699999999999999,60.28,Betfair
Geelong Cats v Brisbane Lions,Geelong Cats,Brisbane Lions,1.4465,169.46,Head To Head,2.995,96.92,Betfair
Carlton v North Melbourne Kangaroos,Carlton,North Melbourne Kangaroos,1.2469999999999999,474.16,Head To Head,3.8499999999999996,52,Betfair
Port Adelaide Power v Sydney Swans,Port Adelaide Power,Sydney Swans,1.6935,204.41,Head To Head,2.2539999999999996,26.99,Betfair
Collingwood Magpies v St Kilda Saints,Collingwood Magpies,St Kilda Saints,1.1804999999999999,52,Head To Head,5.75,191.34,Betfair
GWS Giants v Gold Coast Suns,GWS Giants,Gold Coast Suns,1.9215,30.26,Head To Head,1.9405000000000001,42.48,Betfair
Western Bulldogs v Richmond Tigers,Western Bulldogs,Richmond Tigers,1.0665,10521.69,Head To Head,13.825,69.9,Betfair
