match,home_team,away_team,home_win,home_liquidity,market_name,away_win,away_liquidity,agency
Melbourne Demons v St Kilda Saints,Melbourne Demons,St Kilda Saints,2.463,395.84,Head To Head,1.5415,5000,Betfair
West Coast Eagles v Geelong Cats,West Coast Eagles,Geelong Cats,10.025,58.34,Head To Head,1.0950000000000002,39464.64,Betfair
Western Bulldogs v Hawthorn Hawks,Western Bulldogs,Hawthorn Hawks,1.4369999999999998,67.16,Head To Head,2.5389999999999997,46.26,Betfair
Adelaide Crows v Brisbane Lions,Adelaide Crows,Brisbane Lions,1.6745,71.15,Head To Head,2.178,128.16,Betfair
Richmond Tigers v Sydney Swans,Richmond Tigers,Sydney Swans,2.9,124.83,Head To Head,1.38,49.81,Betfair
GWS Giants v Port Adelaide Power,GWS Giants,Port Adelaide Power,1.2850000000000001,308.86,Head To Head,3.375,43.67,Betfair
Carlton v Essendon Bombers,Carlton,Essendon Bombers,1.3135000000000001,69.18,Head To Head,2.824,27.05,Betfair
Melbourne Demons v Collingwood Magpies,Melbourne Demons,Collingwood Magpies,2.9475,32.89,Head To Head,1.38,223,Betfair
