match,home_team,away_team,home_win,home_liquidity,market_name,away_win,away_liquidity,agency
Hawthorn Hawks v North Melbourne Kangaroos,Hawthorn Hawks,North Melbourne Kangaroos,1.057,27242.59,Head To Head,14.774999999999999,105.08,Betfair
Geelong Cats v West Coast Eagles,Geelong Cats,West Coast Eagles,1.0475,3874.83,Head To Head,18.099999999999998,65.22,Betfair
Richmond Tigers v Gold Coast Suns,Richmond Tigers,Gold Coast Suns,2.5389999999999997,349.42,Head To Head,1.5605,90.64,Betfair
Brisbane Lions v Essendon Bombers,Brisbane Lions,Essendon Bombers,1.1424999999999998,3950.53,Head To Head,6.89,132.63,Betfair
Sydney Swans v Adelaide Crows,Sydney Swans,Adelaide Crows,1.3704999999999998,177.46,Head To Head,3.4225,132.73,Betfair
Western Bulldogs v GWS Giants,Western Bulldogs,GWS Giants,1.513,675.71,Head To Head,2.729,178.99,Betfair
Carlton v St Kilda Saints,Carlton,St Kilda Saints,2.14,349.77,Head To Head,1.779,91.25,Betfair
Fremantle Dockers v Port Adelaide Power,Fremantle Dockers,Port Adelaide Power,1.8929999999999998,34.8,Head To Head,1.95,35.75,Betfair
