match,home_team,away_team,home_win,home_liquidity,market_name,away_win,away_liquidity,agency
Sydney Swans v Western Bulldogs,Sydney Swans,Western Bulldogs,2.444,585.35,Head To Head,1.6079999999999999,876.07,Betfair
Gold Coast Suns v Melbourne Demons,Gold Coast Suns,Melbourne Demons,1.3515000000000001,1496.45,Head To Head,3.5174999999999996,136.9,Betfair
Hawthorn Hawks v North Melbourne Kangaroos,Hawthorn Hawks,North Melbourne Kangaroos,1.1424999999999998,9246.64,Head To Head,6.89,350.81,Betfair
Collingwood Magpies v West Coast Eagles,Collingwood Magpies,West Coast Eagles,1.0190000000000001,29703.67,Head To Head,32.349999999999994,773.7,Betfair
Richmond Tigers v Adelaide Crows,Richmond Tigers,Adelaide Crows,7.6499999999999995,290.76,Head To Head,1.1235,5067.33,Betfair
Fremantle Dockers v St Kilda Saints,Fremantle Dockers,St Kilda Saints,1.2850000000000001,1212.08,Head To Head,4.135,247.3,Betfair
North Melbourne Kangaroos v Western Bulldogs,North Melbourne Kangaroos,Western Bulldogs,4.42,35.49,Head To Head,1.152,438.33,Betfair
Carlton v Collingwood Magpies,Carlton,Collingwood Magpies,3.4225,82.09,Head To Head,1.2375,92.25,Betfair
Adelaide Crows v Melbourne Demons,Adelaide Crows,Melbourne Demons,1.2850000000000001,370.47,Head To Head,3.8499999999999996,37.34,Betfair
