match,home_team,away_team,home_win,home_liquidity,market_name,away_win,away_liquidity,agency
Melbourne Demons v Collingwood Magpies,Melbourne Demons,Collingwood Magpies,4.04,9211.02,Head To Head,1.2850000000000001,15881.06,Betfair
St Kilda Saints v Western Bulldogs,St Kilda Saints,Western Bulldogs,3.375,41.58,Head To Head,1.323,31.39,Betfair
Hawthorn Hawks v Adelaide Crows,Hawthorn Hawks,Adelaide Crows,1.8739999999999999,195.52,Head To Head,1.988,24.98,Betfair
Brisbane Lions v GWS Giants,Brisbane Lions,GWS Giants,1.3609999999999998,292.74,Head To Head,3.375,389.47,Betfair
Essendon Bombers v Geelong Cats,Essendon Bombers,Geelong Cats,4.135,56.2,Head To Head,1.2185,98.45,Betfair
North Melbourne Kangaroos v Fremantle Dockers,North Melbourne Kangaroos,Fremantle Dockers,5.56,101.94,Head To Head,1.1615,1491.88,Betfair
Port Adelaide Power v Melbourne Demons,Port Adelaide Power,Melbourne Demons,1.779,136.41,Head To Head,1.9689999999999999,263.96,Betfair
West Coast Eagles v Carlton,West Coast Eagles,Carlton,3.8499999999999996,23.24,Head To Head,1.2565,38,Betfair
