match,home_team,away_team,home_win,home_liquidity,market_name,away_win,away_liquidity,agency
Brisbane Lions v Essendon Bombers,Brisbane Lions,Essendon Bombers,1.133,4833.8,Head To Head,7.27,665.36,Betfair
Sydney Swans v Adelaide Crows,Sydney Swans,Adelaide Crows,1.3135000000000001,146.15,Head To Head,3.755,670.15,Betfair
Western Bulldogs v GWS Giants,Western Bulldogs,GWS Giants,1.532,74.35,Head To Head,2.6719999999999997,607.77,Betfair
Carlton v St Kilda Saints,Carlton,St Kilda Saints,2.064,665.94,Head To Head,1.8265,60.82,Betfair
Fremantle Dockers v Port Adelaide Power,Fremantle Dockers,Port Adelaide Power,1.8929999999999998,87.38,Head To Head,1.9689999999999999,386.03,Betfair
