match,home_team,away_team,home_win,home_liquidity,market_name,away_win,away_liquidity,agency
St Kilda Saints v Western Bulldogs,St Kilda Saints,Western Bulldogs,3.9449999999999994,1985.34,Head To Head,1.304,9174.92,Betfair
Hawthorn Hawks v Adelaide Crows,Hawthorn Hawks,Adelaide Crows,1.9024999999999999,760.46,Head To Head,1.988,378.65,Betfair
Brisbane Lions v GWS Giants,Brisbane Lions,GWS Giants,1.3515000000000001,610.82,Head To Head,3.565,412,Betfair
Essendon Bombers v Geelong Cats,Essendon Bombers,Geelong Cats,5.655,75.36,Head To Head,1.19,5235.33,Betfair
North Melbourne Kangaroos v Fremantle Dockers,North Melbourne Kangaroos,Fremantle Dockers,6.13,502.67,Head To Head,1.1615,2399.68,Betfair
Port Adelaide Power v Melbourne Demons,Port Adelaide Power,Melbourne Demons,1.8075,78.52,Head To Head,2.083,155.19,Betfair
West Coast Eagles v Carlton,West Coast Eagles,Carlton,4.609999999999999,187,Head To Head,1.2469999999999999,2170.76,Betfair
Fremantle Dockers v Essendon Bombers,Fremantle Dockers,Essendon Bombers,1.228,431.76,Head To Head,3.8499999999999996,27.59,Betfair
Carlton v North Melbourne Kangaroos,Carlton,North Melbourne Kangaroos,1.19,545.14,Head To Head,4.42,31.62,Betfair
