match,home_team,away_team,home_win,home_liquidity,market_name,away_win,away_liquidity,agency
Sydney Swans v Western Bulldogs,Sydney Swans,Western Bulldogs,2.463,61.87,Head To Head,1.6079999999999999,1527.86,Betfair
Gold Coast Suns v Melbourne Demons,Gold Coast Suns,Melbourne Demons,1.3609999999999998,26.09,Head To Head,3.4225,84.7,Betfair
Hawthorn Hawks v North Melbourne Kangaroos,Hawthorn Hawks,North Melbourne Kangaroos,1.152,3839.11,Head To Head,6.699999999999999,227.82,Betfair
Collingwood Magpies v West Coast Eagles,Collingwood Magpies,West Coast Eagles,1.0285,29794.19,Head To Head,28.549999999999997,121.31,Betfair
Richmond Tigers v Adelaide Crows,Richmond Tigers,Adelaide Crows,7.6499999999999995,78.31,Head To Head,1.1235,1251.22,Betfair
Fremantle Dockers v St Kilda Saints,Fremantle Dockers,St Kilda Saints,1.2850000000000001,443.74,Head To Head,4.135,74.51,Betfair
North Melbourne Kangaroos v Western Bulldogs,North Melbourne Kangaroos,Western Bulldogs,4.42,35.47,Head To Head,1.152,438.1,Betfair
Carlton v Collingwood Magpies,Carlton,Collingwood Magpies,3.4225,82.05,Head To Head,1.2375,92.2,Betfair
Adelaide Crows v Melbourne Demons,Adelaide Crows,Melbourne Demons,1.2850000000000001,370.28,Head To Head,3.8499999999999996,37.32,Betfair
