match,home_team,away_team,home_win,home_liquidity,market_name,away_win,away_liquidity,agency
Carlton v Collingwood Magpies,Carlton,Collingwood Magpies,5.085,520.13,Head To Head,1.209,1802.14,Betfair
West Coast Eagles v GWS Giants,West Coast Eagles,GWS Giants,3.755,533.99,Head To Head,1.3135000000000001,3954.11,Betfair
Essendon Bombers v Gold Coast Suns,Essendon Bombers,Gold Coast Suns,3.8025,98.34,Head To Head,1.304,1312.13,Betfair
Geelong Cats v Richmond Tigers,Geelong Cats,Richmond Tigers,1.0285,114695.04,Head To Head,24.75,385.2,Betfair
Brisbane Lions v Port Adelaide Power,Brisbane Lions,Port Adelaide Power,1.2469999999999999,48.39,Head To Head,4.515000000000001,3525.67,Betfair
St Kilda Saints v Hawthorn Hawks,St Kilda Saints,Hawthorn Hawks,3.2325,73.14,Head To Head,1.3609999999999998,92.49,Betfair
Sydney Swans v Fremantle Dockers,Sydney Swans,Fremantle Dockers,1.5985,735.27,Head To Head,2.444,78.72,Betfair
Adelaide Crows v Melbourne Demons,Adelaide Crows,Melbourne Demons,1.2469999999999999,554.67,Head To Head,4.515000000000001,26.93,Betfair
