match,home_team,away_team,home_win,home_liquidity,market_name,away_win,away_liquidity,agency
Port Adelaide Power v Sydney Swans,Port Adelaide Power,Sydney Swans,1.855,93.98,Head To Head,2.026,1028.67,Betfair
Collingwood Magpies v Carlton,Collingwood Magpies,Carlton,2.349,295.1,Head To Head,1.6555,1882.15,Betfair
GWS Giants v Hawthorn Hawks,GWS Giants,Hawthorn Hawks,1.912,23.74,Head To Head,1.9689999999999999,49.11,Betfair
Essendon Bombers v Fremantle Dockers,Essendon Bombers,Fremantle Dockers,2.197,1008.76,Head To Head,1.741,834.32,Betfair
St Kilda Saints v Brisbane Lions,St Kilda Saints,Brisbane Lions,2.4059999999999997,55.67,Head To Head,1.6269999999999998,564.57,Betfair
