match,home_team,away_team,home_win,home_liquidity,market_name,away_win,away_liquidity,agency
Western Bulldogs v Melbourne Demons,Western Bulldogs,Melbourne Demons,1.342,906.77,Head To Head,3.565,4522.48,Betfair
West Coast Eagles v Gold Coast Suns,West Coast Eagles,Gold Coast Suns,3.09,3443.36,Head To Head,1.418,58.33,Betfair
North Melbourne Kangaroos v Richmond Tigers,North Melbourne Kangaroos,Richmond Tigers,2.121,914.39,Head To Head,1.7885,128.16,Betfair
Geelong Cats v Adelaide Crows,Geelong Cats,Adelaide Crows,1.399,248.64,Head To Head,3.1849999999999996,621.61,Betfair
Port Adelaide Power v Sydney Swans,Port Adelaide Power,Sydney Swans,1.931,1030.4,Head To Head,1.95,190.22,Betfair
Collingwood Magpies v Carlton,Collingwood Magpies,Carlton,2.444,1073.69,Head To Head,1.6079999999999999,4294.54,Betfair
GWS Giants v Hawthorn Hawks,GWS Giants,Hawthorn Hawks,1.931,85.8,Head To Head,1.8739999999999999,35.75,Betfair
Essendon Bombers v Fremantle Dockers,Essendon Bombers,Fremantle Dockers,2.197,1383.33,Head To Head,1.741,2411.14,Betfair
St Kilda Saints v Brisbane Lions,St Kilda Saints,Brisbane Lions,2.425,787.79,Head To Head,1.6269999999999998,877.74,Betfair
