match,start_time,market_name,home_team,home_win,away_team,away_win,margin,agency
Collingwood Magpies v Carlton,2025-04-03T08:30:00Z,Head To Head,Collingwood Magpies,1.48,Carlton,2.65,1.053,BetRight
Geelong Cats v Melbourne Demons,2025-04-04T08:40:00Z,Head To Head,Geelong Cats,1.22,Melbourne Demons,4.3,1.052,BetRight
Gold Coast Suns v Adelaide Crows,2025-04-05T02:20:00Z,Head To Head,Gold Coast Suns,1.72,Adelaide Crows,2.12,1.053,BetRight
Richmond Tigers v Brisbane Lions,2025-04-05T05:15:00Z,Head To Head,Richmond Tigers,8,Brisbane Lions,1.08,1.051,BetRight
North Melbourne Kangaroos v Sydney Swans,2025-04-05T08:35:00Z,Head To Head,North Melbourne Kangaroos,2.45,Sydney Swans,1.55,1.053,BetRight
GWS Giants v West Coast Eagles,2025-04-06T03:10:00Z,Head To Head,GWS Giants,1.04,West Coast Eagles,11,1.052,BetRight
Port Adelaide Power v St Kilda Saints,2025-04-06T05:20:00Z,Head To Head,Port Adelaide Power,1.53,St Kilda Saints,2.5,1.054,BetRight
Fremantle Dockers v Western Bulldogs,2025-04-06T07:10:00Z,Head To Head,Fremantle Dockers,1.62,Western Bulldogs,2.3,1.052,BetRight
