match,start_time,market_name,home_team,home_win,home_line,away_team,away_win,away_line,margin,agency
St Kilda Saints v Brisbane Lions,2025-04-26T03:20:00Z,Line,St Kilda Saints,1.9,14.5,Brisbane Lions,1.9,-14.5,1.053,BetRight
Port Adelaide Power v North Melbourne Kangaroos,2025-04-26T06:15:00Z,Line,Port Adelaide Power,1.9,-40.5,North Melbourne Kangaroos,1.9,40.5,1.053,BetRight
GWS Giants v Western Bulldogs,2025-04-26T09:35:00Z,Line,GWS Giants,1.9,-9.5,Western Bulldogs,1.9,9.5,1.053,BetRight
Gold Coast Suns v Sydney Swans,2025-04-27T03:10:00Z,Line,Gold Coast Suns,1.9,-14.5,Sydney Swans,1.9,14.5,1.053,BetRight
Carlton v Geelong Cats,2025-04-27T05:20:00Z,Line,Carlton,1.9,8.5,Geelong Cats,1.9,-8.5,1.053,BetRight
Hawthorn Hawks v West Coast Eagles,2025-04-27T06:40:00Z,Line,Hawthorn Hawks,1.9,-55.5,West Coast Eagles,1.9,55.5,1.053,BetRight
