match,start_time,market_name,home_team,home_win,home_line,away_team,away_win,away_line,margin,agency
Adelaide Crows v GWS Giants,2025-04-19T06:15:00Z,Line,Adelaide Crows,1.9,-11.5,GWS Giants,1.9,11.5,1.053,BetRight
Richmond Tigers v Gold Coast Suns,2025-04-19T09:35:00Z,Line,Richmond Tigers,1.9,45.5,Gold Coast Suns,1.9,-45.5,1.053,BetRight
Sydney Swans v Port Adelaide Power,2025-04-20T05:20:00Z,Line,Sydney Swans,1.9,-13.5,Port Adelaide Power,1.9,13.5,1.053,BetRight
Western Bulldogs v St Kilda Saints,2025-04-20T09:20:00Z,Line,Western Bulldogs,1.9,-10.5,St Kilda Saints,1.9,10.5,1.053,BetRight
Geelong Cats v Hawthorn Hawks,2025-04-21T05:20:00Z,Line,Geelong Cats,1.9,-2.5,Hawthorn Hawks,1.9,2.5,1.053,BetRight
