match,start_time,market_name,home_team,home_win,home_line,away_team,away_win,away_line,margin,agency
Adelaide Crows v St Kilda Saints,2024-07-13T09:30:00Z,Line,Adelaide Crows,1.9,-12.5,St Kilda Saints,1.9,12.5,1.053,BetRight
Melbourne Demons v Essendon Bombers,2024-07-13T09:30:00Z,Line,Melbourne Demons,1.9,10.5,Essendon Bombers,1.9,-10.5,1.053,BetRight
Gold Coast Suns v Port Adelaide Power,2024-07-14T03:10:00Z,Line,Gold Coast Suns,1.9,-3.5,Port Adelaide Power,1.9,3.5,1.053,BetRight
Richmond Tigers v GWS Giants,2024-07-14T05:20:00Z,Line,Richmond Tigers,1.9,25.5,GWS Giants,1.9,-25.5,1.053,BetRight
West Coast Eagles v Brisbane Lions,2024-07-14T06:40:00Z,Line,West Coast Eagles,1.9,32.5,Brisbane Lions,1.9,-32.5,1.053,BetRight
