match,market_name,home_team,home_win,away_team,away_win,margin,agency
Melbourne Demons v Brisbane Lions,Head To Head,Melbourne Demons,1.43,Brisbane Lions,2.8,1.056,Betr
Western Bulldogs v Essendon Bombers,Head To Head,Western Bulldogs,1.43,Essendon Bombers,2.8,1.056,Betr
GWS Giants v St Kilda Saints,Head To Head,GWS Giants,1.35,St Kilda Saints,3.2,1.053,Betr
Carlton v Adelaide Crows,Head To Head,Carlton,1.28,Adelaide Crows,3.6,1.059,Betr
Port Adelaide Power v Fremantle Dockers,Head To Head,Port Adelaide Power,1.35,Fremantle Dockers,3.2,1.053,Betr
Gold Coast Suns v Hawthorn Hawks,Head To Head,Gold Coast Suns,1.25,Hawthorn Hawks,4,1.05,Betr
Geelong Cats v North Melbourne Kangaroos,Head To Head,Geelong Cats,1.03,North Melbourne Kangaroos,12,1.054,Betr
West Coast Eagles v Richmond Tigers,Head To Head,West Coast Eagles,3.2,Richmond Tigers,1.35,1.053,Betr
