match,market_name,home_team,home_win,away_team,away_win,margin,agency
Melbourne Demons v Collingwood Magpies,Head To Head,Melbourne Demons,2.22,Collingwood Magpies,1.64,1.06,Betr
Geelong Cats v West Coast Eagles,Head To Head,Geelong Cats,1.05,West Coast Eagles,10,1.052,Betr
Richmond Tigers v Gold Coast Suns,Head To Head,Richmond Tigers,2.55,Gold Coast Suns,1.5,1.059,Betr
Hawthorn Hawks v North Melbourne Kangaroos,Head To Head,Hawthorn Hawks,1.03,North Melbourne Kangaroos,12,1.054,Betr
Brisbane Lions v Essendon Bombers,Head To Head,Brisbane Lions,1.13,Essendon Bombers,5.8,1.057,Betr
Sydney Swans v Adelaide Crows,Head To Head,Sydney Swans,1.32,Adelaide Crows,3.3,1.061,Betr
Western Bulldogs v GWS Giants,Head To Head,Western Bulldogs,1.45,GWS Giants,2.7,1.06,Betr
Carlton v St Kilda Saints,Head To Head,Carlton,1.7,St Kilda Saints,2.12,1.06,Betr
Fremantle Dockers v Port Adelaide Power,Head To Head,Fremantle Dockers,1.81,Port Adelaide Power,1.97,1.06,Betr
