match,start_time,market_name,home_team,home_win,away_team,away_win,margin,agency
Adelaide Crows v St Kilda Saints,2024-07-13T09:30:00Z,Head To Head,Adelaide Crows,1.55,St Kilda Saints,2.45,1.053,BetRight
Melbourne Demons v Essendon Bombers,2024-07-13T09:30:00Z,Head To Head,Melbourne Demons,2.5,Essendon Bombers,1.53,1.054,BetRight
Gold Coast Suns v Port Adelaide Power,2024-07-14T03:10:00Z,Head To Head,Gold Coast Suns,1.74,Port Adelaide Power,2.1,1.051,BetRight
Richmond Tigers v GWS Giants,2024-07-14T05:20:00Z,Head To Head,Richmond Tigers,4.1,GWS Giants,1.24,1.05,BetRight
West Coast Eagles v Brisbane Lions,2024-07-14T06:40:00Z,Head To Head,West Coast Eagles,4.9,Brisbane Lions,1.18,1.052,BetRight
