match,market_name,home_team,home_win,away_team,away_win,margin,agency
Port Adelaide Power v St Kilda Saints,Head To Head,Port Adelaide Power,1.22,St Kilda Saints,4.2,1.058,Betr
North Melbourne Kangaroos v Adelaide Crows,Head To Head,North Melbourne Kangaroos,5,Adelaide Crows,1.17,1.055,Betr
Geelong Cats v Carlton,Head To Head,Geelong Cats,1.7,Carlton,2.15,1.053,Betr
Fremantle Dockers v Western Bulldogs,Head To Head,Fremantle Dockers,1.9,Western Bulldogs,1.9,1.053,Betr
Gold Coast Suns v West Coast Eagles,Head To Head,Gold Coast Suns,1.15,West Coast Eagles,5.5,1.051,Betr
Hawthorn Hawks v Sydney Swans,Head To Head,Hawthorn Hawks,3.3,Sydney Swans,1.33,1.055,Betr
