match,start_time,market_name,home_team,home_win,home_line,away_team,away_win,away_line,margin,agency
Carlton v Melbourne Demons,2024-05-09T09:30:00Z,Line,Carlton,1.9,3.5,Melbourne Demons,1.9,-3.5,1.053,BetRight
Geelong Cats v Port Adelaide Power,2024-05-10T09:10:00Z,Line,Geelong Cats,1.9,-23.5,Port Adelaide Power,1.9,23.5,1.053,BetRight
Fremantle Dockers v Sydney Swans,2024-05-10T10:20:00Z,Line,Fremantle Dockers,1.9,5.5,Sydney Swans,1.9,-5.5,1.053,BetRight
Hawthorn Hawks v St Kilda Saints,2024-05-11T03:45:00Z,Line,Hawthorn Hawks,1.9,8.5,St Kilda Saints,1.9,-8.5,1.053,BetRight
Essendon Bombers v GWS Giants,2024-05-11T06:35:00Z,Line,Essendon Bombers,1.9,7.5,GWS Giants,1.9,-7.5,1.053,BetRight
Gold Coast Suns v North Melbourne Kangaroos,2024-05-11T09:30:00Z,Line,Gold Coast Suns,1.9,-43.5,North Melbourne Kangaroos,1.9,43.5,1.053,BetRight
Richmond Tigers v Western Bulldogs,2024-05-11T09:30:00Z,Line,Richmond Tigers,1.9,18.5,Western Bulldogs,1.9,-18.5,1.053,BetRight
Collingwood Magpies v West Coast Eagles,2024-05-12T03:00:00Z,Line,Collingwood Magpies,1.9,-41.5,West Coast Eagles,1.9,41.5,1.053,BetRight
Adelaide Crows v Brisbane Lions,2024-05-12T06:00:00Z,Line,Adelaide Crows,1.9,-6.5,Brisbane Lions,1.9,6.5,1.053,BetRight
