match,start_time,market_name,home_team,home_win,away_team,away_win,margin,agency
Essendon Bombers v Adelaide Crows,2024-07-19T09:40:00Z,Head To Head,Essendon Bombers,1.53,Adelaide Crows,2.5,1.054,BetRight
GWS Giants v Gold Coast Suns,2024-07-20T03:45:00Z,Head To Head,GWS Giants,1.38,Gold Coast Suns,3.05,1.053,BetRight
St Kilda Saints v West Coast Eagles,2024-07-20T03:45:00Z,Head To Head,St Kilda Saints,1.22,West Coast Eagles,4.3,1.052,BetRight
Hawthorn Hawks v Collingwood Magpies,2024-07-20T06:35:00Z,Head To Head,Hawthorn Hawks,1.9,Collingwood Magpies,1.9,1.053,BetRight
Geelong Cats v Western Bulldogs,2024-07-20T09:30:00Z,Head To Head,Geelong Cats,1.37,Western Bulldogs,3.1,1.053,BetRight
Port Adelaide Power v Richmond Tigers,2024-07-20T09:30:00Z,Head To Head,Port Adelaide Power,1.09,Richmond Tigers,7.5,1.051,BetRight
Brisbane Lions v Sydney Swans,2024-07-21T03:10:00Z,Head To Head,Brisbane Lions,1.8,Sydney Swans,2.02,1.051,BetRight
Fremantle Dockers v Melbourne Demons,2024-07-21T05:20:00Z,Head To Head,Fremantle Dockers,1.48,Melbourne Demons,2.65,1.053,BetRight
Carlton v North Melbourne Kangaroos,2024-07-21T06:40:00Z,Head To Head,Carlton,1.15,North Melbourne Kangaroos,5.5,1.051,BetRight
