match,market_name,home_team,home_win,home_line,away_team,away_win,away_line,margin,agency
Collingwood Magpies v Brisbane Lions,Line,Collingwood Magpies,1.9,10.5,Brisbane Lions,1.9,-10.5,1.053,Betr
St Kilda Saints v Geelong Cats,Line,St Kilda Saints,1.9,9.5,Geelong Cats,1.9,-9.5,1.053,Betr
Port Adelaide Power v Adelaide Crows,Line,Port Adelaide Power,1.9,-13.5,Adelaide Crows,1.9,13.5,1.053,Betr
Western Bulldogs v North Melbourne Kangaroos,Line,Western Bulldogs,1.9,-45.5,North Melbourne Kangaroos,1.9,45.5,1.053,Betr
Hawthorn Hawks v Richmond Tigers,Line,Hawthorn Hawks,1.9,-44.5,Richmond Tigers,1.9,44.5,1.053,Betr
West Coast Eagles v Carlton,Line,West Coast Eagles,1.9,-2.5,Carlton,1.9,2.5,1.053,Betr
