match,start_time,market_name,home_team,home_win,away_team,away_win,margin,agency
Gold Coast Suns v Hawthorn Hawks,2025-05-15T09:30:00Z,Head To Head,Gold Coast Suns,1.55,Hawthorn Hawks,2.45,1.053,BetRight
Sydney Swans v Carlton,2025-05-16T09:40:00Z,Head To Head,Sydney Swans,1.6,Carlton,2.34,1.052,BetRight
Collingwood Magpies v Adelaide Crows,2025-05-17T03:20:00Z,Head To Head,Collingwood Magpies,1.53,Adelaide Crows,2.5,1.054,BetRight
GWS Giants v Fremantle Dockers,2025-05-17T06:15:00Z,Head To Head,GWS Giants,1.37,Fremantle Dockers,3.1,1.053,BetRight
Port Adelaide Power v Geelong Cats,2025-05-17T06:15:00Z,Head To Head,Port Adelaide Power,2.2,Geelong Cats,1.67,1.053,BetRight
Western Bulldogs v Essendon Bombers,2025-05-17T09:35:00Z,Head To Head,Western Bulldogs,1.27,Essendon Bombers,3.8,1.051,BetRight
Richmond Tigers v North Melbourne Kangaroos,2025-05-18T03:10:00Z,Head To Head,Richmond Tigers,2.34,North Melbourne Kangaroos,1.6,1.052,BetRight
Brisbane Lions v Melbourne Demons,2025-05-18T05:20:00Z,Head To Head,Brisbane Lions,1.18,Melbourne Demons,4.9,1.052,BetRight
West Coast Eagles v St Kilda Saints,2025-05-18T06:40:00Z,Head To Head,West Coast Eagles,3.15,St Kilda Saints,1.36,1.053,BetRight
