match,market_name,home_team,home_win,away_team,away_win,margin,agency
St Kilda Saints v Essendon Bombers,Head To Head,St Kilda Saints,1.57,Essendon Bombers,2.36,1.061,Betr
Gold Coast Suns v Brisbane Lions,Head To Head,Gold Coast Suns,1.88,Brisbane Lions,1.89,1.061,Betr
Melbourne Demons v GWS Giants,Head To Head,Melbourne Demons,1.9,GWS Giants,1.9,1.053,Betr
Fremantle Dockers v West Coast Eagles,Head To Head,Fremantle Dockers,1.1,West Coast Eagles,7,1.052,Betr
Collingwood Magpies v Richmond Tigers,Head To Head,Collingwood Magpies,1.27,Richmond Tigers,3.75,1.054,Betr
Sydney Swans v Western Bulldogs,Head To Head,Sydney Swans,1.52,Western Bulldogs,2.55,1.05,Betr
Adelaide Crows v Hawthorn Hawks,Head To Head,Adelaide Crows,2.1,Hawthorn Hawks,1.74,1.051,Betr
