match,market_name,home_team,home_win,home_line,away_team,away_win,away_line,margin,agency
Western Bulldogs v Melbourne Demons,Line,Western Bulldogs,1.9,-22.5,Melbourne Demons,1.9,22.5,1.053,Betr
West Coast Eagles v Gold Coast Suns,Line,West Coast Eagles,1.9,15.5,Gold Coast Suns,1.9,-15.5,1.053,Betr
North Melbourne Kangaroos v Richmond Tigers,Line,North Melbourne Kangaroos,1.8,2.5,Richmond Tigers,2,-2.5,1.056,Betr
Geelong Cats v Adelaide Crows,Line,Geelong Cats,1.9,-18.5,Adelaide Crows,1.9,18.5,1.053,Betr
Port Adelaide Power v Sydney Swans,Line,Port Adelaide Power,2,-2.5,Sydney Swans,1.8,2.5,1.056,Betr
Collingwood Magpies v Carlton,Line,Collingwood Magpies,1.9,11.5,Carlton,1.9,-11.5,1.053,Betr
GWS Giants v Hawthorn Hawks,Line,GWS Giants,1.9,-2.5,Hawthorn Hawks,1.9,2.5,1.053,Betr
Essendon Bombers v Fremantle Dockers,Line,Essendon Bombers,1.9,7.5,Fremantle Dockers,1.9,-7.5,1.053,Betr
St Kilda Saints v Brisbane Lions,Line,St Kilda Saints,1.9,10.5,Brisbane Lions,1.9,-10.5,1.053,Betr
