match,start_time,market_name,home_team,home_win,away_team,away_win,margin,agency
Carlton v Melbourne Demons,2024-05-09T09:30:00Z,Head To Head,Carlton,1.95,Melbourne Demons,1.85,1.053,BetRight
Geelong Cats v Port Adelaide Power,2024-05-10T09:10:00Z,Head To Head,Geelong Cats,1.28,Port Adelaide Power,3.7,1.052,BetRight
Fremantle Dockers v Sydney Swans,2024-05-10T10:20:00Z,Head To Head,Fremantle Dockers,2.15,Sydney Swans,1.7,1.053,BetRight
Hawthorn Hawks v St Kilda Saints,2024-05-11T03:45:00Z,Head To Head,Hawthorn Hawks,2.48,St Kilda Saints,1.54,1.053,BetRight
Essendon Bombers v GWS Giants,2024-05-11T06:35:00Z,Head To Head,Essendon Bombers,2.3,GWS Giants,1.62,1.052,BetRight
Gold Coast Suns v North Melbourne Kangaroos,2024-05-11T09:30:00Z,Head To Head,Gold Coast Suns,1.08,North Melbourne Kangaroos,8,1.051,BetRight
Richmond Tigers v Western Bulldogs,2024-05-11T09:30:00Z,Head To Head,Richmond Tigers,3.2,Western Bulldogs,1.35,1.053,BetRight
Collingwood Magpies v West Coast Eagles,2024-05-12T03:00:00Z,Head To Head,Collingwood Magpies,1.09,West Coast Eagles,7.5,1.051,BetRight
Adelaide Crows v Brisbane Lions,2024-05-12T06:00:00Z,Head To Head,Adelaide Crows,1.65,Brisbane Lions,2.24,1.052,BetRight
