match,start_time,market_name,home_team,home_win,away_team,away_win,margin,agency
Fremantle Dockers v Collingwood Magpies,2024-05-24T10:10:00Z,Head To Head,Fremantle Dockers,1.57,Collingwood Magpies,2.4,1.054,BetRight
Carlton v Gold Coast Suns,2024-05-25T03:45:00Z,Head To Head,Carlton,1.42,Gold Coast Suns,2.88,1.051,BetRight
North Melbourne Kangaroos v Port Adelaide Power,2024-05-25T03:45:00Z,Head To Head,North Melbourne Kangaroos,9.5,Port Adelaide Power,1.06,1.049,BetRight
Geelong Cats v GWS Giants,2024-05-25T06:35:00Z,Head To Head,Geelong Cats,1.51,GWS Giants,2.58,1.05,BetRight
Richmond Tigers v Essendon Bombers,2024-05-25T09:40:00Z,Head To Head,Richmond Tigers,7.5,Essendon Bombers,1.09,1.051,BetRight
Hawthorn Hawks v Brisbane Lions,2024-05-26T03:10:00Z,Head To Head,Hawthorn Hawks,2.88,Brisbane Lions,1.42,1.051,BetRight
Melbourne Demons v St Kilda Saints,2024-05-26T05:20:00Z,Head To Head,Melbourne Demons,1.35,St Kilda Saints,3.2,1.053,BetRight
Adelaide Crows v West Coast Eagles,2024-05-26T06:40:00Z,Head To Head,Adelaide Crows,1.2,West Coast Eagles,4.6,1.051,BetRight
