match,start_time,market_name,home_team,home_win,away_team,away_win,margin,agency
Adelaide Crows v Geelong Cats,2024-03-22T08:40:00Z,Head To Head,Adelaide Crows,1.5,Geelong Cats,2.6,1.051,BetRight
North Melbourne Kangaroos v Fremantle Dockers,2024-03-23T02:45:00Z,Head To Head,North Melbourne Kangaroos,3.1,Fremantle Dockers,1.37,1.053,BetRight
Hawthorn Hawks v Melbourne Demons,2024-03-23T05:35:00Z,Head To Head,Hawthorn Hawks,3.7,Melbourne Demons,1.28,1.052,BetRight
Sydney Swans v Essendon Bombers,2024-03-23T08:30:00Z,Head To Head,Sydney Swans,1.17,Essendon Bombers,5,1.055,BetRight
Western Bulldogs v Gold Coast Suns,2024-03-24T02:00:00Z,Head To Head,Western Bulldogs,1.67,Gold Coast Suns,2.2,1.053,BetRight
Richmond Tigers v Port Adelaide Power,2024-03-24T05:00:00Z,Head To Head,Richmond Tigers,2.65,Port Adelaide Power,1.48,1.053,BetRight
West Coast Eagles v GWS Giants,2024-03-24T07:50:00Z,Head To Head,West Coast Eagles,9.5,GWS Giants,1.06,1.049,BetRight
