match,market_name,home_team,home_win,home_line,away_team,away_win,away_line,margin,agency
Collingwood Magpies v Adelaide Crows,Line,Collingwood Magpies,1.9,-14.5,Adelaide Crows,1.9,14.5,1.053,Betr
GWS Giants v Western Bulldogs,Line,GWS Giants,1.9,-13.5,Western Bulldogs,1.9,13.5,1.053,Betr
Brisbane Lions v Richmond Tigers,Line,Brisbane Lions,1.9,-47.5,Richmond Tigers,1.9,47.5,1.053,Betr
St Kilda Saints v Fremantle Dockers,Line,St Kilda Saints,1.87,-1.5,Fremantle Dockers,1.93,1.5,1.053,Betr
Essendon Bombers v North Melbourne Kangaroos,Line,Essendon Bombers,1.9,-48.5,North Melbourne Kangaroos,1.9,48.5,1.053,Betr
Port Adelaide Power v Hawthorn Hawks,Line,Port Adelaide Power,1.9,-31.5,Hawthorn Hawks,1.9,31.5,1.053,Betr
West Coast Eagles v Melbourne Demons,Line,West Coast Eagles,1.9,30.5,Melbourne Demons,1.9,-30.5,1.053,Betr
