match,market_name,home_team,home_win,away_team,away_win,margin,agency
Sydney Swans v Collingwood Magpies,Head To Head,Sydney Swans,1.43,Collingwood Magpies,2.8,1.056,Betr
North Melbourne Kangaroos v West Coast Eagles,Head To Head,North Melbourne Kangaroos,1.56,West Coast Eagles,2.4,1.058,Betr
Brisbane Lions v GWS Giants,Head To Head,Brisbane Lions,1.28,GWS Giants,3.65,1.055,Betr
Fremantle Dockers v Geelong Cats,Head To Head,Fremantle Dockers,1.52,Geelong Cats,2.48,1.061,Betr
Melbourne Demons v Port Adelaide Power,Head To Head,Melbourne Demons,3,Port Adelaide Power,1.38,1.058,Betr
Essendon Bombers v Gold Coast Suns,Head To Head,Essendon Bombers,1.48,Gold Coast Suns,2.6,1.06,Betr
Carlton v Hawthorn Hawks,Head To Head,Carlton,1.85,Hawthorn Hawks,1.93,1.059,Betr
Richmond Tigers v St Kilda Saints,Head To Head,Richmond Tigers,3.9,St Kilda Saints,1.25,1.056,Betr
Adelaide Crows v Western Bulldogs,Head To Head,Adelaide Crows,2.9,Western Bulldogs,1.4,1.059,Betr
