match,market_name,home_team,home_win,away_team,away_win,margin,agency
Carlton v Geelong Cats,Head To Head,Carlton,1.57,Geelong Cats,2.4,1.054,Betr
Port Adelaide Power v Brisbane Lions,Head To Head,Port Adelaide Power,1.85,Brisbane Lions,1.93,1.059,Betr
GWS Giants v Sydney Swans,Head To Head,GWS Giants,2.6,Sydney Swans,1.48,1.06,Betr
Melbourne Demons v North Melbourne Kangaroos,Head To Head,Melbourne Demons,1.18,North Melbourne Kangaroos,4.7,1.06,Betr
Essendon Bombers v West Coast Eagles,Head To Head,Essendon Bombers,1.17,West Coast Eagles,5,1.055,Betr
Fremantle Dockers v Gold Coast Suns,Head To Head,Fremantle Dockers,1.44,Gold Coast Suns,2.75,1.058,Betr
