match,start_time,market_name,home_team,home_win,away_team,away_win,margin,agency
Adelaide Crows v Melbourne Demons,2024-04-04T08:40:00Z,Head To Head,Adelaide Crows,2.24,Melbourne Demons,1.65,1.052,BetRight
Brisbane Lions v North Melbourne Kangaroos,2024-04-05T06:10:00Z,Head To Head,Brisbane Lions,1.13,North Melbourne Kangaroos,6,1.052,BetRight
Port Adelaide Power v Essendon Bombers,2024-04-05T09:10:00Z,Head To Head,Port Adelaide Power,1.3,Essendon Bombers,3.55,1.051,BetRight
West Coast Eagles v Sydney Swans,2024-04-06T02:30:00Z,Head To Head,West Coast Eagles,11,Sydney Swans,1.04,1.052,BetRight
Fremantle Dockers v Carlton,2024-04-06T05:20:00Z,Head To Head,Fremantle Dockers,2.24,Carlton,1.65,1.052,BetRight
Gold Coast Suns v GWS Giants,2024-04-07T02:30:00Z,Head To Head,Gold Coast Suns,2.95,GWS Giants,1.4,1.053,BetRight
Richmond Tigers v St Kilda Saints,2024-04-07T05:20:00Z,Head To Head,Richmond Tigers,3.7,St Kilda Saints,1.28,1.052,BetRight
