match,market_name,home_team,home_win,away_team,away_win,margin,agency
Carlton v GWS Giants,Head To Head,Carlton,1.12,GWS Giants,6,1.06,Betr
Brisbane Lions v Geelong Cats,Head To Head,Brisbane Lions,1.56,Geelong Cats,2.4,1.058,Betr
West Coast Eagles v Fremantle Dockers,Head To Head,West Coast Eagles,5.5,Fremantle Dockers,1.15,1.051,Betr
Sydney Swans v Gold Coast Suns,Head To Head,Sydney Swans,1.37,Gold Coast Suns,3.1,1.053,Betr
North Melbourne Kangaroos v Hawthorn Hawks,Head To Head,North Melbourne Kangaroos,2.95,Hawthorn Hawks,1.4,1.053,Betr
