match,market_name,home_team,home_win,away_team,away_win,margin,agency
North Melbourne Kangaroos v Port Adelaide Power,Head To Head,North Melbourne Kangaroos,5.4,Port Adelaide Power,1.14,1.062,Betr
Carlton v Gold Coast Suns,Head To Head,Carlton,1.15,Gold Coast Suns,5.2,1.062,Betr
Geelong Cats v GWS Giants,Head To Head,Geelong Cats,1.45,GWS Giants,2.75,1.053,Betr
Richmond Tigers v Essendon Bombers,Head To Head,Richmond Tigers,6.5,Essendon Bombers,1.11,1.055,Betr
Hawthorn Hawks v Brisbane Lions,Head To Head,Hawthorn Hawks,2.75,Brisbane Lions,1.45,1.053,Betr
Melbourne Demons v St Kilda Saints,Head To Head,Melbourne Demons,1.35,St Kilda Saints,3.2,1.053,Betr
Adelaide Crows v West Coast Eagles,Head To Head,Adelaide Crows,1.2,West Coast Eagles,4.5,1.056,Betr
