match,market_name,home_team,home_win,away_team,away_win,margin,agency
Collingwood Magpies v Melbourne Demons,Head To Head,Collingwood Magpies,2.05,Melbourne Demons,1.77,1.053,Betr
Brisbane Lions v St Kilda Saints,Head To Head,Brisbane Lions,1.2,St Kilda Saints,4.5,1.056,Betr
Western Bulldogs v Fremantle Dockers,Head To Head,Western Bulldogs,1.7,Fremantle Dockers,2.12,1.06,Betr
Richmond Tigers v Hawthorn Hawks,Head To Head,Richmond Tigers,2.46,Hawthorn Hawks,1.53,1.06,Betr
Adelaide Crows v Sydney Swans,Head To Head,Adelaide Crows,3.6,Sydney Swans,1.28,1.059,Betr
GWS Giants v Port Adelaide Power,Head To Head,GWS Giants,1.52,Port Adelaide Power,2.48,1.061,Betr
