match,market_name,home_team,home_win,home_line,away_team,away_win,away_line,margin,agency
Gold Coast Suns v Collingwood Magpies,Line,Gold Coast Suns,1.9,1.5,Collingwood Magpies,1.9,-1.5,1.053,Betr
Adelaide Crows v GWS Giants,Line,Adelaide Crows,1.9,2.5,GWS Giants,1.9,-2.5,1.053,Betr
Geelong Cats v Essendon Bombers,Line,Geelong Cats,1.9,4.5,Essendon Bombers,1.9,-4.5,1.053,Betr
St Kilda Saints v Port Adelaide Power,Line,St Kilda Saints,1.9,-3.5,Port Adelaide Power,1.9,3.5,1.053,Betr
Richmond Tigers v Carlton,Line,Richmond Tigers,1.9,41.5,Carlton,1.9,-41.5,1.053,Betr
West Coast Eagles v Hawthorn Hawks,Line,West Coast Eagles,1.9,10.5,Hawthorn Hawks,1.9,-10.5,1.053,Betr
