match,start_time,market_name,home_team,home_win,home_line,away_team,away_win,away_line,margin,agency
Port Adelaide Power v Carlton,2024-05-30T09:30:00Z,Line,Port Adelaide Power,1.9,-6.5,Carlton,1.9,6.5,1.053,BetRight
Hawthorn Hawks v Adelaide Crows,2024-06-01T03:45:00Z,Line,Hawthorn Hawks,1.9,3.5,Adelaide Crows,1.9,-3.5,1.053,BetRight
West Coast Eagles v St Kilda Saints,2024-06-01T06:35:00Z,Line,West Coast Eagles,1.9,-2.5,St Kilda Saints,1.9,2.5,1.053,BetRight
Geelong Cats v Richmond Tigers,2024-06-01T09:30:00Z,Line,Geelong Cats,1.9,-44.5,Richmond Tigers,1.9,44.5,1.053,BetRight
Melbourne Demons v Fremantle Dockers,2024-06-02T03:00:00Z,Line,Melbourne Demons,1.9,-11.5,Fremantle Dockers,1.9,11.5,1.053,BetRight
Gold Coast Suns v Essendon Bombers,2024-06-02T06:00:00Z,Line,Gold Coast Suns,1.9,-5.5,Essendon Bombers,1.9,5.5,1.053,BetRight
