match,start_time,market_name,home_team,home_win,home_line,away_team,away_win,away_line,margin,agency
Brisbane Lions v Collingwood Magpies,2025-04-17T09:30:00Z,Line,Brisbane Lions,1.9,-10.5,Collingwood Magpies,1.9,10.5,1.053,BetRight
North Melbourne Kangaroos v Carlton,2025-04-18T05:20:00Z,Line,North Melbourne Kangaroos,1.9,16.5,Carlton,1.9,-16.5,1.053,BetRight
West Coast Eagles v Essendon Bombers,2025-04-18T08:10:00Z,Line,West Coast Eagles,1.85,26.5,Essendon Bombers,1.95,-26.5,1.053,BetRight
Melbourne Demons v Fremantle Dockers,2025-04-19T03:20:00Z,Line,Melbourne Demons,1.9,17.5,Fremantle Dockers,1.9,-17.5,1.053,BetRight
Adelaide Crows v GWS Giants,2025-04-19T06:15:00Z,Line,Adelaide Crows,1.9,-2.5,GWS Giants,1.9,2.5,1.053,BetRight
Richmond Tigers v Gold Coast Suns,2025-04-19T09:35:00Z,Line,Richmond Tigers,1.9,45.5,Gold Coast Suns,1.9,-45.5,1.053,BetRight
Sydney Swans v Port Adelaide Power,2025-04-20T05:20:00Z,Line,Sydney Swans,1.9,-14.5,Port Adelaide Power,1.9,14.5,1.053,BetRight
Western Bulldogs v St Kilda Saints,2025-04-20T09:20:00Z,Line,Western Bulldogs,1.9,-12.5,St Kilda Saints,1.9,12.5,1.053,BetRight
Geelong Cats v Hawthorn Hawks,2025-04-21T05:20:00Z,Line,Geelong Cats,1.9,-2.5,Hawthorn Hawks,1.9,2.5,1.053,BetRight
