match,market_name,home_team,home_win,home_line,away_team,away_win,away_line,margin,agency
Essendon Bombers v Adelaide Crows,Line,Essendon Bombers,1.9,-14.5,Adelaide Crows,1.9,14.5,1.053,Betr
GWS Giants v Gold Coast Suns,Line,GWS Giants,1.9,-14.5,Gold Coast Suns,1.9,14.5,1.053,Betr
St Kilda Saints v West Coast Eagles,Line,St Kilda Saints,1.9,-32.5,West Coast Eagles,1.9,32.5,1.053,Betr
Hawthorn Hawks v Collingwood Magpies,Line,Hawthorn Hawks,2,-2.5,Collingwood Magpies,1.8,2.5,1.056,Betr
Geelong Cats v Western Bulldogs,Line,Geelong Cats,1.9,-12.5,Western Bulldogs,1.9,12.5,1.053,Betr
Port Adelaide Power v Richmond Tigers,Line,Port Adelaide Power,1.9,-43.5,Richmond Tigers,1.9,43.5,1.053,Betr
Brisbane Lions v Sydney Swans,Line,Brisbane Lions,1.9,-3.5,Sydney Swans,1.9,3.5,1.053,Betr
Fremantle Dockers v Melbourne Demons,Line,Fremantle Dockers,1.9,-16.5,Melbourne Demons,1.9,16.5,1.053,Betr
Carlton v North Melbourne Kangaroos,Line,Carlton,1.9,-38.5,North Melbourne Kangaroos,1.9,38.5,1.053,Betr
