match,start_time,market_name,home_team,home_win,away_team,away_win,margin,agency
Port Adelaide Power v Richmond Tigers,2025-03-22T05:15:00Z,Head To Head,Port Adelaide Power,1.12,Richmond Tigers,6.5,1.047,BetRight
St Kilda Saints v Geelong Cats,2025-03-22T08:35:00Z,Head To Head,St Kilda Saints,3.55,Geelong Cats,1.3,1.051,BetRight
Brisbane Lions v West Coast Eagles,2025-03-23T02:10:00Z,Head To Head,Brisbane Lions,1.02,West Coast Eagles,14,1.052,BetRight
North Melbourne Kangaroos v Melbourne Demons,2025-03-23T04:20:00Z,Head To Head,North Melbourne Kangaroos,3,Melbourne Demons,1.39,1.053,BetRight
Fremantle Dockers v Sydney Swans,2025-03-23T07:10:00Z,Head To Head,Fremantle Dockers,1.65,Sydney Swans,2.24,1.052,BetRight
