match,start_time,market_name,home_team,home_win,away_team,away_win,margin,agency
Brisbane Lions v Collingwood Magpies,2025-04-17T09:30:00Z,Head To Head,Brisbane Lions,1.54,Collingwood Magpies,2.5,1.049,BetRight
North Melbourne Kangaroos v Carlton,2025-04-18T05:20:00Z,Head To Head,North Melbourne Kangaroos,2.95,Carlton,1.4,1.053,BetRight
West Coast Eagles v Essendon Bombers,2025-04-18T08:10:00Z,Head To Head,West Coast Eagles,4.25,Essendon Bombers,1.23,1.048,BetRight
Melbourne Demons v Fremantle Dockers,2025-04-19T03:20:00Z,Head To Head,Melbourne Demons,3.05,Fremantle Dockers,1.38,1.053,BetRight
Adelaide Crows v GWS Giants,2025-04-19T06:15:00Z,Head To Head,Adelaide Crows,1.8,GWS Giants,2.02,1.051,BetRight
Richmond Tigers v Gold Coast Suns,2025-04-19T09:35:00Z,Head To Head,Richmond Tigers,8.5,Gold Coast Suns,1.07,1.052,BetRight
Sydney Swans v Port Adelaide Power,2025-04-20T05:20:00Z,Head To Head,Sydney Swans,1.45,Port Adelaide Power,2.75,1.053,BetRight
Western Bulldogs v St Kilda Saints,2025-04-20T09:20:00Z,Head To Head,Western Bulldogs,1.55,St Kilda Saints,2.45,1.053,BetRight
Geelong Cats v Hawthorn Hawks,2025-04-21T05:20:00Z,Head To Head,Geelong Cats,1.8,Hawthorn Hawks,2.02,1.051,BetRight
