match,start_time,market_name,home_team,home_win,home_line,away_team,away_win,away_line,margin,agency
Melbourne Demons v Collingwood Magpies,2025-06-09T05:20:00Z,Line,Melbourne Demons,1.9,22.5,Collingwood Magpies,1.9,-22.5,1.053,BetRight
St Kilda Saints v Western Bulldogs,2025-06-12T09:30:00Z,Line,St Kilda Saints,1.9,20.5,Western Bulldogs,1.9,-20.5,1.053,BetRight
Hawthorn Hawks v Adelaide Crows,2025-06-13T09:40:00Z,Line,Hawthorn Hawks,1.9,-2.5,Adelaide Crows,1.9,2.5,1.053,BetRight
Brisbane Lions v GWS Giants,2025-06-14T03:20:00Z,Line,Brisbane Lions,1.9,-18.5,GWS Giants,1.9,18.5,1.053,BetRight
Essendon Bombers v Geelong Cats,2025-06-14T06:15:00Z,Line,Essendon Bombers,1.9,27.5,Geelong Cats,1.9,-27.5,1.053,BetRight
North Melbourne Kangaroos v Fremantle Dockers,2025-06-14T09:35:00Z,Line,North Melbourne Kangaroos,1.9,32.5,Fremantle Dockers,1.9,-32.5,1.053,BetRight
West Coast Eagles v Carlton,2025-06-15T08:10:00Z,Line,West Coast Eagles,1.9,25.5,Carlton,1.9,-25.5,1.053,BetRight
