match,start_time,market_name,home_team,home_win,away_team,away_win,margin,agency
Hawthorn Hawks v Adelaide Crows,2025-06-13T09:40:00Z,Head To Head,Hawthorn Hawks,1.82,Adelaide Crows,2,1.049,BetRight
Brisbane Lions v GWS Giants,2025-06-14T03:20:00Z,Head To Head,Brisbane Lions,1.25,GWS Giants,4,1.05,BetRight
Essendon Bombers v Geelong Cats,2025-06-14T06:15:00Z,Head To Head,Essendon Bombers,5.75,Geelong Cats,1.14,1.051,BetRight
North Melbourne Kangaroos v Fremantle Dockers,2025-06-14T09:35:00Z,Head To Head,North Melbourne Kangaroos,5.5,Fremantle Dockers,1.15,1.051,BetRight
Port Adelaide Power v Melbourne Demons,2025-06-15T05:20:00Z,Head To Head,Port Adelaide Power,1.8,Melbourne Demons,2.02,1.051,BetRight
West Coast Eagles v Carlton,2025-06-15T08:10:00Z,Head To Head,West Coast Eagles,4.5,Carlton,1.21,1.049,BetRight
Geelong Cats v Brisbane Lions,2025-06-20T09:40:00Z,Head To Head,Geelong Cats,1.52,Brisbane Lions,2.55,1.05,BetRight
Carlton v North Melbourne Kangaroos,2025-06-21T03:20:00Z,Head To Head,Carlton,1.22,North Melbourne Kangaroos,4.3,1.052,BetRight
