match,start_time,market_name,home_team,home_win,away_team,away_win,margin,agency
Hawthorn Hawks v GWS Giants,2024-06-08T03:45:00Z,Head To Head,Hawthorn Hawks,1.9,GWS Giants,1.9,1.053,BetRight
West Coast Eagles v North Melbourne Kangaroos,2024-06-08T06:35:00Z,Head To Head,West Coast Eagles,1.28,North Melbourne Kangaroos,3.7,1.052,BetRight
St Kilda Saints v Gold Coast Suns,2024-06-08T09:30:00Z,Head To Head,St Kilda Saints,1.85,Gold Coast Suns,1.96,1.051,BetRight
Sydney Swans v Geelong Cats,2024-06-09T05:20:00Z,Head To Head,Sydney Swans,1.3,Geelong Cats,3.55,1.051,BetRight
Essendon Bombers v Carlton,2024-06-09T09:20:00Z,Head To Head,Essendon Bombers,2.5,Carlton,1.53,1.054,BetRight
Collingwood Magpies v Melbourne Demons,2024-06-10T05:20:00Z,Head To Head,Collingwood Magpies,1.8,Melbourne Demons,2,1.056,BetRight
