match,market_name,home_team,home_win,away_team,away_win,margin,agency
Adelaide Crows v Melbourne Demons,Head To Head,Adelaide Crows,2.54,Melbourne Demons,1.52,1.052,Betr
Brisbane Lions v North Melbourne Kangaroos,Head To Head,Brisbane Lions,1.13,North Melbourne Kangaroos,6,1.052,Betr
Port Adelaide Power v Essendon Bombers,Head To Head,Port Adelaide Power,1.27,Essendon Bombers,3.65,1.061,Betr
West Coast Eagles v Sydney Swans,Head To Head,West Coast Eagles,11,Sydney Swans,1.04,1.052,Betr
Fremantle Dockers v Carlton,Head To Head,Fremantle Dockers,2.25,Carlton,1.65,1.051,Betr
Western Bulldogs v Geelong Cats,Head To Head,Western Bulldogs,1.92,Geelong Cats,1.88,1.053,Betr
Gold Coast Suns v GWS Giants,Head To Head,Gold Coast Suns,3.25,GWS Giants,1.36,1.043,Betr
Richmond Tigers v St Kilda Saints,Head To Head,Richmond Tigers,3.3,St Kilda Saints,1.34,1.049,Betr
Collingwood Magpies v Hawthorn Hawks,Head To Head,Collingwood Magpies,1.25,Hawthorn Hawks,3.9,1.056,Betr
