match,start_time,market_name,home_team,home_win,home_line,away_team,away_win,away_line,margin,agency
Geelong Cats v Hawthorn Hawks,2025-04-21T05:20:00Z,Line,Geelong Cats,1.95,-2.5,Hawthorn Hawks,1.95,-2.5,1.026,BetRight
Melbourne Demons v Richmond Tigers,2025-04-24T09:30:00Z,Line,Melbourne Demons,1.9,-24.5,Richmond Tigers,1.9,24.5,1.053,BetRight
Collingwood Magpies v Essendon Bombers,2025-04-25T05:20:00Z,Line,Collingwood Magpies,1.9,-29.5,Essendon Bombers,1.9,29.5,1.053,BetRight
Fremantle Dockers v Adelaide Crows,2025-04-25T10:10:00Z,Line,Fremantle Dockers,1.9,-2.5,Adelaide Crows,1.9,2.5,1.053,BetRight
St Kilda Saints v Brisbane Lions,2025-04-26T03:20:00Z,Line,St Kilda Saints,1.9,14.5,Brisbane Lions,1.9,-14.5,1.053,BetRight
Port Adelaide Power v North Melbourne Kangaroos,2025-04-26T06:15:00Z,Line,Port Adelaide Power,1.9,-35.5,North Melbourne Kangaroos,1.9,35.5,1.053,BetRight
Gold Coast Suns v Sydney Swans,2025-04-27T03:10:00Z,Line,Gold Coast Suns,1.9,-10.5,Sydney Swans,1.9,10.5,1.053,BetRight
