match,start_time,market_name,home_team,home_win,away_team,away_win,margin,agency
Carlton v Hawthorn Hawks,2025-03-20T08:30:00Z,Head To Head,Carlton,2.88,Hawthorn Hawks,1.42,1.051,BetRight
Western Bulldogs v Collingwood Magpies,2025-03-21T08:40:00Z,Head To Head,Western Bulldogs,2.45,Collingwood Magpies,1.55,1.053,BetRight
Essendon Bombers v Adelaide Crows,2025-03-22T02:20:00Z,Head To Head,Essendon Bombers,2.24,Adelaide Crows,1.65,1.052,BetRight
Port Adelaide Power v Richmond Tigers,2025-03-22T05:15:00Z,Head To Head,Port Adelaide Power,1.11,Richmond Tigers,6.75,1.049,BetRight
St Kilda Saints v Geelong Cats,2025-03-22T08:35:00Z,Head To Head,St Kilda Saints,4,Geelong Cats,1.25,1.05,BetRight
Brisbane Lions v West Coast Eagles,2025-03-23T02:10:00Z,Head To Head,Brisbane Lions,1.02,West Coast Eagles,14,1.052,BetRight
North Melbourne Kangaroos v Melbourne Demons,2025-03-23T04:20:00Z,Head To Head,North Melbourne Kangaroos,3.2,Melbourne Demons,1.35,1.053,BetRight
Fremantle Dockers v Sydney Swans,2025-03-23T07:10:00Z,Head To Head,Fremantle Dockers,1.65,Sydney Swans,2.24,1.052,BetRight
