match,start_time,market_name,home_team,home_win,home_line,away_team,away_win,away_line,margin,agency
Melbourne Demons v GWS Giants,2024-07-27T09:30:00Z,Line,Melbourne Demons,1.9,-1.5,GWS Giants,1.9,1.5,1.053,BetRight
Fremantle Dockers v West Coast Eagles,2024-07-27T10:10:00Z,Line,Fremantle Dockers,1.87,-40.5,West Coast Eagles,1.93,40.5,1.053,BetRight
Collingwood Magpies v Richmond Tigers,2024-07-28T03:10:00Z,Line,Collingwood Magpies,1.9,-22.5,Richmond Tigers,1.9,22.5,1.053,BetRight
Sydney Swans v Western Bulldogs,2024-07-28T05:20:00Z,Line,Sydney Swans,1.9,-12.5,Western Bulldogs,1.9,12.5,1.053,BetRight
Adelaide Crows v Hawthorn Hawks,2024-07-28T06:10:00Z,Line,Adelaide Crows,1.9,2.5,Hawthorn Hawks,1.9,-3.5,1.053,BetRight
