match,start_time,market_name,home_team,home_win,home_line,away_team,away_win,away_line,margin,agency
St Kilda Saints v Western Bulldogs,2024-04-18T09:30:00Z,Line,St Kilda Saints,1.9,-3.5,Western Bulldogs,1.9,3.5,1.053,BetRight
Adelaide Crows v Essendon Bombers,2024-04-19T09:40:00Z,Line,Adelaide Crows,1.87,-13.5,Essendon Bombers,1.93,13.5,1.053,BetRight
Collingwood Magpies v Port Adelaide Power,2024-04-20T03:45:00Z,Line,Collingwood Magpies,1.95,-3.5,Port Adelaide Power,1.85,3.5,1.053,BetRight
Carlton v GWS Giants,2024-04-20T06:35:00Z,Line,Carlton,1.9,-3.5,GWS Giants,1.9,3.5,1.053,BetRight
Brisbane Lions v Geelong Cats,2024-04-20T09:30:00Z,Line,Brisbane Lions,1.9,-11.5,Geelong Cats,1.9,11.5,1.053,BetRight
West Coast Eagles v Fremantle Dockers,2024-04-20T10:10:00Z,Line,West Coast Eagles,1.9,33.5,Fremantle Dockers,1.9,-33.5,1.053,BetRight
Sydney Swans v Gold Coast Suns,2024-04-21T03:00:00Z,Line,Sydney Swans,1.9,-19.5,Gold Coast Suns,1.9,19.5,1.053,BetRight
North Melbourne Kangaroos v Hawthorn Hawks,2024-04-21T06:00:00Z,Line,North Melbourne Kangaroos,1.9,16.5,Hawthorn Hawks,1.9,-16.5,1.053,BetRight
