match,market_name,home_team,home_win,away_team,away_win,margin,agency
Western Bulldogs v Sydney Swans,Head To Head,Western Bulldogs,2.4,Sydney Swans,1.57,1.054,Betr
Fremantle Dockers v Collingwood Magpies,Head To Head,Fremantle Dockers,1.7,Collingwood Magpies,2.15,1.053,Betr
North Melbourne Kangaroos v Port Adelaide Power,Head To Head,North Melbourne Kangaroos,8,Port Adelaide Power,1.08,1.051,Betr
Carlton v Gold Coast Suns,Head To Head,Carlton,1.46,Gold Coast Suns,2.72,1.053,Betr
Geelong Cats v GWS Giants,Head To Head,Geelong Cats,1.53,GWS Giants,2.5,1.054,Betr
Richmond Tigers v Essendon Bombers,Head To Head,Richmond Tigers,7,Essendon Bombers,1.09,1.06,Betr
Hawthorn Hawks v Brisbane Lions,Head To Head,Hawthorn Hawks,3,Brisbane Lions,1.38,1.058,Betr
Melbourne Demons v St Kilda Saints,Head To Head,Melbourne Demons,1.35,St Kilda Saints,3.2,1.053,Betr
Adelaide Crows v West Coast Eagles,Head To Head,Adelaide Crows,1.2,West Coast Eagles,4.5,1.056,Betr
