match,start_time,market_name,home_team,home_win,home_line,away_team,away_win,away_line,margin,agency
Brisbane Lions v St Kilda Saints,2024-06-14T09:40:00Z,Line,Brisbane Lions,1.92,-36.5,St Kilda Saints,1.88,36.5,1.053,BetRight
Western Bulldogs v Fremantle Dockers,2024-06-15T03:45:00Z,Line,Western Bulldogs,1.9,-2.5,Fremantle Dockers,1.9,2.5,1.053,BetRight
Richmond Tigers v Hawthorn Hawks,2024-06-15T06:35:00Z,Line,Richmond Tigers,1.9,14.5,Hawthorn Hawks,1.9,-14.5,1.053,BetRight
Adelaide Crows v Sydney Swans,2024-06-15T09:30:00Z,Line,Adelaide Crows,1.9,20.5,Sydney Swans,1.9,-20.5,1.053,BetRight
North Melbourne Kangaroos v Collingwood Magpies,2024-06-16T03:00:00Z,Line,North Melbourne Kangaroos,1.9,41.5,Collingwood Magpies,1.9,-41.5,1.053,BetRight
GWS Giants v Port Adelaide Power,2024-06-16T06:00:00Z,Line,GWS Giants,1.9,-7.5,Port Adelaide Power,1.9,7.5,1.053,BetRight
