match,market_name,home_team,home_win,away_team,away_win,margin,agency
Brisbane Lions v Collingwood Magpies,Head To Head,Brisbane Lions,1.45,Collingwood Magpies,2.75,1.053,Betr
North Melbourne Kangaroos v Carlton,Head To Head,North Melbourne Kangaroos,5.5,Carlton,1.15,1.051,Betr
Fremantle Dockers v Adelaide Crows,Head To Head,Fremantle Dockers,1.51,Adelaide Crows,2.55,1.054,Betr
Essendon Bombers v St Kilda Saints,Head To Head,Essendon Bombers,2.34,St Kilda Saints,1.6,1.052,Betr
Port Adelaide Power v Melbourne Demons,Head To Head,Port Adelaide Power,1.48,Melbourne Demons,2.65,1.053,Betr
Western Bulldogs v West Coast Eagles,Head To Head,Western Bulldogs,1.06,West Coast Eagles,9,1.055,Betr
Richmond Tigers v Sydney Swans,Head To Head,Richmond Tigers,3.45,Sydney Swans,1.31,1.053,Betr
Hawthorn Hawks v Geelong Cats,Head To Head,Hawthorn Hawks,3.1,Geelong Cats,1.36,1.058,Betr
