match,market_name,home_team,home_win,away_team,away_win,margin,agency
Brisbane Lions v St Kilda Saints,Head To Head,Brisbane Lions,1.2,St Kilda Saints,4.5,1.056,Dabble
Western Bulldogs v Fremantle Dockers,Head To Head,Western Bulldogs,1.7,Fremantle Dockers,2.15,1.053,Dabble
Richmond Tigers v Hawthorn Hawks,Head To Head,Richmond Tigers,2.6,Hawthorn Hawks,1.5,1.051,Dabble
Adelaide Crows v Sydney Swans,Head To Head,Adelaide Crows,3.2,Sydney Swans,1.35,1.053,Dabble
North Melbourne Kangaroos v Collingwood Magpies,Head To Head,North Melbourne Kangaroos,7.5,Collingwood Magpies,1.09,1.051,Dabble
GWS Giants v Port Adelaide Power,Head To Head,GWS Giants,1.62,Port Adelaide Power,2.3,1.052,Dabble
