match,market_name,home_team,home_win,away_team,away_win,margin,agency
Gold Coast Suns v Geelong Cats,Head To Head,Gold Coast Suns,2,Geelong Cats,1.82,1.049,Dabble
Sydney Swans v Carlton,Head To Head,Sydney Swans,1.46,Carlton,2.7,1.055,Dabble
Collingwood Magpies v Adelaide Crows,Head To Head,Collingwood Magpies,1.35,Adelaide Crows,3.2,1.053,Dabble
GWS Giants v Western Bulldogs,Head To Head,GWS Giants,1.48,Western Bulldogs,2.65,1.053,Dabble
Brisbane Lions v Richmond Tigers,Head To Head,Brisbane Lions,1.07,Richmond Tigers,8.5,1.052,Dabble
St Kilda Saints v Fremantle Dockers,Head To Head,St Kilda Saints,1.8,Fremantle Dockers,2.02,1.051,Dabble
Essendon Bombers v North Melbourne Kangaroos,Head To Head,Essendon Bombers,1.05,North Melbourne Kangaroos,10,1.052,Dabble
Port Adelaide Power v Hawthorn Hawks,Head To Head,Port Adelaide Power,1.17,Hawthorn Hawks,5,1.055,Dabble
West Coast Eagles v Melbourne Demons,Head To Head,West Coast Eagles,5,Melbourne Demons,1.17,1.055,Dabble
