match,market_name,home_team,home_win,away_team,away_win,margin,agency
Richmond Tigers v Brisbane Lions,Head To Head,Richmond Tigers,9,Brisbane Lions,1.06,1.055,Dabble
North Melbourne Kangaroos v Sydney Swans,Head To Head,North Melbourne Kangaroos,2.3,Sydney Swans,1.62,1.052,Dabble
GWS Giants v West Coast Eagles,Head To Head,GWS Giants,1.01,West Coast Eagles,17,1.049,Dabble
Port Adelaide Power v St Kilda Saints,Head To Head,Port Adelaide Power,1.5,St Kilda Saints,2.6,1.051,Dabble
Fremantle Dockers v Western Bulldogs,Head To Head,Fremantle Dockers,1.6,Western Bulldogs,2.35,1.051,Dabble
