match,market_name,home_team,home_win,away_team,away_win,margin,agency
Western Bulldogs v Collingwood Magpies,Head To Head,Western Bulldogs,2.75,Collingwood Magpies,1.45,1.053,Dabble
Essendon Bombers v Adelaide Crows,Head To Head,Essendon Bombers,2.35,Adelaide Crows,1.6,1.051,Dabble
Port Adelaide Power v Richmond Tigers,Head To Head,Port Adelaide Power,1.1,Richmond Tigers,7,1.052,Dabble
St Kilda Saints v Geelong Cats,Head To Head,St Kilda Saints,3.85,Geelong Cats,1.26,1.053,Dabble
Brisbane Lions v West Coast Eagles,Head To Head,Brisbane Lions,1.02,West Coast Eagles,15,1.047,Dabble
North Melbourne Kangaroos v Melbourne Demons,Head To Head,North Melbourne Kangaroos,3.1,Melbourne Demons,1.38,1.047,Dabble
Fremantle Dockers v Sydney Swans,Head To Head,Fremantle Dockers,1.62,Sydney Swans,2.3,1.052,Dabble
