match,market_name,home_team,home_win,away_team,away_win,margin,agency
Collingwood Magpies v Adelaide Crows,Head To Head,Collingwood Magpies,1.53,Adelaide Crows,2.5,1.054,Dabble
GWS Giants v Fremantle Dockers,Head To Head,GWS Giants,1.33,Fremantle Dockers,3.3,1.055,Dabble
Port Adelaide Power v Geelong Cats,Head To Head,Port Adelaide Power,2.3,Geelong Cats,1.62,1.052,Dabble
Western Bulldogs v Essendon Bombers,Head To Head,Western Bulldogs,1.26,Essendon Bombers,4,1.044,Dabble
Richmond Tigers v North Melbourne Kangaroos,Head To Head,Richmond Tigers,2.38,North Melbourne Kangaroos,NA,NA,Dabble
Brisbane Lions v Melbourne Demons,Head To Head,Brisbane Lions,1.15,Melbourne Demons,5.25,1.06,Dabble
West Coast Eagles v St Kilda Saints,Head To Head,West Coast Eagles,3.1,St Kilda Saints,1.38,1.047,Dabble
