match,market_name,home_team,home_win,away_team,away_win,margin,agency
St Kilda Saints v Western Bulldogs,Head To Head,St Kilda Saints,3.25,Western Bulldogs,1.35,1.048,Dabble
Hawthorn Hawks v Adelaide Crows,Head To Head,Hawthorn Hawks,1.9,Adelaide Crows,1.95,1.039,Dabble
Brisbane Lions v GWS Giants,Head To Head,Brisbane Lions,1.35,GWS Giants,3.25,1.048,Dabble
Essendon Bombers v Geelong Cats,Head To Head,Essendon Bombers,5,Geelong Cats,1.17,1.055,Dabble
Port Adelaide Power v Melbourne Demons,Head To Head,Port Adelaide Power,1.86,Melbourne Demons,1.96,1.048,Dabble
West Coast Eagles v Carlton,Head To Head,West Coast Eagles,3.9,Carlton,1.26,1.05,Dabble
