match,market_name,home_team,home_win,away_team,away_win,margin,agency
Gold Coast Suns v Melbourne Demons,Head To Head,Gold Coast Suns,1.3,Melbourne Demons,3.5,1.055,Dabble
Hawthorn Hawks v North Melbourne Kangaroos,Head To Head,Hawthorn Hawks,1.21,North Melbourne Kangaroos,NA,NA,Dabble
Collingwood Magpies v West Coast Eagles,Head To Head,Collingwood Magpies,1.02,West Coast Eagles,17,1.039,Dabble
Richmond Tigers v Adelaide Crows,Head To Head,Richmond Tigers,7,Adelaide Crows,1.1,1.052,Dabble
Fremantle Dockers v St Kilda Saints,Head To Head,Fremantle Dockers,1.26,St Kilda Saints,3.75,1.06,Dabble
