match,market_name,home_team,home_win,away_team,away_win,margin,agency
Sydney Swans v Western Bulldogs,Head To Head,Sydney Swans,2.63,Western Bulldogs,1.5,1.047,Dabble
Gold Coast Suns v Melbourne Demons,Head To Head,Gold Coast Suns,1.35,Melbourne Demons,3.25,1.048,Dabble
Hawthorn Hawks v North Melbourne Kangaroos,Head To Head,Hawthorn Hawks,1.2,North Melbourne Kangaroos,NA,NA,Dabble
Collingwood Magpies v West Coast Eagles,Head To Head,Collingwood Magpies,1.01,West Coast Eagles,19,1.043,Dabble
Richmond Tigers v Adelaide Crows,Head To Head,Richmond Tigers,7,Adelaide Crows,1.1,1.052,Dabble
Fremantle Dockers v St Kilda Saints,Head To Head,Fremantle Dockers,1.26,St Kilda Saints,3.9,1.05,Dabble
