match,market_name,home_team,home_win,away_team,away_win,margin,agency
Adelaide Crows v Richmond Tigers,Head To Head,Adelaide Crows,1.15,Richmond Tigers,5.5,1.051,Dabble
Western Bulldogs v Brisbane Lions,Head To Head,Western Bulldogs,1.57,Brisbane Lions,2.4,1.054,Dabble
Hawthorn Hawks v GWS Giants,Head To Head,Hawthorn Hawks,2.25,GWS Giants,1.64,1.054,Dabble
West Coast Eagles v North Melbourne Kangaroos,Head To Head,West Coast Eagles,1.3,North Melbourne Kangaroos,3.5,1.055,Dabble
St Kilda Saints v Gold Coast Suns,Head To Head,St Kilda Saints,2.02,Gold Coast Suns,1.8,1.051,Dabble
Sydney Swans v Geelong Cats,Head To Head,Sydney Swans,1.33,Geelong Cats,3.3,1.055,Dabble
Essendon Bombers v Carlton,Head To Head,Essendon Bombers,2.55,Carlton,1.52,1.05,Dabble
Collingwood Magpies v Melbourne Demons,Head To Head,Collingwood Magpies,1.9,Melbourne Demons,1.9,1.053,Dabble
