match,market_name,home_team,home_win,away_team,away_win,margin,agency
Melbourne Demons v GWS Giants,Head To Head,Melbourne Demons,1.9,GWS Giants,1.9,1.053,Dabble
Fremantle Dockers v West Coast Eagles,Head To Head,Fremantle Dockers,1.1,West Coast Eagles,7,1.052,Dabble
Collingwood Magpies v Richmond Tigers,Head To Head,Collingwood Magpies,1.26,Richmond Tigers,3.85,1.053,Dabble
Sydney Swans v Western Bulldogs,Head To Head,Sydney Swans,1.5,Western Bulldogs,2.6,1.051,Dabble
Adelaide Crows v Hawthorn Hawks,Head To Head,Adelaide Crows,2.05,Hawthorn Hawks,1.77,1.053,Dabble
