match,market_name,home_team,home_win,away_team,away_win,margin,agency
Carlton v Hawthorn Hawks,Head To Head,Carlton,2.85,Hawthorn Hawks,1.42,1.055,Dabble
Western Bulldogs v Collingwood Magpies,Head To Head,Western Bulldogs,2.4,Collingwood Magpies,1.58,1.05,Dabble
Essendon Bombers v Adelaide Crows,Head To Head,Essendon Bombers,2.35,Adelaide Crows,1.6,1.051,Dabble
Port Adelaide Power v Richmond Tigers,Head To Head,Port Adelaide Power,1.13,Richmond Tigers,6,1.052,Dabble
St Kilda Saints v Geelong Cats,Head To Head,St Kilda Saints,3.75,Geelong Cats,1.28,1.048,Dabble
Brisbane Lions v West Coast Eagles,Head To Head,Brisbane Lions,1.03,West Coast Eagles,13,1.048,Dabble
North Melbourne Kangaroos v Melbourne Demons,Head To Head,North Melbourne Kangaroos,3,Melbourne Demons,1.38,1.058,Dabble
Fremantle Dockers v Sydney Swans,Head To Head,Fremantle Dockers,1.6,Sydney Swans,2.35,1.051,Dabble
