match,market_name,home_team,home_win,away_team,away_win,margin,agency
Western Bulldogs v Hawthorn Hawks,Head To Head,Western Bulldogs,1.38,Hawthorn Hawks,3.1,1.047,Dabble
Adelaide Crows v Brisbane Lions,Head To Head,Adelaide Crows,1.62,Brisbane Lions,2.3,1.052,Dabble
Richmond Tigers v Sydney Swans,Head To Head,Richmond Tigers,2.63,Sydney Swans,1.48,1.056,Dabble
Geelong Cats v Gold Coast Suns,Head To Head,Geelong Cats,1.4,Gold Coast Suns,3,1.048,Dabble
GWS Giants v Port Adelaide Power,Head To Head,GWS Giants,1.35,Port Adelaide Power,3.3,1.044,Dabble
Carlton v Essendon Bombers,Head To Head,Carlton,1.48,Essendon Bombers,2.63,1.056,Dabble
Melbourne Demons v Collingwood Magpies,Head To Head,Melbourne Demons,3.6,Collingwood Magpies,1.3,1.047,Dabble
