match,market_name,home_team,home_win,away_team,away_win,margin,agency
Brisbane Lions v Collingwood Magpies,Head To Head,Brisbane Lions,1.4,Collingwood Magpies,3,1.048,Dabble
North Melbourne Kangaroos v Carlton,Head To Head,North Melbourne Kangaroos,6,Carlton,1.13,1.052,Dabble
Fremantle Dockers v Adelaide Crows,Head To Head,Fremantle Dockers,1.46,Adelaide Crows,2.75,1.049,Dabble
Essendon Bombers v St Kilda Saints,Head To Head,Essendon Bombers,2.35,St Kilda Saints,1.6,1.051,Dabble
Port Adelaide Power v Melbourne Demons,Head To Head,Port Adelaide Power,1.46,Melbourne Demons,2.75,1.049,Dabble
Western Bulldogs v West Coast Eagles,Head To Head,Western Bulldogs,1.07,West Coast Eagles,8.5,1.052,Dabble
Richmond Tigers v Sydney Swans,Head To Head,Richmond Tigers,3.6,Sydney Swans,1.3,1.047,Dabble
Hawthorn Hawks v Geelong Cats,Head To Head,Hawthorn Hawks,3.3,Geelong Cats,1.33,1.055,Dabble
