match,market_name,home_team,home_win,away_team,away_win,margin,agency
Collingwood Magpies v Essendon Bombers,Head To Head,Collingwood Magpies,1.58,Essendon Bombers,2.4,1.05,Dabble
Port Adelaide Power v Western Bulldogs,Head To Head,Port Adelaide Power,2,Western Bulldogs,1.8,1.056,Dabble
North Melbourne Kangaroos v Gold Coast Suns,Head To Head,North Melbourne Kangaroos,3.1,Gold Coast Suns,1.37,1.053,Dabble
Geelong Cats v Hawthorn Hawks,Head To Head,Geelong Cats,1.52,Hawthorn Hawks,2.55,1.05,Dabble
GWS Giants v Carlton,Head To Head,GWS Giants,2.25,Carlton,1.65,1.051,Dabble
Fremantle Dockers v Richmond Tigers,Head To Head,Fremantle Dockers,1.08,Richmond Tigers,8,1.051,Dabble
Melbourne Demons v West Coast Eagles,Head To Head,Melbourne Demons,1.15,West Coast Eagles,5.5,1.051,Dabble
St Kilda Saints v Sydney Swans,Head To Head,St Kilda Saints,3.5,Sydney Swans,1.3,1.055,Dabble
Brisbane Lions v Adelaide Crows,Head To Head,Brisbane Lions,1.22,Adelaide Crows,4.4,1.047,Dabble
