match,market_name,home_team,home_win,away_team,away_win,margin,agency
Geelong Cats v Port Adelaide Power,Head To Head,Geelong Cats,1.28,Port Adelaide Power,3.75,1.048,Dabble
Fremantle Dockers v Sydney Swans,Head To Head,Fremantle Dockers,2.15,Sydney Swans,1.7,1.053,Dabble
Hawthorn Hawks v St Kilda Saints,Head To Head,Hawthorn Hawks,2.6,St Kilda Saints,1.5,1.051,Dabble
Essendon Bombers v GWS Giants,Head To Head,Essendon Bombers,2.4,GWS Giants,1.58,1.05,Dabble
Richmond Tigers v Western Bulldogs,Head To Head,Richmond Tigers,3.1,Western Bulldogs,1.37,1.053,Dabble
Gold Coast Suns v North Melbourne Kangaroos,Head To Head,Gold Coast Suns,1.1,North Melbourne Kangaroos,7,1.052,Dabble
Collingwood Magpies v West Coast Eagles,Head To Head,Collingwood Magpies,1.1,West Coast Eagles,7,1.052,Dabble
Adelaide Crows v Brisbane Lions,Head To Head,Adelaide Crows,1.65,Brisbane Lions,2.25,1.051,Dabble
