match,market_name,home_team,home_win,away_team,away_win,margin,agency
Adelaide Crows v Carlton,Head To Head,Adelaide Crows,1.55,Carlton,2.5,1.045,Dabble
West Coast Eagles v Melbourne Demons,Head To Head,West Coast Eagles,2.63,Melbourne Demons,1.48,1.056,Dabble
Collingwood Magpies v Geelong Cats,Head To Head,Collingwood Magpies,1.53,Geelong Cats,2.5,1.054,Dabble
Sydney Swans v GWS Giants,Head To Head,Sydney Swans,2.3,GWS Giants,1.62,1.052,Dabble
Hawthorn Hawks v Richmond Tigers,Head To Head,Hawthorn Hawks,1.06,Richmond Tigers,9.5,1.049,Dabble
Brisbane Lions v Gold Coast Suns,Head To Head,Brisbane Lions,1.57,Gold Coast Suns,2.4,1.054,Dabble
