match,market_name,home_team,home_win,away_team,away_win,margin,agency
Essendon Bombers v Adelaide Crows,Head To Head,Essendon Bombers,1.53,Adelaide Crows,2.5,1.054,Dabble
St Kilda Saints v West Coast Eagles,Head To Head,St Kilda Saints,1.22,West Coast Eagles,4.25,1.055,Dabble
GWS Giants v Gold Coast Suns,Head To Head,GWS Giants,1.37,Gold Coast Suns,3.1,1.053,Dabble
Hawthorn Hawks v Collingwood Magpies,Head To Head,Hawthorn Hawks,1.85,Collingwood Magpies,1.95,1.053,Dabble
Geelong Cats v Western Bulldogs,Head To Head,Geelong Cats,1.38,Western Bulldogs,3,1.058,Dabble
Port Adelaide Power v Richmond Tigers,Head To Head,Port Adelaide Power,1.1,Richmond Tigers,7,1.052,Dabble
Brisbane Lions v Sydney Swans,Head To Head,Brisbane Lions,1.85,Sydney Swans,1.95,1.053,Dabble
Fremantle Dockers v Melbourne Demons,Head To Head,Fremantle Dockers,1.44,Melbourne Demons,2.8,1.052,Dabble
Carlton v North Melbourne Kangaroos,Head To Head,Carlton,1.15,North Melbourne Kangaroos,5.5,1.051,Dabble
