match,market_name,home_team,home_win,away_team,away_win,margin,agency
Western Bulldogs v Brisbane Lions,Head To Head,Western Bulldogs,2.55,Brisbane Lions,1.52,1.05,Dabble
Melbourne Demons v Essendon Bombers,Head To Head,Melbourne Demons,1.88,Essendon Bombers,1.95,1.045,Dabble
Richmond Tigers v Fremantle Dockers,Head To Head,Richmond Tigers,6.5,Fremantle Dockers,1.11,1.055,Dabble
St Kilda Saints v GWS Giants,Head To Head,St Kilda Saints,2.7,GWS Giants,1.46,1.055,Dabble
Port Adelaide Power v Hawthorn Hawks,Head To Head,Port Adelaide Power,2.75,Hawthorn Hawks,1.46,1.049,Dabble
