match,market_name,home_team,home_win,away_team,away_win,margin,agency
Carlton v Hawthorn Hawks,Head To Head,Carlton,2.8,Hawthorn Hawks,1.44,1.052,Dabble
Western Bulldogs v Collingwood Magpies,Head To Head,Western Bulldogs,2.2,Collingwood Magpies,1.67,1.053,Dabble
Essendon Bombers v Adelaide Crows,Head To Head,Essendon Bombers,2.1,Adelaide Crows,1.75,1.048,Dabble
Port Adelaide Power v Richmond Tigers,Head To Head,Port Adelaide Power,1.12,Richmond Tigers,6,1.06,Dabble
St Kilda Saints v Geelong Cats,Head To Head,St Kilda Saints,3.5,Geelong Cats,1.3,1.055,Dabble
Brisbane Lions v West Coast Eagles,Head To Head,Brisbane Lions,1.04,West Coast Eagles,13,1.038,Dabble
North Melbourne Kangaroos v Melbourne Demons,Head To Head,North Melbourne Kangaroos,3,Melbourne Demons,1.4,1.048,Dabble
Fremantle Dockers v Sydney Swans,Head To Head,Fremantle Dockers,1.75,Sydney Swans,2.1,1.048,Dabble
