match,market_name,home_team,home_win,away_team,away_win,margin,agency
Geelong Cats v Richmond Tigers,Head To Head,Geelong Cats,1.02,Richmond Tigers,19,1.033,Dabble
Brisbane Lions v Port Adelaide Power,Head To Head,Brisbane Lions,1.25,Port Adelaide Power,4,1.05,Dabble
St Kilda Saints v Hawthorn Hawks,Head To Head,St Kilda Saints,3.1,Hawthorn Hawks,1.38,1.047,Dabble
Sydney Swans v Fremantle Dockers,Head To Head,Sydney Swans,1.57,Fremantle Dockers,2.4,1.054,Dabble
Adelaide Crows v Melbourne Demons,Head To Head,Adelaide Crows,1.22,Melbourne Demons,4.33,1.051,Dabble
