match,market_name,home_team,home_win,away_team,away_win,margin,agency
Geelong Cats v Western Bulldogs,Head To Head,Geelong Cats,1.88,Western Bulldogs,1.96,1.042,Dabble
Essendon Bombers v Richmond Tigers,Head To Head,Essendon Bombers,1.38,Richmond Tigers,3,1.058,Dabble
Carlton v GWS Giants,Head To Head,Carlton,1.7,GWS Giants,2.15,1.053,Dabble
Hawthorn Hawks v Brisbane Lions,Head To Head,Hawthorn Hawks,1.6,Brisbane Lions,2.4,1.042,Dabble
Fremantle Dockers v Port Adelaide Power,Head To Head,Fremantle Dockers,1.38,Port Adelaide Power,3.1,1.047,Dabble
