match,market_name,home_team,away_team,home_win,away_win,margin,agency
Carlton v Geelong Cats,Head To Head,Carlton,Geelong Cats,1.6,2.35,1.05,Neds
Port Adelaide Power v Brisbane Lions,Head To Head,Port Adelaide Power,Brisbane Lions,1.8199999999999998,2,1.05,Neds
GWS Giants v Sydney Swans,Head To Head,GWS Giants,Sydney Swans,2.65,1.48,1.05,Neds
Fremantle Dockers v Gold Coast Suns,Head To Head,Fremantle Dockers,Gold Coast Suns,1.45,2.75,1.05,Neds
Essendon Bombers v West Coast Eagles,Head To Head,Essendon Bombers,West Coast Eagles,1.1400000000000001,5.5,1.06,Neds
Melbourne Demons v North Melbourne Kangaroos,Head To Head,Melbourne Demons,North Melbourne Kangaroos,1.16,5.25,1.05,Neds
