match,market_name,home_team,away_team,home_win,away_win,margin,agency
Geelong Cats v West Coast Eagles,Head To Head,Geelong Cats,West Coast Eagles,1.05,10,1.05,Neds
Western Bulldogs v GWS Giants,Head To Head,Western Bulldogs,GWS Giants,1.42,2.8,1.06,Neds
Fremantle Dockers v Port Adelaide Power,Head To Head,Fremantle Dockers,Port Adelaide Power,1.77,2.05,1.05,Neds
Carlton v St Kilda Saints,Head To Head,Carlton,St Kilda Saints,1.73,2.1,1.05,Neds
Richmond Tigers v Gold Coast Suns,Head To Head,Richmond Tigers,Gold Coast Suns,2.55,1.52,1.05,Neds
Hawthorn Hawks v North Melbourne Kangaroos,Head To Head,Hawthorn Hawks,North Melbourne Kangaroos,1.04,10,1.06,Neds
Brisbane Lions v Essendon Bombers,Head To Head,Brisbane Lions,Essendon Bombers,1.1400000000000001,5.6,1.06,Neds
Sydney Swans v Adelaide Crows,Head To Head,Sydney Swans,Adelaide Crows,1.33,3.25,1.06,Neds
Melbourne Demons v Collingwood Magpies,Head To Head,Melbourne Demons,Collingwood Magpies,2.25,1.65,1.05,Neds
