match,market_name,home_team,away_team,home_win,away_win,margin,agency
Western Bulldogs v Fremantle Dockers,Head To Head,Western Bulldogs,Fremantle Dockers,1.7,2.15,1.05,Neds
GWS Giants v Port Adelaide Power,Head To Head,GWS Giants,Port Adelaide Power,1.6,2.35,1.05,Neds
North Melbourne Kangaroos v Collingwood Magpies,Head To Head,North Melbourne Kangaroos,Collingwood Magpies,7,1.1,1.05,Neds
Adelaide Crows v Sydney Swans,Head To Head,Adelaide Crows,Sydney Swans,3.25,1.35,1.05,Neds
Collingwood Magpies v Melbourne Demons,Head To Head,Collingwood Magpies,Melbourne Demons,2.05,1.77,1.05,Neds
Richmond Tigers v Hawthorn Hawks,Head To Head,Richmond Tigers,Hawthorn Hawks,2.8,1.44,1.05,Neds
Brisbane Lions v St Kilda Saints,Head To Head,Brisbane Lions,St Kilda Saints,1.28,3.75,1.05,Neds
