match,market_name,home_team,away_team,home_win,away_win,margin,agency
GWS Giants v West Coast Eagles,Head To Head,GWS Giants,West Coast Eagles,1.42,2.75,1.07,Neds
Brisbane Lions v Adelaide Crows,Head To Head,Brisbane Lions,Adelaide Crows,1.55,2.4,1.06,Neds
Collingwood Magpies v Gold Coast Suns,Head To Head,Collingwood Magpies,Gold Coast Suns,3,1.38,1.06,Neds
Sydney Swans v Brisbane Lions,Head To Head,Sydney Swans,Brisbane Lions,1.75,2.1,1.05,Neds
Western Bulldogs v Sydney Swans,Head To Head,Western Bulldogs,Sydney Swans,3.45,1.3,1.06,Neds
St Kilda Saints v Fremantle Dockers,Head To Head,St Kilda Saints,Fremantle Dockers,1.58,2.3,1.07,Neds
Essendon Bombers v Melbourne Demons,Head To Head,Essendon Bombers,Melbourne Demons,2.6,1.48,1.06,Neds
