match,market_name,home_team,away_team,home_win,away_win,margin,agency
GWS Giants v West Coast Eagles,Head To Head,GWS Giants,West Coast Eagles,1.55,2.45,1.05,Neds
North Melbourne Kangaroos v Richmond Tigers,Head To Head,North Melbourne Kangaroos,Richmond Tigers,1.09,7,1.06,Neds
Brisbane Lions v Adelaide Crows,Head To Head,Brisbane Lions,Adelaide Crows,1.65,2.2,1.06,Neds
Port Adelaide Power v Carlton,Head To Head,Port Adelaide Power,Carlton,1.72,2.1,1.06,Neds
Sydney Swans v Brisbane Lions,Head To Head,Sydney Swans,Brisbane Lions,1.75,2.1,1.05,Neds
