match,market_name,home_team,away_team,home_win,away_win,margin,agency
Fremantle Dockers v Port Adelaide Power,Head To Head,Fremantle Dockers,Port Adelaide Power,1.33,3.25,1.06,Neds
Melbourne Demons v Sydney Swans,Head To Head,Melbourne Demons,Sydney Swans,2,1.8199999999999998,1.05,Neds
North Melbourne Kangaroos v Collingwood Magpies,Head To Head,North Melbourne Kangaroos,Collingwood Magpies,5,1.18,1.05,Neds
St Kilda Saints v Gold Coast Suns,Head To Head,St Kilda Saints,Gold Coast Suns,2.55,1.52,1.05,Neds
Geelong Cats v Western Bulldogs,Head To Head,Geelong Cats,Western Bulldogs,1.8199999999999998,2,1.05,Neds
Adelaide Crows v West Coast Eagles,Head To Head,Adelaide Crows,West Coast Eagles,1.04,11,1.05,Neds
Carlton v GWS Giants,Head To Head,Carlton,GWS Giants,1.73,2.1,1.05,Neds
Essendon Bombers v Richmond Tigers,Head To Head,Essendon Bombers,Richmond Tigers,1.33,3.35,1.05,Neds
Hawthorn Hawks v Brisbane Lions,Head To Head,Hawthorn Hawks,Brisbane Lions,1.55,2.45,1.05,Neds
