match,market_name,home_team,away_team,home_win,away_win,margin,agency
Brisbane Lions v Collingwood Magpies,Head To Head,Brisbane Lions,Collingwood Magpies,1.42,2.85,1.06,Neds
Fremantle Dockers v Adelaide Crows,Head To Head,Fremantle Dockers,Adelaide Crows,1.48,2.7,1.05,Neds
Essendon Bombers v St Kilda Saints,Head To Head,Essendon Bombers,St Kilda Saints,2.3,1.6,1.06,Neds
Port Adelaide Power v Melbourne Demons,Head To Head,Port Adelaide Power,Melbourne Demons,1.48,2.65,1.05,Neds
Western Bulldogs v West Coast Eagles,Head To Head,Western Bulldogs,West Coast Eagles,1.1,7,1.05,Neds
Richmond Tigers v Sydney Swans,Head To Head,Richmond Tigers,Sydney Swans,3.7,1.28,1.05,Neds
Hawthorn Hawks v Geelong Cats,Head To Head,Hawthorn Hawks,Geelong Cats,3.2,1.32,1.07,Neds
