match,market_name,home_team,away_team,home_win,away_win,margin,agency
Western Bulldogs v Fremantle Dockers,Head To Head,Western Bulldogs,Fremantle Dockers,1.7,2.15,1.05,Neds
GWS Giants v Port Adelaide Power,Head To Head,GWS Giants,Port Adelaide Power,1.6400000000000001,2.25,1.05,Neds
North Melbourne Kangaroos v Collingwood Magpies,Head To Head,North Melbourne Kangaroos,Collingwood Magpies,7,1.1,1.05,Neds
Adelaide Crows v Sydney Swans,Head To Head,Adelaide Crows,Sydney Swans,3.1,1.3599999999999999,1.06,Neds
East Fremantle v Subiaco,Head To Head,East Fremantle,Subiaco,1.01,1.01,1.98,Neds
Peel Thunder v Perth,Head To Head,Peel Thunder,Perth,1.01,1.01,1.98,Neds
Richmond Tigers v Hawthorn Hawks,Head To Head,Richmond Tigers,Hawthorn Hawks,2.65,1.48,1.05,Neds
Swan Districts v South Fremantle,Head To Head,Swan Districts,South Fremantle,1.01,1.01,1.98,Neds
Brisbane Lions v St Kilda Saints,Head To Head,Brisbane Lions,St Kilda Saints,1.19,4.5,1.06,Neds
