match,market_name,home_team,away_team,home_win,away_win,margin,agency
GWS Giants v Gold Coast Suns,Head To Head,GWS Giants,Gold Coast Suns,1.72,2.1,1.06,Neds
Adelaide Crows v Hawthorn Hawks,Head To Head,Adelaide Crows,Hawthorn Hawks,1.26,3.7,1.06,Neds
Essendon Bombers v St Kilda Saints,Head To Head,Essendon Bombers,St Kilda Saints,2.75,1.44,1.06,Neds
Swan Districts v Peel Thunder,Head To Head,Swan Districts,Peel Thunder,2.05,1.77,1.05,Neds
Sydney Swans v Port Adelaide Power,Head To Head,Sydney Swans,Port Adelaide Power,1.3,3.45,1.06,Neds
Melbourne Demons v North Melbourne Kangaroos,Head To Head,Melbourne Demons,North Melbourne Kangaroos,4,1.24,1.06,Neds
Geelong Cats v Brisbane Lions,Head To Head,Geelong Cats,Brisbane Lions,1.73,2.1,1.05,Neds
