match,start_time,market_name,home_team,home_line,home_win,away_team,away_line,away_win,margin,agency
Essendon Bombers v Port Adelaide Power,2025-03-27T08:30:00Z,Line,Essendon Bombers,7.5,1.9,Port Adelaide Power,-7.5,1.9,1.053,Pointsbet
Carlton v Western Bulldogs,2025-03-28T08:40:00Z,Line,Carlton,2.5,1.9,Western Bulldogs,-2.5,1.9,1.053,Pointsbet
Melbourne Demons v Gold Coast Suns,2025-03-29T02:20:00Z,Line,Melbourne Demons,0.5,1.9,Gold Coast Suns,-0.5,1.9,1.053,Pointsbet
St Kilda Saints v Richmond Tigers,2025-03-29T05:15:00Z,Line,St Kilda Saints,-28.5,1.9,Richmond Tigers,28.5,1.9,1.053,Pointsbet
Brisbane Lions v Geelong Cats,2025-03-29T08:35:00Z,Line,Brisbane Lions,-13.5,1.9,Geelong Cats,13.5,1.9,1.053,Pointsbet
Hawthorn Hawks v GWS Giants,2025-03-29T08:35:00Z,Line,Hawthorn Hawks,-12.5,1.9,GWS Giants,12.5,1.9,1.053,Pointsbet
Adelaide Crows v North Melbourne Kangaroos,2025-03-30T04:20:00Z,Line,Adelaide Crows,-39.5,1.9,North Melbourne Kangaroos,39.5,1.9,1.053,Pointsbet
West Coast Eagles v Fremantle Dockers,2025-03-30T07:10:00Z,Line,West Coast Eagles,25.5,1.9,Fremantle Dockers,-25.5,1.9,1.053,Pointsbet
