match,start_time,market_name,home_team,home_line,home_win,away_team,away_line,away_win,margin,agency
Port Adelaide Power v Essendon Bombers,2024-04-05T09:10:00Z,Line,Port Adelaide Power,-26.5,1.9,Essendon Bombers,26.5,1.9,1.053,Pointsbet
West Coast Eagles v Sydney Swans,2024-04-06T02:30:00Z,Line,West Coast Eagles,61.5,1.9,Sydney Swans,-61.5,1.9,1.053,Pointsbet
Fremantle Dockers v Carlton,2024-04-06T05:20:00Z,Line,Fremantle Dockers,7.5,1.9,Carlton,-7.5,1.9,1.053,Pointsbet
Western Bulldogs v Geelong Cats,2024-04-06T09:10:00Z,Line,Western Bulldogs,1.5,1.9,Geelong Cats,-1.5,1.9,1.053,Pointsbet
Gold Coast Suns v GWS Giants,2024-04-07T02:30:00Z,Line,Gold Coast Suns,21.5,1.9,GWS Giants,-21.5,1.9,1.053,Pointsbet
Richmond Tigers v St Kilda Saints,2024-04-07T05:20:00Z,Line,Richmond Tigers,19.5,1.9,St Kilda Saints,-19.5,1.9,1.053,Pointsbet
Collingwood Magpies v Hawthorn Hawks,2024-04-07T07:10:00Z,Line,Collingwood Magpies,-25.5,1.9,Hawthorn Hawks,25.5,1.9,1.053,Pointsbet
