match,start_time,market_name,home_team,home_line,home_win,away_team,away_line,away_win,margin,agency
Port Adelaide Power v Richmond Tigers,2025-03-22T05:15:00Z,Line,Port Adelaide Power,-41.5,1.9,Richmond Tigers,41.5,1.9,1.053,Pointsbet
St Kilda Saints v Geelong Cats,2025-03-22T08:35:00Z,Line,St Kilda Saints,20.5,1.9,Geelong Cats,-20.5,1.9,1.053,Pointsbet
Brisbane Lions v West Coast Eagles,2025-03-23T02:10:00Z,Line,Brisbane Lions,-60.5,1.9,West Coast Eagles,60.5,1.9,1.053,Pointsbet
North Melbourne Kangaroos v Melbourne Demons,2025-03-23T04:20:00Z,Line,North Melbourne Kangaroos,16.5,1.9,Melbourne Demons,-16.5,1.9,1.053,Pointsbet
Fremantle Dockers v Sydney Swans,2025-03-23T07:10:00Z,Line,Fremantle Dockers,-7.5,1.9,Sydney Swans,7.5,1.9,1.053,Pointsbet
