match,start_time,market_name,home_team,home_line,home_win,away_team,away_line,away_win,margin,agency
Carlton v Gold Coast Suns,2024-05-25T03:45:00Z,Line,Carlton,-15.5,1.9,Gold Coast Suns,15.5,1.9,1.053,Pointsbet
North Melbourne Kangaroos v Port Adelaide Power,2024-05-25T03:45:00Z,Line,North Melbourne Kangaroos,44.5,1.9,Port Adelaide Power,-44.5,1.9,1.053,Pointsbet
Geelong Cats v GWS Giants,2024-05-25T06:35:00Z,Line,Geelong Cats,-14.5,1.9,GWS Giants,14.5,1.9,1.053,Pointsbet
Richmond Tigers v Essendon Bombers,2024-05-25T09:40:00Z,Line,Richmond Tigers,35.5,1.9,Essendon Bombers,-35.5,1.9,1.053,Pointsbet
Hawthorn Hawks v Brisbane Lions,2024-05-26T03:10:00Z,Line,Hawthorn Hawks,14.5,1.9,Brisbane Lions,-14.5,1.9,1.053,Pointsbet
Melbourne Demons v St Kilda Saints,2024-05-26T05:20:00Z,Line,Melbourne Demons,-17.5,1.9,St Kilda Saints,17.5,1.9,1.053,Pointsbet
Adelaide Crows v West Coast Eagles,2024-05-26T06:40:00Z,Line,Adelaide Crows,-27.5,1.9,West Coast Eagles,27.5,1.9,1.053,Pointsbet
