match,start_time,market_name,home_team,home_line,home_win,away_team,away_line,away_win,margin,agency
Richmond Tigers v Sydney Swans,2025-06-07T03:20:00Z,Line,Richmond Tigers,43.5,1.83,Sydney Swans,-43.5,1.9,1.073,Pointsbet
Geelong Cats v Gold Coast Suns,2025-06-07T06:15:00Z,Line,Geelong Cats,-15.5,1.9,Gold Coast Suns,15.5,1.9,1.053,Pointsbet
GWS Giants v Port Adelaide Power,2025-06-07T09:35:00Z,Line,GWS Giants,-19.5,1.9,Port Adelaide Power,19.5,1.9,1.053,Pointsbet
North Melbourne Kangaroos v West Coast Eagles,2025-06-08T05:20:00Z,Line,North Melbourne Kangaroos,-7.5,1.9,West Coast Eagles,7.5,1.9,1.053,Pointsbet
Carlton v Essendon Bombers,2025-06-08T09:20:00Z,Line,Carlton,-14.5,1.9,Essendon Bombers,14.5,1.9,1.053,Pointsbet
Melbourne Demons v Collingwood Magpies,2025-06-09T05:20:00Z,Line,Melbourne Demons,24.5,1.87,Collingwood Magpies,-24.5,1.95,1.048,Pointsbet
