match,start_time,market_name,home_team,home_line,home_win,away_team,away_line,away_win,margin,agency
Richmond Tigers v Carlton,2025-03-13T08:30:00Z,Line,Richmond Tigers,47.5,1.9,Carlton,-47.5,1.9,1.053,Pointsbet
Hawthorn Hawks v Essendon Bombers,2025-03-14T08:40:00Z,Line,Hawthorn Hawks,-21.5,1.9,Essendon Bombers,21.5,1.9,1.053,Pointsbet
Geelong Cats v Fremantle Dockers,2025-03-15T02:20:00Z,Line,Geelong Cats,-13.5,1.9,Fremantle Dockers,13.5,1.9,1.053,Pointsbet
Sydney Swans v Brisbane Lions,2025-03-15T05:15:00Z,Line,Sydney Swans,3.5,1.9,Brisbane Lions,-3.5,1.9,1.053,Pointsbet
Western Bulldogs v North Melbourne Kangaroos,2025-03-15T08:35:00Z,Line,Western Bulldogs,-20.5,1.9,North Melbourne Kangaroos,20.5,1.9,1.053,Pointsbet
Collingwood Magpies v Port Adelaide Power,2025-03-15T08:35:00Z,Line,Collingwood Magpies,-8.5,1.9,Port Adelaide Power,8.5,1.9,1.053,Pointsbet
Adelaide Crows v St Kilda Saints,2025-03-16T01:35:00Z,Line,Adelaide Crows,-18.5,1.9,St Kilda Saints,18.5,1.9,1.053,Pointsbet
Melbourne Demons v GWS Giants,2025-03-16T04:20:00Z,Line,Melbourne Demons,3.5,1.9,GWS Giants,-3.5,1.9,1.053,Pointsbet
West Coast Eagles v Gold Coast Suns,2025-03-16T07:10:00Z,Line,West Coast Eagles,11.5,1.9,Gold Coast Suns,-11.5,1.9,1.053,Pointsbet
