match,start_time,market_name,home_team,home_line,home_win,away_team,away_line,away_win,margin,agency
Carlton v GWS Giants,2025-05-24T02:35:00Z,Line,Carlton,-7.5,1.9,GWS Giants,7.5,1.9,1.053,Pointsbet
Hawthorn Hawks v Brisbane Lions,2025-05-24T06:15:00Z,Line,Hawthorn Hawks,-11.5,1.9,Brisbane Lions,11.5,1.9,1.053,Pointsbet
North Melbourne Kangaroos v Collingwood Magpies,2025-05-24T09:35:00Z,Line,North Melbourne Kangaroos,30.5,1.9,Collingwood Magpies,-30.5,1.9,1.053,Pointsbet
Fremantle Dockers v Port Adelaide Power,2025-05-24T10:10:00Z,Line,Fremantle Dockers,-19.5,1.9,Port Adelaide Power,19.5,1.9,1.053,Pointsbet
Adelaide Crows v West Coast Eagles,2025-05-25T03:10:00Z,Line,Adelaide Crows,-50.5,1.9,West Coast Eagles,50.5,1.9,1.053,Pointsbet
Melbourne Demons v Sydney Swans,2025-05-25T05:20:00Z,Line,Melbourne Demons,1.5,1.9,Sydney Swans,-1.5,1.9,1.053,Pointsbet
St Kilda Saints v Gold Coast Suns,2025-05-25T06:40:00Z,Line,St Kilda Saints,12.5,1.9,Gold Coast Suns,-12.5,1.9,1.053,Pointsbet
