match,start_time,market_name,home_team,home_win,away_team,away_win,margin,agency
North Melbourne Kangaroos v Gold Coast Suns,2025-04-12T02:35:00Z,Head To Head,North Melbourne Kangaroos,4.2,Gold Coast Suns,1.23,1.051,Pointsbet
Carlton v West Coast Eagles,2025-04-12T03:20:00Z,Head To Head,Carlton,1.1,West Coast Eagles,7,1.052,Pointsbet
Western Bulldogs v Brisbane Lions,2025-04-12T06:15:00Z,Head To Head,Western Bulldogs,2.6,Brisbane Lions,1.5,1.051,Pointsbet
Melbourne Demons v Essendon Bombers,2025-04-12T09:35:00Z,Head To Head,Melbourne Demons,1.92,Essendon Bombers,1.88,1.053,Pointsbet
Richmond Tigers v Fremantle Dockers,2025-04-13T02:35:00Z,Head To Head,Richmond Tigers,6,Fremantle Dockers,1.13,1.052,Pointsbet
St Kilda Saints v GWS Giants,2025-04-13T05:20:00Z,Head To Head,St Kilda Saints,2.8,GWS Giants,1.44,1.052,Pointsbet
Port Adelaide Power v Hawthorn Hawks,2025-04-13T09:20:00Z,Head To Head,Port Adelaide Power,2.75,Hawthorn Hawks,1.45,1.053,Pointsbet
