match,start_time,market_name,home_team,home_win,away_team,away_win,margin,agency
Brisbane Lions v Essendon Bombers,2024-08-24T09:30:00Z,Head To Head,Brisbane Lions,1.13,Essendon Bombers,6,1.052,Pointsbet
Sydney Swans v Adelaide Crows,2024-08-24T09:40:00Z,Head To Head,Sydney Swans,1.4,Adelaide Crows,3,1.048,Pointsbet
Western Bulldogs v GWS Giants,2024-08-25T02:30:00Z,Head To Head,Western Bulldogs,1.5,GWS Giants,2.6,1.051,Pointsbet
Carlton v St Kilda Saints,2024-08-25T05:20:00Z,Head To Head,Carlton,2.1,St Kilda Saints,1.72,1.058,Pointsbet
Fremantle Dockers v Port Adelaide Power,2024-08-25T08:10:00Z,Head To Head,Fremantle Dockers,1.85,Port Adelaide Power,1.95,1.053,Pointsbet
