match,start_time,market_name,home_team,home_line,home_win,away_team,away_line,away_win,margin,agency
Gold Coast Suns v Fremantle Dockers,2025-05-31T03:20:00Z,Line,Gold Coast Suns,-16.5,1.95,Fremantle Dockers,16.5,1.87,1.048,Pointsbet
GWS Giants v Richmond Tigers,2025-05-31T06:15:00Z,Line,GWS Giants,-46.5,1.9,Richmond Tigers,46.5,1.9,1.053,Pointsbet
Sydney Swans v Adelaide Crows,2025-05-31T09:35:00Z,Line,Sydney Swans,7.5,1.9,Adelaide Crows,-7.5,1.9,1.053,Pointsbet
Melbourne Demons v St Kilda Saints,2025-06-01T05:20:00Z,Line,Melbourne Demons,-12.5,1.9,St Kilda Saints,12.5,1.9,1.053,Pointsbet
West Coast Eagles v Geelong Cats,2025-06-01T09:20:00Z,Line,West Coast Eagles,40.5,1.9,Geelong Cats,-40.5,1.9,1.053,Pointsbet
