match,start_time,market_name,home_team,home_win,away_team,away_win,margin,agency
Western Bulldogs v Hawthorn Hawks,2025-06-05T09:30:00Z,Head To Head,Western Bulldogs,1.36,Hawthorn Hawks,3.3,1.038,Pointsbet
Adelaide Crows v Brisbane Lions,2025-06-06T09:40:00Z,Head To Head,Adelaide Crows,1.59,Brisbane Lions,2.4,1.046,Pointsbet
Richmond Tigers v Sydney Swans,2025-06-07T03:20:00Z,Head To Head,Richmond Tigers,2.75,Sydney Swans,1.48,1.039,Pointsbet
Geelong Cats v Gold Coast Suns,2025-06-07T06:15:00Z,Head To Head,Geelong Cats,1.36,Gold Coast Suns,3.2,1.048,Pointsbet
GWS Giants v Port Adelaide Power,2025-06-07T09:35:00Z,Head To Head,GWS Giants,1.31,Port Adelaide Power,3.5,1.049,Pointsbet
North Melbourne Kangaroos v West Coast Eagles,2025-06-08T05:20:00Z,Head To Head,North Melbourne Kangaroos,1.59,West Coast Eagles,2.4,1.046,Pointsbet
Carlton v Essendon Bombers,2025-06-08T09:20:00Z,Head To Head,Carlton,1.44,Essendon Bombers,2.85,1.045,Pointsbet
Melbourne Demons v Collingwood Magpies,2025-06-09T05:20:00Z,Head To Head,Melbourne Demons,4,Collingwood Magpies,1.27,1.037,Pointsbet
