match,start_time,market_name,home_team,home_line,home_win,away_team,away_line,away_win,margin,agency
St Kilda Saints v Carlton,2025-05-09T09:40:00Z,Line,St Kilda Saints,8.5,1.9,Carlton,-8.5,1.9,1.053,Pointsbet
Melbourne Demons v Hawthorn Hawks,2025-05-10T03:20:00Z,Line,Melbourne Demons,22.5,1.9,Hawthorn Hawks,-22.5,1.9,1.053,Pointsbet
Essendon Bombers v Sydney Swans,2025-05-10T06:15:00Z,Line,Essendon Bombers,8.5,1.9,Sydney Swans,-8.5,1.9,1.053,Pointsbet
Gold Coast Suns v Western Bulldogs,2025-05-10T09:35:00Z,Line,Gold Coast Suns,-1.5,1.9,Western Bulldogs,1.5,1.9,1.053,Pointsbet
Port Adelaide Power v Adelaide Crows,2025-05-10T10:10:00Z,Line,Port Adelaide Power,14.5,1.9,Adelaide Crows,-14.5,1.9,1.053,Pointsbet
Richmond Tigers v West Coast Eagles,2025-05-11T03:10:00Z,Line,Richmond Tigers,-13.5,1.95,West Coast Eagles,13.5,1.87,1.048,Pointsbet
Geelong Cats v GWS Giants,2025-05-11T05:20:00Z,Line,Geelong Cats,-16.5,1.9,GWS Giants,16.5,1.9,1.053,Pointsbet
North Melbourne Kangaroos v Brisbane Lions,2025-05-11T06:40:00Z,Line,North Melbourne Kangaroos,36.5,1.9,Brisbane Lions,-36.5,1.9,1.053,Pointsbet
