match,start_time,market_name,home_team,home_line,home_win,away_team,away_line,away_win,margin,agency
Port Adelaide Power v Geelong Cats,2025-05-17T06:15:00Z,Line,Port Adelaide Power,7.5,1.9,Geelong Cats,-7.5,1.9,1.053,Pointsbet
GWS Giants v Fremantle Dockers,2025-05-17T06:15:00Z,Line,GWS Giants,-18.5,1.9,Fremantle Dockers,18.5,1.9,1.053,Pointsbet
Western Bulldogs v Essendon Bombers,2025-05-17T09:35:00Z,Line,Western Bulldogs,-24.5,1.85,Essendon Bombers,24.5,1.95,1.053,Pointsbet
Richmond Tigers v North Melbourne Kangaroos,2025-05-18T03:10:00Z,Line,Richmond Tigers,9.5,1.9,North Melbourne Kangaroos,-9.5,1.9,1.053,Pointsbet
Brisbane Lions v Melbourne Demons,2025-05-18T05:20:00Z,Line,Brisbane Lions,-31.5,1.9,Melbourne Demons,31.5,1.9,1.053,Pointsbet
West Coast Eagles v St Kilda Saints,2025-05-18T06:40:00Z,Line,West Coast Eagles,18.5,1.9,St Kilda Saints,-18.5,1.9,1.053,Pointsbet
