match,start_time,market_name,home_team,home_line,home_win,away_team,away_line,away_win,margin,agency
Essendon Bombers v Sydney Swans,2024-08-16T09:40:00Z,Line,Essendon Bombers,10.5,1.9,Sydney Swans,-10.5,1.9,1.053,Pointsbet
Gold Coast Suns v Melbourne Demons,2024-08-17T03:45:00Z,Line,Gold Coast Suns,-12.5,1.9,Melbourne Demons,12.5,1.9,1.053,Pointsbet
GWS Giants v Fremantle Dockers,2024-08-17T03:45:00Z,Line,GWS Giants,-11.5,1.9,Fremantle Dockers,11.5,1.9,1.053,Pointsbet
Collingwood Magpies v Brisbane Lions,2024-08-17T06:35:00Z,Line,Collingwood Magpies,8.5,1.9,Brisbane Lions,-8.5,1.9,1.053,Pointsbet
Port Adelaide Power v Adelaide Crows,2024-08-17T09:30:00Z,Line,Port Adelaide Power,-12.5,1.9,Adelaide Crows,12.5,1.9,1.053,Pointsbet
St Kilda Saints v Geelong Cats,2024-08-17T09:30:00Z,Line,St Kilda Saints,10.5,1.9,Geelong Cats,-10.5,1.9,1.053,Pointsbet
Western Bulldogs v North Melbourne Kangaroos,2024-08-18T03:10:00Z,Line,Western Bulldogs,-43.5,1.9,North Melbourne Kangaroos,43.5,1.9,1.053,Pointsbet
Hawthorn Hawks v Richmond Tigers,2024-08-18T05:20:00Z,Line,Hawthorn Hawks,-40.5,1.9,Richmond Tigers,40.5,1.9,1.053,Pointsbet
West Coast Eagles v Carlton,2024-08-18T06:40:00Z,Line,West Coast Eagles,-2.5,1.9,Carlton,2.5,1.9,1.053,Pointsbet
