match,start_time,market_name,home_team,home_line,home_win,away_team,away_line,away_win,margin,agency
Western Bulldogs v Essendon Bombers,2024-04-12T09:40:00Z,Line,Western Bulldogs,-18.5,1.9,Essendon Bombers,18.5,1.9,1.053,Pointsbet
GWS Giants v St Kilda Saints,2024-04-13T03:45:00Z,Line,GWS Giants,-20.5,1.9,St Kilda Saints,20.5,1.9,1.053,Pointsbet
Carlton v Adelaide Crows,2024-04-13T06:35:00Z,Line,Carlton,-22.5,1.9,Adelaide Crows,22.5,1.9,1.053,Pointsbet
Gold Coast Suns v Hawthorn Hawks,2024-04-13T09:30:00Z,Line,Gold Coast Suns,-24.5,1.9,Hawthorn Hawks,24.5,1.9,1.053,Pointsbet
Port Adelaide Power v Fremantle Dockers,2024-04-13T09:30:00Z,Line,Port Adelaide Power,-20.5,1.9,Fremantle Dockers,20.5,1.9,1.053,Pointsbet
Geelong Cats v North Melbourne Kangaroos,2024-04-14T03:00:00Z,Line,Geelong Cats,-59.5,1.9,North Melbourne Kangaroos,59.5,1.9,1.053,Pointsbet
West Coast Eagles v Richmond Tigers,2024-04-14T06:00:00Z,Line,West Coast Eagles,14.5,1.9,Richmond Tigers,-14.5,1.9,1.053,Pointsbet
