match,start_time,market_name,home_team,home_line,home_win,away_team,away_line,away_win,margin,agency
Brisbane Lions v Collingwood Magpies,2025-04-17T09:30:00Z,Line,Brisbane Lions,-11.5,1.9,Collingwood Magpies,11.5,1.9,1.053,Pointsbet
North Melbourne Kangaroos v Carlton,2025-04-18T05:20:00Z,Line,North Melbourne Kangaroos,17.5,1.9,Carlton,-17.5,1.9,1.053,Pointsbet
West Coast Eagles v Essendon Bombers,2025-04-18T08:10:00Z,Line,West Coast Eagles,26.5,1.9,Essendon Bombers,-26.5,1.9,1.053,Pointsbet
Melbourne Demons v Fremantle Dockers,2025-04-19T03:20:00Z,Line,Melbourne Demons,17.5,1.9,Fremantle Dockers,-17.5,1.9,1.053,Pointsbet
Adelaide Crows v GWS Giants,2025-04-19T06:15:00Z,Line,Adelaide Crows,-3.5,1.9,GWS Giants,3.5,1.9,1.053,Pointsbet
Richmond Tigers v Gold Coast Suns,2025-04-19T09:35:00Z,Line,Richmond Tigers,45.5,1.9,Gold Coast Suns,-45.5,1.9,1.053,Pointsbet
Sydney Swans v Port Adelaide Power,2025-04-20T05:20:00Z,Line,Sydney Swans,-13.5,1.9,Port Adelaide Power,13.5,1.9,1.053,Pointsbet
Western Bulldogs v St Kilda Saints,2025-04-20T09:20:00Z,Line,Western Bulldogs,-11.5,1.9,St Kilda Saints,11.5,1.9,1.053,Pointsbet
Geelong Cats v Hawthorn Hawks,2025-04-21T05:20:00Z,Line,Geelong Cats,-1.5,1.9,Hawthorn Hawks,1.5,1.9,1.053,Pointsbet
