match,start_time,market_name,home_team,home_win,away_team,away_win,margin,agency
Gold Coast Suns v Collingwood Magpies,2024-06-29T06:35:00Z,Head To Head,Gold Coast Suns,1.17,Collingwood Magpies,5,1.055,Pointsbet
Adelaide Crows v GWS Giants,2024-06-29T09:30:00Z,Head To Head,Adelaide Crows,2.05,GWS Giants,1.77,1.053,Pointsbet
Geelong Cats v Essendon Bombers,2024-06-29T09:30:00Z,Head To Head,Geelong Cats,2.2,Essendon Bombers,1.67,1.053,Pointsbet
St Kilda Saints v Port Adelaide Power,2024-06-30T03:10:00Z,Head To Head,St Kilda Saints,1.74,Port Adelaide Power,2.1,1.051,Pointsbet
Richmond Tigers v Carlton,2024-06-30T05:20:00Z,Head To Head,Richmond Tigers,8,Carlton,1.08,1.051,Pointsbet
West Coast Eagles v Hawthorn Hawks,2024-06-30T06:40:00Z,Head To Head,West Coast Eagles,2.45,Hawthorn Hawks,1.55,1.053,Pointsbet
