match,start_time,market_name,home_team,home_win,away_team,away_win,margin,agency
Melbourne Demons v Hawthorn Hawks,2025-05-10T03:20:00Z,Head To Head,Melbourne Demons,3.6,Hawthorn Hawks,1.3,1.047,Pointsbet
Essendon Bombers v Sydney Swans,2025-05-10T06:15:00Z,Head To Head,Essendon Bombers,2.25,Sydney Swans,1.65,1.051,Pointsbet
Gold Coast Suns v Western Bulldogs,2025-05-10T09:35:00Z,Head To Head,Gold Coast Suns,1.85,Western Bulldogs,1.95,1.053,Pointsbet
Port Adelaide Power v Adelaide Crows,2025-05-10T10:10:00Z,Head To Head,Port Adelaide Power,2.75,Adelaide Crows,1.45,1.053,Pointsbet
Richmond Tigers v West Coast Eagles,2025-05-11T03:10:00Z,Head To Head,Richmond Tigers,1.54,West Coast Eagles,2.5,1.049,Pointsbet
Geelong Cats v GWS Giants,2025-05-11T05:20:00Z,Head To Head,Geelong Cats,1.44,GWS Giants,2.85,1.045,Pointsbet
North Melbourne Kangaroos v Brisbane Lions,2025-05-11T06:40:00Z,Head To Head,North Melbourne Kangaroos,6,Brisbane Lions,1.13,1.052,Pointsbet
