match,start_time,market_name,home_team,home_line,home_win,away_team,away_line,away_win,margin,agency
Western Bulldogs v Sydney Swans,2024-05-23T09:30:00Z,Line,Western Bulldogs,7.5,1.9,Sydney Swans,-7.5,1.9,1.053,Pointsbet
Fremantle Dockers v Collingwood Magpies,2024-05-24T10:10:00Z,Line,Fremantle Dockers,-1.5,1.9,Collingwood Magpies,1.5,1.9,1.053,Pointsbet
Carlton v Gold Coast Suns,2024-05-25T03:45:00Z,Line,Carlton,-17.5,1.9,Gold Coast Suns,17.5,1.9,1.053,Pointsbet
North Melbourne Kangaroos v Port Adelaide Power,2024-05-25T03:45:00Z,Line,North Melbourne Kangaroos,42.5,1.9,Port Adelaide Power,-42.5,1.9,1.053,Pointsbet
Geelong Cats v GWS Giants,2024-05-25T06:35:00Z,Line,Geelong Cats,-10.5,1.9,GWS Giants,10.5,1.9,1.053,Pointsbet
Richmond Tigers v Essendon Bombers,2024-05-25T09:40:00Z,Line,Richmond Tigers,39.5,1.9,Essendon Bombers,-39.5,1.9,1.053,Pointsbet
Hawthorn Hawks v Brisbane Lions,2024-05-26T03:10:00Z,Line,Hawthorn Hawks,17.5,1.9,Brisbane Lions,-17.5,1.9,1.053,Pointsbet
Melbourne Demons v St Kilda Saints,2024-05-26T05:20:00Z,Line,Melbourne Demons,-19.5,1.9,St Kilda Saints,19.5,1.9,1.053,Pointsbet
Adelaide Crows v West Coast Eagles,2024-05-26T06:40:00Z,Line,Adelaide Crows,-28.5,1.9,West Coast Eagles,28.5,1.9,1.053,Pointsbet
