match,start_time,market_name,home_team,home_win,away_team,away_win,margin,agency
Melbourne Demons v Fremantle Dockers,2025-04-19T03:20:00Z,Head To Head,Melbourne Demons,3.8,Fremantle Dockers,1.26,1.057,Pointsbet
Adelaide Crows v GWS Giants,2025-04-19T06:15:00Z,Head To Head,Adelaide Crows,1.55,GWS Giants,2.45,1.053,Pointsbet
Richmond Tigers v Gold Coast Suns,2025-04-19T09:35:00Z,Head To Head,Richmond Tigers,8.5,Gold Coast Suns,1.07,1.052,Pointsbet
Sydney Swans v Port Adelaide Power,2025-04-20T05:20:00Z,Head To Head,Sydney Swans,1.45,Port Adelaide Power,2.6,1.074,Pointsbet
Western Bulldogs v St Kilda Saints,2025-04-20T09:20:00Z,Head To Head,Western Bulldogs,1.58,St Kilda Saints,2.4,1.05,Pointsbet
Geelong Cats v Hawthorn Hawks,2025-04-21T05:20:00Z,Head To Head,Geelong Cats,1.9,Hawthorn Hawks,1.9,1.053,Pointsbet
