match,start_time,market_name,home_team,home_line,home_win,away_team,away_line,away_win,margin,agency
St Kilda Saints v Western Bulldogs,2024-04-18T09:30:00Z,Line,St Kilda Saints,-3.5,1.9,Western Bulldogs,3.5,1.9,1.053,Pointsbet
Adelaide Crows v Essendon Bombers,2024-04-19T09:40:00Z,Line,Adelaide Crows,-12.5,1.9,Essendon Bombers,12.5,1.9,1.053,Pointsbet
Collingwood Magpies v Port Adelaide Power,2024-04-20T03:45:00Z,Line,Collingwood Magpies,-4.5,1.9,Port Adelaide Power,4.5,1.9,1.053,Pointsbet
Carlton v GWS Giants,2024-04-20T06:35:00Z,Line,Carlton,-2.5,1.9,GWS Giants,2.5,1.9,1.053,Pointsbet
Brisbane Lions v Geelong Cats,2024-04-20T09:30:00Z,Line,Brisbane Lions,-12.5,1.9,Geelong Cats,12.5,1.9,1.053,Pointsbet
West Coast Eagles v Fremantle Dockers,2024-04-20T10:10:00Z,Line,West Coast Eagles,34.5,1.9,Fremantle Dockers,-34.5,1.9,1.053,Pointsbet
Sydney Swans v Gold Coast Suns,2024-04-21T03:00:00Z,Line,Sydney Swans,-20.5,1.9,Gold Coast Suns,20.5,1.9,1.053,Pointsbet
North Melbourne Kangaroos v Hawthorn Hawks,2024-04-21T06:00:00Z,Line,North Melbourne Kangaroos,17.5,1.9,Hawthorn Hawks,-17.5,1.9,1.053,Pointsbet
