match,start_time,market_name,home_team,home_win,away_team,away_win,margin,agency
Geelong Cats v Fremantle Dockers,2025-03-15T02:20:00Z,Head To Head,Geelong Cats,1.45,Fremantle Dockers,2.75,1.053,Pointsbet
Sydney Swans v Brisbane Lions,2025-03-15T05:15:00Z,Head To Head,Sydney Swans,2.1,Brisbane Lions,1.75,1.048,Pointsbet
Western Bulldogs v North Melbourne Kangaroos,2025-03-15T08:35:00Z,Head To Head,Western Bulldogs,1.34,North Melbourne Kangaroos,3.25,1.054,Pointsbet
Collingwood Magpies v Port Adelaide Power,2025-03-15T08:35:00Z,Head To Head,Collingwood Magpies,1.6,Port Adelaide Power,2.35,1.051,Pointsbet
Adelaide Crows v St Kilda Saints,2025-03-16T01:35:00Z,Head To Head,Adelaide Crows,1.33,St Kilda Saints,3.3,1.055,Pointsbet
Melbourne Demons v GWS Giants,2025-03-16T04:20:00Z,Head To Head,Melbourne Demons,2.05,GWS Giants,1.77,1.053,Pointsbet
West Coast Eagles v Gold Coast Suns,2025-03-16T07:10:00Z,Head To Head,West Coast Eagles,2.45,Gold Coast Suns,1.55,1.053,Pointsbet
