match,start_time,market_name,home_team,home_win,away_team,away_win,margin,agency
Collingwood Magpies v Adelaide Crows,2024-05-18T03:45:00Z,Head To Head,Collingwood Magpies,1.45,Adelaide Crows,2.75,1.053,Pointsbet
GWS Giants v Western Bulldogs,2024-05-18T06:35:00Z,Head To Head,GWS Giants,1.45,Western Bulldogs,2.75,1.053,Pointsbet
St Kilda Saints v Fremantle Dockers,2024-05-18T09:30:00Z,Head To Head,St Kilda Saints,1.77,Fremantle Dockers,2.05,1.053,Pointsbet
Brisbane Lions v Richmond Tigers,2024-05-18T09:30:00Z,Head To Head,Brisbane Lions,1.05,Richmond Tigers,10,1.052,Pointsbet
Essendon Bombers v North Melbourne Kangaroos,2024-05-19T03:10:00Z,Head To Head,Essendon Bombers,1.05,North Melbourne Kangaroos,10,1.052,Pointsbet
Port Adelaide Power v Hawthorn Hawks,2024-05-19T05:20:00Z,Head To Head,Port Adelaide Power,1.13,Hawthorn Hawks,6,1.052,Pointsbet
West Coast Eagles v Melbourne Demons,2024-05-19T08:20:00Z,Head To Head,West Coast Eagles,5.5,Melbourne Demons,1.15,1.051,Pointsbet
