match,start_time,market_name,home_team,home_line,home_win,away_team,away_line,away_win,margin,agency
Hawthorn Hawks v Adelaide Crows,2024-06-01T03:45:00Z,Line,Hawthorn Hawks,-1.5,1.9,Adelaide Crows,1.5,1.9,1.053,Pointsbet
West Coast Eagles v St Kilda Saints,2024-06-01T06:35:00Z,Line,West Coast Eagles,4.5,1.9,St Kilda Saints,-4.5,1.9,1.053,Pointsbet
Geelong Cats v Richmond Tigers,2024-06-01T09:30:00Z,Line,Geelong Cats,-47.5,1.9,Richmond Tigers,47.5,1.9,1.053,Pointsbet
Melbourne Demons v Fremantle Dockers,2024-06-02T03:00:00Z,Line,Melbourne Demons,-12.5,1.9,Fremantle Dockers,12.5,1.9,1.053,Pointsbet
Gold Coast Suns v Essendon Bombers,2024-06-02T06:00:00Z,Line,Gold Coast Suns,-4.5,1.9,Essendon Bombers,4.5,1.9,1.053,Pointsbet
