match,start_time,market_name,home_team,home_line,home_win,away_team,away_line,away_win,margin,agency
Melbourne Demons v GWS Giants,2024-07-27T09:30:00Z,Line,Melbourne Demons,-0.5,1.9,GWS Giants,0.5,1.9,1.053,Pointsbet
Fremantle Dockers v West Coast Eagles,2024-07-27T10:10:00Z,Line,Fremantle Dockers,-38.5,1.9,West Coast Eagles,38.5,1.9,1.053,Pointsbet
Collingwood Magpies v Richmond Tigers,2024-07-28T03:10:00Z,Line,Collingwood Magpies,-22.5,1.9,Richmond Tigers,22.5,1.9,1.053,Pointsbet
Sydney Swans v Western Bulldogs,2024-07-28T05:20:00Z,Line,Sydney Swans,-12.5,1.9,Western Bulldogs,12.5,1.9,1.053,Pointsbet
Adelaide Crows v Hawthorn Hawks,2024-07-28T06:10:00Z,Line,Adelaide Crows,2.5,1.9,Hawthorn Hawks,-2.5,1.9,1.053,Pointsbet
