match,start_time,market_name,home_team,home_win,away_team,away_win,margin,agency
Brisbane Lions v GWS Giants,2025-06-14T03:20:00Z,Head To Head,Brisbane Lions,1.5,GWS Giants,2.5,1.067,Pointsbet
Essendon Bombers v Geelong Cats,2025-06-14T06:15:00Z,Head To Head,Essendon Bombers,5.75,Geelong Cats,1.14,1.051,Pointsbet
North Melbourne Kangaroos v Fremantle Dockers,2025-06-14T09:35:00Z,Head To Head,North Melbourne Kangaroos,5.75,Fremantle Dockers,1.14,1.051,Pointsbet
Port Adelaide Power v Melbourne Demons,2025-06-15T05:20:00Z,Head To Head,Port Adelaide Power,1.8,Melbourne Demons,2,1.056,Pointsbet
West Coast Eagles v Carlton,2025-06-15T08:10:00Z,Head To Head,West Coast Eagles,4.2,Carlton,1.23,1.051,Pointsbet
