match,start_time,market_name,home_team,home_win,away_team,away_win,margin,agency
Port Adelaide Power v Carlton,2025-06-26T09:30:00Z,Head To Head,Port Adelaide Power,1.71,Carlton,2.2,1.039,Pointsbet
Sydney Swans v Western Bulldogs,2025-06-27T09:40:00Z,Head To Head,Sydney Swans,2.35,Western Bulldogs,1.63,1.039,Pointsbet
Gold Coast Suns v Melbourne Demons,2025-06-28T03:20:00Z,Head To Head,Gold Coast Suns,1.4,Melbourne Demons,3,1.048,Pointsbet
Hawthorn Hawks v North Melbourne Kangaroos,2025-06-28T06:15:00Z,Head To Head,Hawthorn Hawks,1.15,North Melbourne Kangaroos,5.5,1.051,Pointsbet
Collingwood Magpies v West Coast Eagles,2025-06-28T09:35:00Z,Head To Head,Collingwood Magpies,1.03,West Coast Eagles,15,1.038,Pointsbet
Fremantle Dockers v St Kilda Saints,2025-06-29T07:10:00Z,Head To Head,Fremantle Dockers,1.27,St Kilda Saints,4,1.037,Pointsbet
