match,start_time,market_name,home_team,home_line,home_win,away_team,away_line,away_win,margin,agency
Brisbane Lions v Essendon Bombers,2025-05-29T09:30:00Z,Line,Brisbane Lions,-43.5,1.9,Essendon Bombers,43.5,1.9,1.053,Pointsbet
Collingwood Magpies v Hawthorn Hawks,2025-05-30T09:40:00Z,Line,Collingwood Magpies,-8.5,1.9,Hawthorn Hawks,8.5,1.9,1.053,Pointsbet
Gold Coast Suns v Fremantle Dockers,2025-05-31T03:20:00Z,Line,Gold Coast Suns,-16.5,1.9,Fremantle Dockers,16.5,1.9,1.053,Pointsbet
GWS Giants v Richmond Tigers,2025-05-31T06:15:00Z,Line,GWS Giants,-45.5,1.9,Richmond Tigers,45.5,1.9,1.053,Pointsbet
Sydney Swans v Adelaide Crows,2025-05-31T09:35:00Z,Line,Sydney Swans,6.5,1.9,Adelaide Crows,-6.5,1.9,1.053,Pointsbet
Melbourne Demons v St Kilda Saints,2025-06-01T05:20:00Z,Line,Melbourne Demons,-12.5,1.9,St Kilda Saints,12.5,1.9,1.053,Pointsbet
West Coast Eagles v Geelong Cats,2025-06-01T09:20:00Z,Line,West Coast Eagles,40.5,1.9,Geelong Cats,-40.5,1.9,1.053,Pointsbet
