match,start_time,market_name,home_team,home_line,home_win,away_team,away_line,away_win,margin,agency
St Kilda Saints v Fremantle Dockers,2025-05-02T09:40:00Z,Line,St Kilda Saints,8.5,1.9,Fremantle Dockers,-8.5,1.9,1.053,Pointsbet
Western Bulldogs v Port Adelaide Power,2025-05-03T03:20:00Z,Line,Western Bulldogs,-20.5,1.9,Port Adelaide Power,20.5,1.9,1.053,Pointsbet
Adelaide Crows v Carlton,2025-05-03T06:15:00Z,Line,Adelaide Crows,-11.5,1.9,Carlton,11.5,1.9,1.053,Pointsbet
Collingwood Magpies v Geelong Cats,2025-05-03T09:35:00Z,Line,Collingwood Magpies,-11.5,1.9,Geelong Cats,11.5,1.9,1.053,Pointsbet
West Coast Eagles v Melbourne Demons,2025-05-03T09:35:00Z,Line,West Coast Eagles,14.5,1.9,Melbourne Demons,-14.5,1.9,1.053,Pointsbet
Sydney Swans v GWS Giants,2025-05-04T03:10:00Z,Line,Sydney Swans,9.5,1.9,GWS Giants,-9.5,1.9,1.053,Pointsbet
Hawthorn Hawks v Richmond Tigers,2025-05-04T05:20:00Z,Line,Hawthorn Hawks,-47.5,1.9,Richmond Tigers,47.5,1.9,1.053,Pointsbet
Brisbane Lions v Gold Coast Suns,2025-05-04T09:20:00Z,Line,Brisbane Lions,-7.5,1.9,Gold Coast Suns,7.5,1.9,1.053,Pointsbet
