match,start_time,market_name,home_team,home_win,away_team,away_win,margin,agency
Fremantle Dockers v Essendon Bombers,2025-06-19T10:10:00Z,Head To Head,Fremantle Dockers,1.17,Essendon Bombers,5.25,1.045,Pointsbet
Geelong Cats v Brisbane Lions,2025-06-20T09:40:00Z,Head To Head,Geelong Cats,1.42,Brisbane Lions,2.9,1.049,Pointsbet
Carlton v North Melbourne Kangaroos,2025-06-21T03:20:00Z,Head To Head,Carlton,1.27,North Melbourne Kangaroos,4,1.037,Pointsbet
Port Adelaide Power v Sydney Swans,2025-06-21T06:15:00Z,Head To Head,Port Adelaide Power,1.59,Sydney Swans,2.4,1.046,Pointsbet
Collingwood Magpies v St Kilda Saints,2025-06-21T09:35:00Z,Head To Head,Collingwood Magpies,1.17,St Kilda Saints,5.25,1.045,Pointsbet
GWS Giants v Gold Coast Suns,2025-06-22T03:10:00Z,Head To Head,GWS Giants,1.77,Gold Coast Suns,2.1,1.041,Pointsbet
Western Bulldogs v Richmond Tigers,2025-06-22T05:20:00Z,Head To Head,Western Bulldogs,1.06,Richmond Tigers,11.5,1.03,Pointsbet
