match,start_time,market_name,home_team,home_win,away_team,away_win,margin,agency
Essendon Bombers v Port Adelaide Power,2025-03-27T08:30:00Z,Head To Head,Essendon Bombers,2.35,Port Adelaide Power,1.6,1.051,Pointsbet
Carlton v Western Bulldogs,2025-03-28T08:40:00Z,Head To Head,Carlton,1.9,Western Bulldogs,1.9,1.053,Pointsbet
Melbourne Demons v Gold Coast Suns,2025-03-29T02:20:00Z,Head To Head,Melbourne Demons,1.85,Gold Coast Suns,1.95,1.053,Pointsbet
St Kilda Saints v Richmond Tigers,2025-03-29T05:15:00Z,Head To Head,St Kilda Saints,1.25,Richmond Tigers,4,1.05,Pointsbet
Brisbane Lions v Geelong Cats,2025-03-29T08:35:00Z,Head To Head,Brisbane Lions,1.45,Geelong Cats,2.75,1.053,Pointsbet
Hawthorn Hawks v GWS Giants,2025-03-29T08:35:00Z,Head To Head,Hawthorn Hawks,1.5,GWS Giants,2.6,1.051,Pointsbet
Adelaide Crows v North Melbourne Kangaroos,2025-03-30T04:20:00Z,Head To Head,Adelaide Crows,1.1,North Melbourne Kangaroos,7,1.052,Pointsbet
West Coast Eagles v Fremantle Dockers,2025-03-30T07:10:00Z,Head To Head,West Coast Eagles,4,Fremantle Dockers,1.25,1.05,Pointsbet
