match,start_time,market_name,home_team,home_win,away_team,away_win,margin,agency
Collingwood Magpies v Adelaide Crows,2025-05-17T03:19:00Z,Head To Head,Collingwood Magpies,1.36,Adelaide Crows,3.15,1.053,Pointsbet
Port Adelaide Power v Geelong Cats,2025-05-17T06:15:00Z,Head To Head,Port Adelaide Power,2.3,Geelong Cats,1.62,1.052,Pointsbet
GWS Giants v Fremantle Dockers,2025-05-17T06:15:00Z,Head To Head,GWS Giants,1.37,Fremantle Dockers,3.1,1.053,Pointsbet
Western Bulldogs v Essendon Bombers,2025-05-17T09:35:00Z,Head To Head,Western Bulldogs,1.25,Essendon Bombers,4,1.05,Pointsbet
Richmond Tigers v North Melbourne Kangaroos,2025-05-18T03:10:00Z,Head To Head,Richmond Tigers,2.4,North Melbourne Kangaroos,1.59,1.046,Pointsbet
Brisbane Lions v Melbourne Demons,2025-05-18T05:20:00Z,Head To Head,Brisbane Lions,1.17,Melbourne Demons,5.25,1.045,Pointsbet
West Coast Eagles v St Kilda Saints,2025-05-18T06:40:00Z,Head To Head,West Coast Eagles,3.2,St Kilda Saints,1.36,1.048,Pointsbet
