match,market_name,home_team,home_line,home_win,away_team,away_line,away_win,margin,agency
Western Bulldogs v Richmond Tigers,Line,Western Bulldogs,-52.5,1.9,Richmond Tigers,52.5,1.9,1.053,Sportsbet
Port Adelaide Power v Carlton,Line,Port Adelaide Power,-4.5,1.9,Carlton,4.5,1.9,1.053,Sportsbet
Sydney Swans v Western Bulldogs,Line,Sydney Swans,9.5,1.9,Western Bulldogs,-9.5,1.9,1.053,Sportsbet
Hawthorn Hawks v North Melbourne Kangaroos,Line,Hawthorn Hawks,-33.5,1.9,North Melbourne Kangaroos,33.5,1.9,1.053,Sportsbet
Collingwood Magpies v West Coast Eagles,Line,Collingwood Magpies,-55.5,1.9,West Coast Eagles,55.5,1.9,1.053,Sportsbet
Richmond Tigers v Adelaide Crows,Line,Richmond Tigers,32.5,1.9,Adelaide Crows,-32.5,1.9,1.053,Sportsbet
Fremantle Dockers v St Kilda Saints,Line,Fremantle Dockers,-21.5,1.9,St Kilda Saints,21.5,1.9,1.053,Sportsbet
