match,market_name,home_team,home_win,away_team,away_win,margin,agency
Adelaide Crows v Melbourne Demons,Head To Head,Adelaide Crows,2.3,Melbourne Demons,1.63,1.048,Sportsbet
Brisbane Lions v North Melbourne Kangaroos,Head To Head,Brisbane Lions,1.13,North Melbourne Kangaroos,6.05,1.05,Sportsbet
Port Adelaide Power v Essendon Bombers,Head To Head,Port Adelaide Power,1.29,Essendon Bombers,3.66,1.048,Sportsbet
West Coast Eagles v Sydney Swans,Head To Head,West Coast Eagles,11,Sydney Swans,1.04,1.052,Sportsbet
Fremantle Dockers v Carlton,Head To Head,Fremantle Dockers,2.27,Carlton,1.64,1.05,Sportsbet
Western Bulldogs v Geelong Cats,Head To Head,Western Bulldogs,2.04,Geelong Cats,1.81,1.043,Sportsbet
Gold Coast Suns v GWS Giants,Head To Head,Gold Coast Suns,3.05,GWS Giants,1.38,1.053,Sportsbet
Richmond Tigers v St Kilda Saints,Head To Head,Richmond Tigers,3.73,St Kilda Saints,1.28,1.049,Sportsbet
Collingwood Magpies v Hawthorn Hawks,Head To Head,Collingwood Magpies,1.26,Hawthorn Hawks,3.9,1.05,Sportsbet
