match,market_name,home_team,home_win,away_team,away_win,margin,agency
St Kilda Saints v Collingwood Magpies,Head To Head,St Kilda Saints,2.37,Collingwood Magpies,1.59,1.051,Sportsbet
Adelaide Crows v Geelong Cats,Head To Head,Adelaide Crows,1.49,Geelong Cats,2.64,1.05,Sportsbet
North Melbourne Kangaroos v Fremantle Dockers,Head To Head,North Melbourne Kangaroos,2.79,Fremantle Dockers,1.45,1.048,Sportsbet
Hawthorn Hawks v Melbourne Demons,Head To Head,Hawthorn Hawks,4.1,Melbourne Demons,1.24,1.05,Sportsbet
Sydney Swans v Essendon Bombers,Head To Head,Sydney Swans,1.18,Essendon Bombers,4.9,1.052,Sportsbet
Western Bulldogs v Gold Coast Suns,Head To Head,Western Bulldogs,1.59,Gold Coast Suns,2.38,1.049,Sportsbet
Richmond Tigers v Port Adelaide Power,Head To Head,Richmond Tigers,2.65,Port Adelaide Power,1.49,1.048,Sportsbet
West Coast Eagles v GWS Giants,Head To Head,West Coast Eagles,9.3,GWS Giants,1.06,1.051,Sportsbet
