match,market_name,home_team,home_win,away_team,away_win,margin,agency
Brisbane Lions v St Kilda Saints,Head To Head,Brisbane Lions,1.21,St Kilda Saints,4.45,1.051,Sportsbet
Western Bulldogs v Fremantle Dockers,Head To Head,Western Bulldogs,1.69,Fremantle Dockers,2.18,1.05,Sportsbet
Richmond Tigers v Hawthorn Hawks,Head To Head,Richmond Tigers,2.69,Hawthorn Hawks,1.47,1.052,Sportsbet
Adelaide Crows v Sydney Swans,Head To Head,Adelaide Crows,3.21,Sydney Swans,1.35,1.052,Sportsbet
North Melbourne Kangaroos v Collingwood Magpies,Head To Head,North Melbourne Kangaroos,7,Collingwood Magpies,1.1,1.052,Sportsbet
GWS Giants v Port Adelaide Power,Head To Head,GWS Giants,1.56,Port Adelaide Power,2.45,1.049,Sportsbet
