match,market_name,home_team,home_win,away_team,away_win,margin,agency
Adelaide Crows v Richmond Tigers,Head To Head,Adelaide Crows,1.14,Richmond Tigers,5.5,1.059,Sportsbet
Western Bulldogs v Brisbane Lions,Head To Head,Western Bulldogs,1.56,Brisbane Lions,2.44,1.051,Sportsbet
Hawthorn Hawks v GWS Giants,Head To Head,Hawthorn Hawks,2.31,GWS Giants,1.62,1.05,Sportsbet
West Coast Eagles v North Melbourne Kangaroos,Head To Head,West Coast Eagles,1.29,North Melbourne Kangaroos,3.63,1.051,Sportsbet
St Kilda Saints v Gold Coast Suns,Head To Head,St Kilda Saints,2.07,Gold Coast Suns,1.79,1.042,Sportsbet
Sydney Swans v Geelong Cats,Head To Head,Sydney Swans,1.35,Geelong Cats,3.25,1.048,Sportsbet
Essendon Bombers v Carlton,Head To Head,Essendon Bombers,2.6,Carlton,1.5,1.051,Sportsbet
Collingwood Magpies v Melbourne Demons,Head To Head,Collingwood Magpies,1.9,Melbourne Demons,1.94,1.042,Sportsbet
