match,market_name,home_team,home_win,away_team,away_win,margin,agency
Brisbane Lions v Essendon Bombers,Head To Head,Brisbane Lions,1.13,Essendon Bombers,5.75,1.059,Sportsbet
Sydney Swans v Adelaide Crows,Head To Head,Sydney Swans,1.37,Adelaide Crows,3.02,1.061,Sportsbet
Western Bulldogs v GWS Giants,Head To Head,Western Bulldogs,1.48,GWS Giants,2.6,1.06,Sportsbet
Carlton v St Kilda Saints,Head To Head,Carlton,2.1,St Kilda Saints,1.72,1.058,Sportsbet
Fremantle Dockers v Port Adelaide Power,Head To Head,Fremantle Dockers,1.84,Port Adelaide Power,1.96,1.054,Sportsbet
