match,market_name,home_team,home_line,home_win,away_team,away_line,away_win,margin,agency
Port Adelaide Power v Carlton,Line,Port Adelaide Power,-5.5,1.9,Carlton,5.5,1.9,1.053,Sportsbet
Sydney Swans v Western Bulldogs,Line,Sydney Swans,8.5,1.9,Western Bulldogs,-8.5,1.9,1.053,Sportsbet
Gold Coast Suns v Melbourne Demons,Line,Gold Coast Suns,-17.5,1.9,Melbourne Demons,17.5,1.9,1.053,Sportsbet
Hawthorn Hawks v North Melbourne Kangaroos,Line,Hawthorn Hawks,-32.5,1.9,North Melbourne Kangaroos,32.5,1.9,1.053,Sportsbet
Collingwood Magpies v West Coast Eagles,Line,Collingwood Magpies,-60.5,1.9,West Coast Eagles,60.5,1.9,1.053,Sportsbet
Richmond Tigers v Adelaide Crows,Line,Richmond Tigers,37.5,1.9,Adelaide Crows,-37.5,1.9,1.053,Sportsbet
Fremantle Dockers v St Kilda Saints,Line,Fremantle Dockers,-22.5,1.9,St Kilda Saints,22.5,1.9,1.053,Sportsbet
