match,market_name,home_team,home_win,away_team,away_win,margin,agency
Gold Coast Suns v Geelong Cats,Head To Head,Gold Coast Suns,2,Geelong Cats,1.8,1.056,Sportsbet
Sydney Swans v Carlton,Head To Head,Sydney Swans,1.44,Carlton,2.73,1.061,Sportsbet
Collingwood Magpies v Adelaide Crows,Head To Head,Collingwood Magpies,1.34,Adelaide Crows,3.29,1.05,Sportsbet
GWS Giants v Western Bulldogs,Head To Head,GWS Giants,1.45,Western Bulldogs,2.78,1.049,Sportsbet
Brisbane Lions v Richmond Tigers,Head To Head,Brisbane Lions,1.05,Richmond Tigers,10.5,1.048,Sportsbet
St Kilda Saints v Fremantle Dockers,Head To Head,St Kilda Saints,1.8,Fremantle Dockers,2.05,1.043,Sportsbet
Essendon Bombers v North Melbourne Kangaroos,Head To Head,Essendon Bombers,1.05,North Melbourne Kangaroos,10.5,1.048,Sportsbet
Port Adelaide Power v Hawthorn Hawks,Head To Head,Port Adelaide Power,1.15,Hawthorn Hawks,5.5,1.051,Sportsbet
West Coast Eagles v Melbourne Demons,Head To Head,West Coast Eagles,5.1,Melbourne Demons,1.17,1.051,Sportsbet
