match,market_name,home_team,home_win,away_team,away_win,margin,agency
Melbourne Demons v Brisbane Lions,Head To Head,Melbourne Demons,1.43,Brisbane Lions,2.86,1.049,Sportsbet
Western Bulldogs v Essendon Bombers,Head To Head,Western Bulldogs,1.45,Essendon Bombers,2.76,1.052,Sportsbet
GWS Giants v St Kilda Saints,Head To Head,GWS Giants,1.32,St Kilda Saints,3.4,1.052,Sportsbet
Carlton v Adelaide Crows,Head To Head,Carlton,1.27,Adelaide Crows,3.78,1.052,Sportsbet
Port Adelaide Power v Fremantle Dockers,Head To Head,Port Adelaide Power,1.35,Fremantle Dockers,3.25,1.048,Sportsbet
Gold Coast Suns v Hawthorn Hawks,Head To Head,Gold Coast Suns,1.22,Hawthorn Hawks,4.35,1.05,Sportsbet
Geelong Cats v North Melbourne Kangaroos,Head To Head,Geelong Cats,1.03,North Melbourne Kangaroos,12.5,1.051,Sportsbet
West Coast Eagles v Richmond Tigers,Head To Head,West Coast Eagles,3.34,Richmond Tigers,1.33,1.051,Sportsbet
