match,market_name,home_team,home_win,away_team,away_win,margin,agency
Carlton v Melbourne Demons,Head To Head,Carlton,2.03,Melbourne Demons,1.78,1.054,Sportsbet
Geelong Cats v Port Adelaide Power,Head To Head,Geelong Cats,1.28,Port Adelaide Power,3.6,1.059,Sportsbet
Fremantle Dockers v Sydney Swans,Head To Head,Fremantle Dockers,2.25,Sydney Swans,1.63,1.058,Sportsbet
Hawthorn Hawks v St Kilda Saints,Head To Head,Hawthorn Hawks,2.48,St Kilda Saints,1.54,1.053,Sportsbet
Essendon Bombers v GWS Giants,Head To Head,Essendon Bombers,2.31,GWS Giants,1.62,1.05,Sportsbet
Richmond Tigers v Western Bulldogs,Head To Head,Richmond Tigers,3.29,Western Bulldogs,1.34,1.05,Sportsbet
Gold Coast Suns v North Melbourne Kangaroos,Head To Head,Gold Coast Suns,1.09,North Melbourne Kangaroos,7.5,1.051,Sportsbet
Collingwood Magpies v West Coast Eagles,Head To Head,Collingwood Magpies,1.11,West Coast Eagles,6.7,1.05,Sportsbet
Adelaide Crows v Brisbane Lions,Head To Head,Adelaide Crows,1.66,Brisbane Lions,2.23,1.051,Sportsbet
