match,market_name,home_team,home_line,home_win,away_team,away_line,away_win,margin,agency
Brisbane Lions v Essendon Bombers,Line,Brisbane Lions,-37.5,1.9,Essendon Bombers,37.5,1.9,1.053,Sportsbet
Sydney Swans v Adelaide Crows,Line,Sydney Swans,-20.5,1.9,Adelaide Crows,20.5,1.9,1.053,Sportsbet
Western Bulldogs v GWS Giants,Line,Western Bulldogs,-13.5,1.9,GWS Giants,13.5,1.9,1.053,Sportsbet
Carlton v St Kilda Saints,Line,Carlton,4.5,1.9,St Kilda Saints,-4.5,1.9,1.053,Sportsbet
Fremantle Dockers v Port Adelaide Power,Line,Fremantle Dockers,-1.5,1.9,Port Adelaide Power,1.5,1.9,1.053,Sportsbet
