match,market_name,home_team,home_win,away_team,away_win,margin,agency
Fremantle Dockers v Geelong Cats,Head To Head,Fremantle Dockers,1.78,Geelong Cats,1.95,1.075,Sportsbet
Essendon Bombers v Gold Coast Suns,Head To Head,Essendon Bombers,1.5,Gold Coast Suns,2.54,1.06,Sportsbet
Melbourne Demons v Port Adelaide Power,Head To Head,Melbourne Demons,3.06,Port Adelaide Power,1.36,1.062,Sportsbet
Carlton v Hawthorn Hawks,Head To Head,Carlton,1.9,Hawthorn Hawks,1.9,1.053,Sportsbet
Richmond Tigers v St Kilda Saints,Head To Head,Richmond Tigers,4.05,St Kilda Saints,1.23,1.06,Sportsbet
Adelaide Crows v Western Bulldogs,Head To Head,Adelaide Crows,2.94,Western Bulldogs,1.39,1.06,Sportsbet
