match,market_name,home_team,home_line,home_win,away_team,away_line,away_win,margin,agency
Sydney Swans v Gold Coast Suns,Line,Sydney Swans,-18.5,1.9,Gold Coast Suns,18.5,1.9,1.053,Sportsbet
North Melbourne Kangaroos v Hawthorn Hawks,Line,North Melbourne Kangaroos,16.5,1.9,Hawthorn Hawks,-16.5,1.9,1.053,Sportsbet
Richmond Tigers v Melbourne Demons,Line,Richmond Tigers,26.5,1.9,Melbourne Demons,-26.5,1.9,1.053,Sportsbet
Essendon Bombers v Collingwood Magpies,Line,Essendon Bombers,11.5,1.9,Collingwood Magpies,-11.5,1.9,1.053,Sportsbet
Port Adelaide Power v St Kilda Saints,Line,Port Adelaide Power,-17.5,1.9,St Kilda Saints,17.5,1.9,1.053,Sportsbet
North Melbourne Kangaroos v Adelaide Crows,Line,North Melbourne Kangaroos,27.5,1.9,Adelaide Crows,-27.5,1.9,1.053,Sportsbet
Hawthorn Hawks v Sydney Swans,Line,Hawthorn Hawks,24.5,1.9,Sydney Swans,-24.5,1.9,1.053,Sportsbet
