match,market_name,home_team,home_line,home_win,away_team,away_line,away_win,margin,agency
Carlton v Richmond Tigers,Line,Carlton,-19.5,1.9,Richmond Tigers,19.5,1.9,1.053,Sportsbet
Collingwood Magpies v Sydney Swans,Line,Collingwood Magpies,-11.5,1.9,Sydney Swans,11.5,1.9,1.053,Sportsbet
Essendon Bombers v Hawthorn Hawks,Line,Essendon Bombers,-7.5,1.9,Hawthorn Hawks,7.5,1.9,1.053,Sportsbet
GWS Giants v North Melbourne Kangaroos,Line,GWS Giants,-45.5,1.9,North Melbourne Kangaroos,45.5,1.9,1.053,Sportsbet
Geelong Cats v St Kilda Saints,Line,Geelong Cats,-11.5,1.9,St Kilda Saints,11.5,1.9,1.053,Sportsbet
Gold Coast Suns v Adelaide Crows,Line,Gold Coast Suns,-5.5,1.9,Adelaide Crows,5.5,1.9,1.053,Sportsbet
Melbourne Demons v Western Bulldogs,Line,Melbourne Demons,-7.5,1.9,Western Bulldogs,7.5,1.9,1.053,Sportsbet
Port Adelaide Power v West Coast Eagles,Line,Port Adelaide Power,-45.5,1.9,West Coast Eagles,45.5,1.9,1.053,Sportsbet
Fremantle Dockers v Brisbane Lions,Line,Fremantle Dockers,13.5,1.9,Brisbane Lions,-13.5,1.9,1.053,Sportsbet
