match,market_name,home_team,home_win,away_team,away_win,margin,agency
Collingwood Magpies v Essendon Bombers,Head To Head,Collingwood Magpies,1.52,Essendon Bombers,2.53,1.053,Sportsbet
North Melbourne Kangaroos v Gold Coast Suns,Head To Head,North Melbourne Kangaroos,2.92,Gold Coast Suns,1.42,1.047,Sportsbet
Port Adelaide Power v Western Bulldogs,Head To Head,Port Adelaide Power,2.04,Western Bulldogs,1.81,1.043,Sportsbet
Geelong Cats v Hawthorn Hawks,Head To Head,Geelong Cats,1.58,Hawthorn Hawks,2.39,1.051,Sportsbet
GWS Giants v Carlton,Head To Head,GWS Giants,2.1,Carlton,1.77,1.041,Sportsbet
Fremantle Dockers v Richmond Tigers,Head To Head,Fremantle Dockers,1.08,Richmond Tigers,8,1.051,Sportsbet
Melbourne Demons v West Coast Eagles,Head To Head,Melbourne Demons,1.14,West Coast Eagles,5.75,1.051,Sportsbet
St Kilda Saints v Sydney Swans,Head To Head,St Kilda Saints,3.44,Sydney Swans,1.32,1.048,Sportsbet
Brisbane Lions v Adelaide Crows,Head To Head,Brisbane Lions,1.22,Adelaide Crows,4.35,1.05,Sportsbet
