match,start_time,market_name,home_team,home_line,home_win,away_team,away_line,away_win,margin,agency
North Melbourne Kangaroos v Brisbane Lions,2025-05-11T06:42:00.000Z,Line,North Melbourne Kangaroos,39.5,1.9,Brisbane Lions,-39.5,1.9,1.053,TAB
Gold Coast Suns v Hawthorn Hawks,2025-05-15T09:30:00.000Z,Line,Gold Coast Suns,-1.5,1.9,Hawthorn Hawks,1.5,1.9,1.053,TAB
Sydney Swans v Carlton,2025-05-16T09:40:00.000Z,Line,Sydney Swans,-6.5,1.9,Carlton,6.5,1.9,1.053,TAB
Collingwood Magpies v Adelaide Crows,2025-05-17T03:20:00.000Z,Line,Collingwood Magpies,-15.5,1.9,Adelaide Crows,15.5,1.9,1.053,TAB
Western Bulldogs v Essendon Bombers,2025-05-17T09:35:00.000Z,Line,Western Bulldogs,-24.5,1.9,Essendon Bombers,24.5,1.9,1.053,TAB
Richmond Tigers v North Melbourne Kangaroos,2025-05-18T03:10:00.000Z,Line,Richmond Tigers,6.5,1.9,North Melbourne Kangaroos,-6.5,1.9,1.053,TAB
Brisbane Lions v Melbourne Demons,2025-05-18T05:20:00.000Z,Line,Brisbane Lions,-32.5,1.9,Melbourne Demons,32.5,1.9,1.053,TAB
West Coast Eagles v St Kilda Saints,2025-05-18T06:40:00.000Z,Line,West Coast Eagles,19.5,1.9,St Kilda Saints,-19.5,1.9,1.053,TAB
