match,start_time,market_name,home_team,home_win,away_team,away_win,margin,agency
Essendon Bombers v Sydney Swans,2024-08-16T09:40:00.000Z,Head To Head,Essendon Bombers,2.45,Sydney Swans,1.55,1.053,TAB
GWS Giants v Fremantle Dockers,2024-08-17T03:45:00.000Z,Head To Head,GWS Giants,1.5,Fremantle Dockers,2.6,1.051,TAB
Gold Coast Suns v Melbourne Demons,2024-08-17T03:45:00.000Z,Head To Head,Gold Coast Suns,1.45,Melbourne Demons,2.75,1.053,TAB
Collingwood Magpies v Brisbane Lions,2024-08-17T06:35:00.000Z,Head To Head,Collingwood Magpies,2.4,Brisbane Lions,1.58,1.05,TAB
Port Adelaide Power v Adelaide Crows,2024-08-17T09:30:00.000Z,Head To Head,Port Adelaide Power,1.4,Adelaide Crows,3,1.048,TAB
St Kilda Saints v Geelong Cats,2024-08-17T09:30:00.000Z,Head To Head,St Kilda Saints,2.65,Geelong Cats,1.48,1.053,TAB
Western Bulldogs v North Melbourne Kangaroos,2024-08-18T03:10:00.000Z,Head To Head,Western Bulldogs,1.09,North Melbourne Kangaroos,7.5,1.051,TAB
Hawthorn Hawks v Richmond Tigers,2024-08-18T05:20:00.000Z,Head To Head,Hawthorn Hawks,1.08,Richmond Tigers,8,1.051,TAB
West Coast Eagles v Carlton,2024-08-18T06:40:00.000Z,Head To Head,West Coast Eagles,1.85,Carlton,1.95,1.053,TAB
