match,start_time,market_name,home_team,away_team,line,over_price,under_price,margin,agency
St Kilda Saints v Western Bulldogs,2025-06-12T09:30:00.000Z,Total Points,St Kilda Saints,Western Bulldogs,169.5,1.9,1.9,1.053,TAB
Hawthorn Hawks v Adelaide Crows,2025-06-13T09:40:00.000Z,Total Points,Hawthorn Hawks,Adelaide Crows,155.5,1.9,1.9,1.053,TAB
Brisbane Lions v GWS Giants,2025-06-14T03:20:00.000Z,Total Points,Brisbane Lions,GWS Giants,168.5,1.9,1.9,1.053,TAB
Essendon Bombers v Geelong Cats,2025-06-14T06:15:00.000Z,Total Points,Essendon Bombers,Geelong Cats,166.5,1.9,1.9,1.053,TAB
North Melbourne Kangaroos v Fremantle Dockers,2025-06-14T09:35:00.000Z,Total Points,North Melbourne Kangaroos,Fremantle Dockers,167.5,1.9,1.9,1.053,TAB
Port Adelaide Power v Melbourne Demons,2025-06-15T05:20:00.000Z,Total Points,Port Adelaide Power,Melbourne Demons,155.5,1.9,1.9,1.053,TAB
