match,start_time,market_name,home_team,home_win,away_team,away_win,margin,agency
Gold Coast Suns v Hawthorn Hawks,2025-05-15T09:30:00.000Z,Head To Head,Gold Coast Suns,1.67,Hawthorn Hawks,2.2,1.053,TAB
Sydney Swans v Carlton,2025-05-16T09:40:00.000Z,Head To Head,Sydney Swans,1.7,Carlton,2.15,1.053,TAB
Collingwood Magpies v Adelaide Crows,2025-05-17T03:20:00.000Z,Head To Head,Collingwood Magpies,1.43,Adelaide Crows,2.85,1.05,TAB
GWS Giants v Fremantle Dockers,2025-05-17T06:15:00.000Z,Head To Head,GWS Giants,1.38,Fremantle Dockers,3.1,1.047,TAB
Port Adelaide Power v Geelong Cats,2025-05-17T06:15:00.000Z,Head To Head,Port Adelaide Power,2.2,Geelong Cats,1.67,1.053,TAB
Western Bulldogs v Essendon Bombers,2025-05-17T09:35:00.000Z,Head To Head,Western Bulldogs,1.29,Essendon Bombers,3.6,1.053,TAB
Richmond Tigers v North Melbourne Kangaroos,2025-05-18T03:10:00.000Z,Head To Head,Richmond Tigers,2.4,North Melbourne Kangaroos,1.58,1.05,TAB
Brisbane Lions v Melbourne Demons,2025-05-18T05:20:00.000Z,Head To Head,Brisbane Lions,1.17,Melbourne Demons,5,1.055,TAB
West Coast Eagles v St Kilda Saints,2025-05-18T06:40:00.000Z,Head To Head,West Coast Eagles,3.15,St Kilda Saints,1.37,1.047,TAB
