match,start_time,market_name,home_team,home_win,away_team,away_win,margin,agency
St Kilda Saints v Collingwood Magpies,2024-03-21T08:30:00.000Z,Head To Head,St Kilda Saints,2.4,Collingwood Magpies,1.58,1.05,TAB
Adelaide Crows v Geelong Cats,2024-03-22T08:40:00.000Z,Head To Head,Adelaide Crows,1.5,Geelong Cats,2.6,1.051,TAB
North Melbourne Kangaroos v Fremantle Dockers,2024-03-23T02:45:00.000Z,Head To Head,North Melbourne Kangaroos,2.75,Fremantle Dockers,1.45,1.053,TAB
Hawthorn Hawks v Melbourne Demons,2024-03-23T05:35:00.000Z,Head To Head,Hawthorn Hawks,3.9,Melbourne Demons,1.26,1.05,TAB
Sydney Swans v Essendon Bombers,2024-03-23T08:30:00.000Z,Head To Head,Sydney Swans,1.18,Essendon Bombers,4.8,1.056,TAB
Western Bulldogs v Gold Coast Suns,2024-03-24T02:00:00.000Z,Head To Head,Western Bulldogs,1.62,Gold Coast Suns,2.3,1.052,TAB
Richmond Tigers v Port Adelaide Power,2024-03-24T05:00:00.000Z,Head To Head,Richmond Tigers,2.6,Port Adelaide Power,1.5,1.051,TAB
West Coast Eagles v GWS Giants,2024-03-24T07:50:00.000Z,Head To Head,West Coast Eagles,8,GWS Giants,1.08,1.051,TAB
