match,start_time,market_name,home_team,home_line,home_win,away_team,away_line,away_win,margin,agency
St Kilda Saints v Western Bulldogs,2025-06-12T09:30:00.000Z,Line,St Kilda Saints,20.5,1.9,Western Bulldogs,-20.5,1.9,1.053,TAB
Hawthorn Hawks v Adelaide Crows,2025-06-13T09:40:00.000Z,Line,Hawthorn Hawks,-2.5,1.95,Adelaide Crows,2.5,1.85,1.053,TAB
Brisbane Lions v GWS Giants,2025-06-14T03:20:00.000Z,Line,Brisbane Lions,-19.5,1.9,GWS Giants,19.5,1.9,1.053,TAB
Essendon Bombers v Geelong Cats,2025-06-14T06:15:00.000Z,Line,Essendon Bombers,29.5,1.9,Geelong Cats,-29.5,1.9,1.053,TAB
North Melbourne Kangaroos v Fremantle Dockers,2025-06-14T09:35:00.000Z,Line,North Melbourne Kangaroos,31.5,1.9,Fremantle Dockers,-31.5,1.9,1.053,TAB
Port Adelaide Power v Melbourne Demons,2025-06-15T05:20:00.000Z,Line,Port Adelaide Power,-2.5,1.9,Melbourne Demons,2.5,1.9,1.053,TAB
West Coast Eagles v Carlton,2025-06-15T08:10:00.000Z,Line,West Coast Eagles,25.5,1.9,Carlton,-25.5,1.9,1.053,TAB
