match,start_time,market_name,home_team,away_team,line,over_price,under_price,margin,agency
Brisbane Lions v Essendon Bombers,2025-05-29T09:30:00.000Z,Total Points,Brisbane Lions,Essendon Bombers,174.5,1.9,1.9,1.053,TAB
Collingwood Magpies v Hawthorn Hawks,2025-05-30T09:40:00.000Z,Total Points,Collingwood Magpies,Hawthorn Hawks,169.5,1.9,1.9,1.053,TAB
Gold Coast Suns v Fremantle Dockers,2025-05-31T03:20:00.000Z,Total Points,Gold Coast Suns,Fremantle Dockers,170.5,1.9,1.9,1.053,TAB
GWS Giants v Richmond Tigers,2025-05-31T06:15:00.000Z,Total Points,GWS Giants,Richmond Tigers,174.5,1.9,1.9,1.053,TAB
Sydney Swans v Adelaide Crows,2025-05-31T09:35:00.000Z,Total Points,Sydney Swans,Adelaide Crows,175.5,1.9,1.9,1.053,TAB
Melbourne Demons v St Kilda Saints,2025-06-01T05:20:00.000Z,Total Points,Melbourne Demons,St Kilda Saints,169.5,1.9,1.9,1.053,TAB
West Coast Eagles v Geelong Cats,2025-06-01T09:20:00.000Z,Total Points,West Coast Eagles,Geelong Cats,171.5,1.9,1.9,1.053,TAB
