match,start_time,market_name,home_team,home_line,home_win,away_team,away_line,away_win,margin,agency
Carlton v Geelong Cats,2024-06-21T09:40:00.000Z,Line,Carlton,-9.5,1.9,Geelong Cats,9.5,1.9,1.053,TAB
Port Adelaide Power v Brisbane Lions,2024-06-22T03:45:00.000Z,Line,Port Adelaide Power,-2.5,1.9,Brisbane Lions,2.5,1.9,1.053,TAB
GWS Giants v Sydney Swans,2024-06-22T06:35:00.000Z,Line,GWS Giants,12.5,1.9,Sydney Swans,-12.5,1.9,1.053,TAB
Melbourne Demons v North Melbourne Kangaroos,2024-06-22T09:30:00.000Z,Line,Melbourne Demons,-32.5,1.9,North Melbourne Kangaroos,32.5,1.9,1.053,TAB
Essendon Bombers v West Coast Eagles,2024-06-23T03:00:00.000Z,Line,Essendon Bombers,-33.5,1.9,West Coast Eagles,33.5,1.9,1.053,TAB
Fremantle Dockers v Gold Coast Suns,2024-06-23T06:00:00.000Z,Line,Fremantle Dockers,-15.5,1.9,Gold Coast Suns,15.5,1.9,1.053,TAB
