match,start_time,market_name,home_team,home_win,away_team,away_win,margin,agency
Essendon Bombers v Sydney Swans,2024-08-16T19:40:00Z,Head To Head,Essendon Bombers,2.35,Sydney Swans,1.57,1.062,TopSport
Gold Coast Suns v Melbourne Demons,2024-08-17T13:45:00Z,Head To Head,Gold Coast Suns,1.38,Melbourne Demons,2.95,1.064,TopSport
GWS Giants v Fremantle Dockers,2024-08-17T13:45:00Z,Head To Head,GWS Giants,1.5,Fremantle Dockers,2.52,1.063,TopSport
Collingwood Magpies v Brisbane Lions,2024-08-17T16:35:00Z,Head To Head,Collingwood Magpies,2.36,Brisbane Lions,1.56,1.065,TopSport
Port Adelaide Power v Adelaide Crows,2024-08-17T19:30:00Z,Head To Head,Port Adelaide Power,1.43,Adelaide Crows,2.75,1.063,TopSport
St Kilda Saints v Geelong Cats,2024-08-17T19:30:00Z,Head To Head,St Kilda Saints,2.5,Geelong Cats,1.51,1.062,TopSport
Western Bulldogs v North Melbourne Kangaroos,2024-08-18T13:10:00Z,Head To Head,Western Bulldogs,1.08,North Melbourne Kangaroos,7.5,1.059,TopSport
Hawthorn Hawks v Richmond Tigers,2024-08-18T15:20:00Z,Head To Head,Hawthorn Hawks,1.08,Richmond Tigers,7.5,1.059,TopSport
West Coast Eagles v Carlton,2024-08-18T16:40:00Z,Head To Head,West Coast Eagles,1.88,Carlton,1.88,1.064,TopSport
