match,start_time,market_name,home_team,home_win,away_team,away_win,margin,agency
North Melbourne Kangaroos v Adelaide Crows,2024-04-27T13:46:00Z,Head To Head,North Melbourne Kangaroos,5,Adelaide Crows,1.18,1.047,TopSport
Geelong Cats v Carlton,2024-04-27T16:35:00Z,Head To Head,Geelong Cats,1.7,Carlton,2.15,1.053,TopSport
Fremantle Dockers v Western Bulldogs,2024-04-27T19:30:00Z,Head To Head,Fremantle Dockers,1.86,Western Bulldogs,1.94,1.053,TopSport
Gold Coast Suns v West Coast Eagles,2024-04-28T13:00:00Z,Head To Head,Gold Coast Suns,1.14,West Coast Eagles,5.75,1.051,TopSport
Hawthorn Hawks v Sydney Swans,2024-04-28T16:00:00Z,Head To Head,Hawthorn Hawks,3.15,Sydney Swans,1.35,1.058,TopSport
