match,start_time,market_name,home_team,home_win,away_team,away_win,margin,agency
Carlton v Geelong Cats,2024-06-21T19:40:00Z,Head To Head,Carlton,1.58,Geelong Cats,2.38,1.053,TopSport
Port Adelaide Power v Brisbane Lions,2024-06-22T13:45:00Z,Head To Head,Port Adelaide Power,1.87,Brisbane Lions,1.93,1.053,TopSport
GWS Giants v Sydney Swans,2024-06-22T16:35:00Z,Head To Head,GWS Giants,2.9,Sydney Swans,1.41,1.054,TopSport
Melbourne Demons v North Melbourne Kangaroos,2024-06-22T19:30:00Z,Head To Head,Melbourne Demons,1.19,North Melbourne Kangaroos,4.75,1.051,TopSport
Essendon Bombers v West Coast Eagles,2024-06-23T13:00:00Z,Head To Head,Essendon Bombers,1.14,West Coast Eagles,5.75,1.051,TopSport
Fremantle Dockers v Gold Coast Suns,2024-06-23T16:00:00Z,Head To Head,Fremantle Dockers,1.37,Gold Coast Suns,3.1,1.053,TopSport
