match,start_time,market_name,home_team,home_win,away_team,away_win,margin,agency
Hawthorn Hawks v GWS Giants,2024-06-08T13:45:00Z,Head To Head,Hawthorn Hawks,1.86,GWS Giants,1.96,1.048,TopSport
West Coast Eagles v North Melbourne Kangaroos,2024-06-08T16:35:00Z,Head To Head,West Coast Eagles,1.28,North Melbourne Kangaroos,3.7,1.052,TopSport
St Kilda Saints v Gold Coast Suns,2024-06-08T19:30:00Z,Head To Head,St Kilda Saints,1.77,Gold Coast Suns,2.05,1.053,TopSport
Sydney Swans v Geelong Cats,2024-06-09T15:20:00Z,Head To Head,Sydney Swans,1.3,Geelong Cats,3.55,1.051,TopSport
Essendon Bombers v Carlton,2024-06-09T19:20:00Z,Head To Head,Essendon Bombers,2.45,Carlton,1.55,1.053,TopSport
Collingwood Magpies v Melbourne Demons,2024-06-10T15:20:00Z,Head To Head,Collingwood Magpies,1.78,Melbourne Demons,2,1.062,TopSport
