match,start_time,market_name,home_team,home_win,away_team,away_win,margin,agency
Gold Coast Suns v Melbourne Demons,2024-08-17T13:45:00Z,Head To Head,Gold Coast Suns,1.39,Melbourne Demons,3,1.053,TopSport
GWS Giants v Fremantle Dockers,2024-08-17T13:45:00Z,Head To Head,GWS Giants,1.36,Fremantle Dockers,3.15,1.053,TopSport
Collingwood Magpies v Brisbane Lions,2024-08-17T16:35:00Z,Head To Head,Collingwood Magpies,2.4,Brisbane Lions,1.57,1.054,TopSport
Port Adelaide Power v Adelaide Crows,2024-08-17T19:30:00Z,Head To Head,Port Adelaide Power,1.45,Adelaide Crows,2.75,1.053,TopSport
St Kilda Saints v Geelong Cats,2024-08-17T19:30:00Z,Head To Head,St Kilda Saints,2.56,Geelong Cats,1.51,1.053,TopSport
Western Bulldogs v North Melbourne Kangaroos,2024-08-18T13:10:00Z,Head To Head,Western Bulldogs,1.09,North Melbourne Kangaroos,7.4,1.053,TopSport
Hawthorn Hawks v Richmond Tigers,2024-08-18T15:20:00Z,Head To Head,Hawthorn Hawks,1.07,Richmond Tigers,8.5,1.052,TopSport
West Coast Eagles v Carlton,2024-08-18T16:40:00Z,Head To Head,West Coast Eagles,1.8,Carlton,2,1.056,TopSport
