match,start_time,market_name,home_team,home_win,away_team,away_win,margin,agency
Port Adelaide Power v St Kilda Saints,2024-04-26T19:40:00Z,Head To Head,Port Adelaide Power,1.24,St Kilda Saints,4.05,1.053,TopSport
North Melbourne Kangaroos v Adelaide Crows,2024-04-27T13:45:00Z,Head To Head,North Melbourne Kangaroos,5,Adelaide Crows,1.17,1.055,TopSport
Geelong Cats v Carlton,2024-04-27T16:35:00Z,Head To Head,Geelong Cats,1.65,Carlton,2.22,1.057,TopSport
Fremantle Dockers v Western Bulldogs,2024-04-27T19:30:00Z,Head To Head,Fremantle Dockers,1.86,Western Bulldogs,1.94,1.053,TopSport
Gold Coast Suns v West Coast Eagles,2024-04-28T13:00:00Z,Head To Head,Gold Coast Suns,1.14,West Coast Eagles,5.75,1.051,TopSport
Hawthorn Hawks v Sydney Swans,2024-04-28T16:00:00Z,Head To Head,Hawthorn Hawks,3.05,Sydney Swans,1.38,1.053,TopSport
