match,start_time,market_name,home_team,home_win,away_team,away_win,margin,agency
Hawthorn Hawks v Fremantle Dockers,2024-07-13T13:45:00Z,Head To Head,Hawthorn Hawks,2.05,Fremantle Dockers,1.77,1.053,TopSport
Sydney Swans v North Melbourne Kangaroos,2024-07-13T13:45:00Z,Head To Head,Sydney Swans,1.07,North Melbourne Kangaroos,8.5,1.052,TopSport
Western Bulldogs v Carlton,2024-07-13T16:35:00Z,Head To Head,Western Bulldogs,2.8,Carlton,1.44,1.052,TopSport
Adelaide Crows v St Kilda Saints,2024-07-13T19:30:00Z,Head To Head,Adelaide Crows,1.53,St Kilda Saints,2.5,1.054,TopSport
Melbourne Demons v Essendon Bombers,2024-07-13T19:30:00Z,Head To Head,Melbourne Demons,2.55,Essendon Bombers,1.51,1.054,TopSport
Gold Coast Suns v Port Adelaide Power,2024-07-14T13:10:00Z,Head To Head,Gold Coast Suns,1.73,Port Adelaide Power,2.1,1.054,TopSport
Richmond Tigers v GWS Giants,2024-07-14T15:20:00Z,Head To Head,Richmond Tigers,4.17,GWS Giants,1.23,1.053,TopSport
West Coast Eagles v Brisbane Lions,2024-07-14T16:40:00Z,Head To Head,West Coast Eagles,4.55,Brisbane Lions,1.2,1.053,TopSport
