match,start_time,market_name,home_team,home_win,away_team,away_win,margin,agency
GWS Giants v St Kilda Saints,2024-04-13T13:45:00Z,Head To Head,GWS Giants,1.29,St Kilda Saints,3.6,1.053,TopSport
Carlton v Adelaide Crows,2024-04-13T16:35:00Z,Head To Head,Carlton,1.28,Adelaide Crows,3.7,1.052,TopSport
Gold Coast Suns v Hawthorn Hawks,2024-04-13T19:30:00Z,Head To Head,Gold Coast Suns,1.25,Hawthorn Hawks,4,1.05,TopSport
Port Adelaide Power v Fremantle Dockers,2024-04-13T19:30:00Z,Head To Head,Port Adelaide Power,1.31,Fremantle Dockers,3.5,1.049,TopSport
Geelong Cats v North Melbourne Kangaroos,2024-04-14T13:00:00Z,Head To Head,Geelong Cats,1.03,North Melbourne Kangaroos,12,1.054,TopSport
West Coast Eagles v Richmond Tigers,2024-04-14T16:00:00Z,Head To Head,West Coast Eagles,2.7,Richmond Tigers,1.47,1.051,TopSport
