match,start_time,market_name,home_team,home_win,away_team,away_win,margin,agency
North Melbourne Kangaroos v Geelong Cats,2024-07-27T13:45:00Z,Head To Head,North Melbourne Kangaroos,3.9,Geelong Cats,1.26,1.05,TopSport
Gold Coast Suns v Brisbane Lions,2024-07-27T16:35:00Z,Head To Head,Gold Coast Suns,2.12,Brisbane Lions,1.74,1.046,TopSport
St Kilda Saints v Essendon Bombers,2024-07-27T16:35:00Z,Head To Head,St Kilda Saints,2.2,Essendon Bombers,1.67,1.053,TopSport
Melbourne Demons v GWS Giants,2024-07-27T19:30:00Z,Head To Head,Melbourne Demons,1.85,GWS Giants,1.95,1.053,TopSport
Fremantle Dockers v West Coast Eagles,2024-07-27T20:10:00Z,Head To Head,Fremantle Dockers,1.11,West Coast Eagles,6.5,1.055,TopSport
Collingwood Magpies v Richmond Tigers,2024-07-28T13:10:00Z,Head To Head,Collingwood Magpies,1.24,Richmond Tigers,4.05,1.053,TopSport
Sydney Swans v Western Bulldogs,2024-07-28T15:20:00Z,Head To Head,Sydney Swans,1.51,Western Bulldogs,2.55,1.054,TopSport
Adelaide Crows v Hawthorn Hawks,2024-07-28T16:10:00Z,Head To Head,Adelaide Crows,2.02,Hawthorn Hawks,1.8,1.051,TopSport
