match,start_time,market_name,home_team,home_win,away_team,away_win,margin,agency
Adelaide Crows v Port Adelaide Power,2024-05-02T19:30:00Z,Head To Head,Adelaide Crows,2.2,Port Adelaide Power,1.67,1.053,TopSport
Carlton v Collingwood Magpies,2024-05-03T19:40:00Z,Head To Head,Carlton,1.57,Collingwood Magpies,2.4,1.054,TopSport
Sydney Swans v GWS Giants,2024-05-04T13:45:00Z,Head To Head,Sydney Swans,1.8,GWS Giants,2,1.056,TopSport
St Kilda Saints v North Melbourne Kangaroos,2024-05-04T16:35:00Z,Head To Head,St Kilda Saints,1.13,North Melbourne Kangaroos,6,1.052,TopSport
Melbourne Demons v Geelong Cats,2024-05-04T19:30:00Z,Head To Head,Melbourne Demons,2,Geelong Cats,1.8,1.056,TopSport
West Coast Eagles v Essendon Bombers,2024-05-04T20:10:00Z,Head To Head,West Coast Eagles,2.6,Essendon Bombers,1.5,1.051,TopSport
Richmond Tigers v Fremantle Dockers,2024-05-05T13:00:00Z,Head To Head,Richmond Tigers,2.52,Fremantle Dockers,1.49,1.068,TopSport
Western Bulldogs v Hawthorn Hawks,2024-05-05T16:00:00Z,Head To Head,Western Bulldogs,1.28,Hawthorn Hawks,3.5,1.067,TopSport
Brisbane Lions v Gold Coast Suns,2024-05-05T19:10:00Z,Head To Head,Brisbane Lions,1.48,Gold Coast Suns,2.55,1.068,TopSport
