match,start_time,market_name,home_team,home_win,away_team,away_win,margin,agency
Adelaide Crows v Geelong Cats,2024-03-22T19:40:00Z,Head To Head,Adelaide Crows,1.5,Geelong Cats,2.6,1.051,TopSport
North Melbourne Kangaroos v Fremantle Dockers,2024-03-23T13:45:00Z,Head To Head,North Melbourne Kangaroos,3.1,Fremantle Dockers,1.37,1.053,TopSport
Hawthorn Hawks v Melbourne Demons,2024-03-23T16:35:00Z,Head To Head,Hawthorn Hawks,4,Melbourne Demons,1.24,1.056,TopSport
Sydney Swans v Essendon Bombers,2024-03-23T19:30:00Z,Head To Head,Sydney Swans,1.15,Essendon Bombers,5.5,1.051,TopSport
Western Bulldogs v Gold Coast Suns,2024-03-24T13:00:00Z,Head To Head,Western Bulldogs,1.62,Gold Coast Suns,2.3,1.052,TopSport
Richmond Tigers v Port Adelaide Power,2024-03-24T16:00:00Z,Head To Head,Richmond Tigers,3,Port Adelaide Power,1.39,1.053,TopSport
West Coast Eagles v GWS Giants,2024-03-24T18:50:00Z,Head To Head,West Coast Eagles,9.5,GWS Giants,1.06,1.049,TopSport
